{
  "address": "0x99FF1d1A51Ff29590FDe37aDE46B122e1a19A8Ce",
  "abi": [
    {
      "inputs": [
        {
          "internalType": "contract IController",
          "name": "_controller",
          "type": "address"
        }
      ],
      "stateMutability": "nonpayable",
      "type": "constructor"
    },
    {
      "inputs": [
        {
          "internalType": "address",
          "name": "target",
          "type": "address"
        }
      ],
      "name": "AddressEmptyCode",
      "type": "error"
    },
    {
      "inputs": [
        {
          "internalType": "address",
          "name": "account",
          "type": "address"
        }
      ],
      "name": "AddressInsufficientBalance",
      "type": "error"
    },
    {
      "inputs": [],
      "name": "FailedInnerCall",
      "type": "error"
    },
    {
      "inputs": [],
      "name": "ReentrancyGuardReentrantCall",
      "type": "error"
    },
    {
      "inputs": [
        {
          "internalType": "address",
          "name": "token",
          "type": "address"
        }
      ],
      "name": "SafeERC20FailedOperation",
      "type": "error"
    },
    {
      "anonymous": false,
      "inputs": [
        {
          "indexed": true,
          "internalType": "contract ISetToken",
          "name": "setToken",
          "type": "address"
        },
        {
          "indexed": false,
          "internalType": "bool",
          "name": "isAnyoneAllowedToBid",
          "type": "bool"
        }
      ],
      "name": "AnyoneBidUpdated",
      "type": "event"
    },
    {
      "anonymous": false,
      "inputs": [
        {
          "indexed": true,
          "internalType": "contract ISetToken",
          "name": "setToken",
          "type": "address"
        },
        {
          "indexed": false,
          "internalType": "uint256",
          "name": "newPositionMultiplier",
          "type": "uint256"
        }
      ],
      "name": "AssetTargetsRaised",
      "type": "event"
    },
    {
      "anonymous": false,
      "inputs": [
        {
          "indexed": true,
          "internalType": "contract ISetToken",
          "name": "setToken",
          "type": "address"
        },
        {
          "indexed": true,
          "internalType": "address",
          "name": "sendToken",
          "type": "address"
        },
        {
          "indexed": true,
          "internalType": "address",
          "name": "receiveToken",
          "type": "address"
        },
        {
          "indexed": false,
          "internalType": "address",
          "name": "bidder",
          "type": "address"
        },
        {
          "indexed": false,
          "internalType": "contract IAuctionPriceAdapterV1",
          "name": "priceAdapter",
          "type": "address"
        },
        {
          "indexed": false,
          "internalType": "bool",
          "name": "isSellAuction",
          "type": "bool"
        },
        {
          "indexed": false,
          "internalType": "uint256",
          "name": "price",
          "type": "uint256"
        },
        {
          "indexed": false,
          "internalType": "uint256",
          "name": "netQuantitySentBySet",
          "type": "uint256"
        },
        {
          "indexed": false,
          "internalType": "uint256",
          "name": "netQuantityReceivedBySet",
          "type": "uint256"
        },
        {
          "indexed": false,
          "internalType": "uint256",
          "name": "protocolFee",
          "type": "uint256"
        },
        {
          "indexed": false,
          "internalType": "uint256",
          "name": "setTotalSupply",
          "type": "uint256"
        }
      ],
      "name": "BidExecuted",
      "type": "event"
    },
    {
      "anonymous": false,
      "inputs": [
        {
          "indexed": true,
          "internalType": "contract ISetToken",
          "name": "setToken",
          "type": "address"
        },
        {
          "indexed": true,
          "internalType": "address",
          "name": "bidder",
          "type": "address"
        },
        {
          "indexed": false,
          "internalType": "bool",
          "name": "isBidderAllowed",
          "type": "bool"
        }
      ],
      "name": "BidderStatusUpdated",
      "type": "event"
    },
    {
      "anonymous": false,
      "inputs": [
        {
          "indexed": true,
          "internalType": "contract ISetToken",
          "name": "setToken",
          "type": "address"
        }
      ],
      "name": "LockedRebalanceEndedEarly",
      "type": "event"
    },
    {
      "anonymous": false,
      "inputs": [
        {
          "indexed": true,
          "internalType": "contract ISetToken",
          "name": "setToken",
          "type": "address"
        },
        {
          "indexed": false,
          "internalType": "uint256",
          "name": "newRaiseTargetPercentage",
          "type": "uint256"
        }
      ],
      "name": "RaiseTargetPercentageUpdated",
      "type": "event"
    },
    {
      "anonymous": false,
      "inputs": [
        {
          "indexed": true,
          "internalType": "contract ISetToken",
          "name": "setToken",
          "type": "address"
        },
        {
          "indexed": true,
          "internalType": "contract IERC20",
          "name": "quoteAsset",
          "type": "address"
        },
        {
          "indexed": false,
          "internalType": "bool",
          "name": "isSetTokenLocked",
          "type": "bool"
        },
        {
          "indexed": false,
          "internalType": "uint256",
          "name": "rebalanceDuration",
          "type": "uint256"
        },
        {
          "indexed": false,
          "internalType": "uint256",
          "name": "initialPositionMultiplier",
          "type": "uint256"
        },
        {
          "indexed": false,
          "internalType": "address[]",
          "name": "componentsInvolved",
          "type": "address[]"
        },
        {
          "components": [
            {
              "internalType": "uint256",
              "name": "targetUnit",
              "type": "uint256"
            },
            {
              "internalType": "string",
              "name": "priceAdapterName",
              "type": "string"
            },
            {
              "internalType": "bytes",
              "name": "priceAdapterConfigData",
              "type": "bytes"
            }
          ],
          "indexed": false,
          "internalType": "struct AuctionRebalanceModuleV1.AuctionExecutionParams[]",
          "name": "auctionParameters",
          "type": "tuple[]"
        }
      ],
      "name": "RebalanceStarted",
      "type": "event"
    },
    {
      "inputs": [
        {
          "internalType": "contract ISetToken",
          "name": "_setToken",
          "type": "address"
        }
      ],
      "name": "allTargetsMet",
      "outputs": [
        {
          "internalType": "bool",
          "name": "",
          "type": "bool"
        }
      ],
      "stateMutability": "view",
      "type": "function"
    },
    {
      "inputs": [
        {
          "internalType": "contract ISetToken",
          "name": "_setToken",
          "type": "address"
        },
        {
          "internalType": "contract IERC20",
          "name": "_component",
          "type": "address"
        },
        {
          "internalType": "contract IERC20",
          "name": "_quoteAsset",
          "type": "address"
        },
        {
          "internalType": "uint256",
          "name": "_componentAmount",
          "type": "uint256"
        },
        {
          "internalType": "uint256",
          "name": "_quoteAssetLimit",
          "type": "uint256"
        },
        {
          "internalType": "bool",
          "name": "_isSellAuction",
          "type": "bool"
        }
      ],
      "name": "bid",
      "outputs": [],
      "stateMutability": "nonpayable",
      "type": "function"
    },
    {
      "inputs": [
        {
          "internalType": "contract ISetToken",
          "name": "_setToken",
          "type": "address"
        }
      ],
      "name": "canRaiseAssetTargets",
      "outputs": [
        {
          "internalType": "bool",
          "name": "",
          "type": "bool"
        }
      ],
      "stateMutability": "view",
      "type": "function"
    },
    {
      "inputs": [
        {
          "internalType": "contract ISetToken",
          "name": "_setToken",
          "type": "address"
        }
      ],
      "name": "canUnlockEarly",
      "outputs": [
        {
          "internalType": "bool",
          "name": "",
          "type": "bool"
        }
      ],
      "stateMutability": "view",
      "type": "function"
    },
    {
      "inputs": [],
      "name": "controller",
      "outputs": [
        {
          "internalType": "contract IController",
          "name": "",
          "type": "address"
        }
      ],
      "stateMutability": "view",
      "type": "function"
    },
    {
      "inputs": [
        {
          "internalType": "contract ISetToken",
          "name": "",
          "type": "address"
        },
        {
          "internalType": "contract IERC20",
          "name": "",
          "type": "address"
        }
      ],
      "name": "executionInfo",
      "outputs": [
        {
          "internalType": "uint256",
          "name": "targetUnit",
          "type": "uint256"
        },
        {
          "internalType": "string",
          "name": "priceAdapterName",
          "type": "string"
        },
        {
          "internalType": "bytes",
          "name": "priceAdapterConfigData",
          "type": "bytes"
        }
      ],
      "stateMutability": "view",
      "type": "function"
    },
    {
      "inputs": [
        {
          "internalType": "contract ISetToken",
          "name": "_setToken",
          "type": "address"
        }
      ],
      "name": "getAllowedBidders",
      "outputs": [
        {
          "internalType": "address[]",
          "name": "",
          "type": "address[]"
        }
      ],
      "stateMutability": "view",
      "type": "function"
    },
    {
      "inputs": [
        {
          "internalType": "contract ISetToken",
          "name": "_setToken",
          "type": "address"
        },
        {
          "internalType": "contract IERC20",
          "name": "_component",
          "type": "address"
        }
      ],
      "name": "getAuctionSizeAndDirection",
      "outputs": [
        {
          "internalType": "bool",
          "name": "isSellAuction",
          "type": "bool"
        },
        {
          "internalType": "uint256",
          "name": "componentQuantity",
          "type": "uint256"
        }
      ],
      "stateMutability": "view",
      "type": "function"
    },
    {
      "inputs": [
        {
          "internalType": "contract ISetToken",
          "name": "_setToken",
          "type": "address"
        },
        {
          "internalType": "contract IERC20",
          "name": "_component",
          "type": "address"
        },
        {
          "internalType": "contract IERC20",
          "name": "_quoteAsset",
          "type": "address"
        },
        {
          "internalType": "uint256",
          "name": "_componentQuantity",
          "type": "uint256"
        },
        {
          "internalType": "uint256",
          "name": "_quoteQuantityLimit",
          "type": "uint256"
        },
        {
          "internalType": "bool",
          "name": "_isSellAuction",
          "type": "bool"
        }
      ],
      "name": "getBidPreview",
      "outputs": [
        {
          "components": [
            {
              "internalType": "contract ISetToken",
              "name": "setToken",
              "type": "address"
            },
            {
              "internalType": "contract IERC20",
              "name": "sendToken",
              "type": "address"
            },
            {
              "internalType": "contract IERC20",
              "name": "receiveToken",
              "type": "address"
            },
            {
              "internalType": "contract IAuctionPriceAdapterV1",
              "name": "priceAdapter",
              "type": "address"
            },
            {
              "internalType": "bytes",
              "name": "priceAdapterConfigData",
              "type": "bytes"
            },
            {
              "internalType": "bool",
              "name": "isSellAuction",
              "type": "bool"
            },
            {
              "internalType": "uint256",
              "name": "auctionQuantity",
              "type": "uint256"
            },
            {
              "internalType": "uint256",
              "name": "componentPrice",
              "type": "uint256"
            },
            {
              "internalType": "uint256",
              "name": "quantitySentBySet",
              "type": "uint256"
            },
            {
              "internalType": "uint256",
              "name": "quantityReceivedBySet",
              "type": "uint256"
            },
            {
              "internalType": "uint256",
              "name": "preBidTokenSentBalance",
              "type": "uint256"
            },
            {
              "internalType": "uint256",
              "name": "preBidTokenReceivedBalance",
              "type": "uint256"
            },
            {
              "internalType": "uint256",
              "name": "setTotalSupply",
              "type": "uint256"
            }
          ],
          "internalType": "struct AuctionRebalanceModuleV1.BidInfo",
          "name": "",
          "type": "tuple"
        }
      ],
      "stateMutability": "view",
      "type": "function"
    },
    {
      "inputs": [
        {
          "internalType": "contract ISetToken",
          "name": "_setToken",
          "type": "address"
        }
      ],
      "name": "getQuoteAssetBalance",
      "outputs": [
        {
          "internalType": "uint256",
          "name": "",
          "type": "uint256"
        }
      ],
      "stateMutability": "view",
      "type": "function"
    },
    {
      "inputs": [
        {
          "internalType": "contract ISetToken",
          "name": "_setToken",
          "type": "address"
        }
      ],
      "name": "getRebalanceComponents",
      "outputs": [
        {
          "internalType": "address[]",
          "name": "",
          "type": "address[]"
        }
      ],
      "stateMutability": "view",
      "type": "function"
    },
    {
      "inputs": [
        {
          "internalType": "contract ISetToken",
          "name": "_setToken",
          "type": "address"
        }
      ],
      "name": "initialize",
      "outputs": [],
      "stateMutability": "nonpayable",
      "type": "function"
    },
    {
      "inputs": [
        {
          "internalType": "contract ISetToken",
          "name": "_setToken",
          "type": "address"
        },
        {
          "internalType": "address",
          "name": "_bidder",
          "type": "address"
        }
      ],
      "name": "isAllowedBidder",
      "outputs": [
        {
          "internalType": "bool",
          "name": "",
          "type": "bool"
        }
      ],
      "stateMutability": "view",
      "type": "function"
    },
    {
      "inputs": [
        {
          "internalType": "contract ISetToken",
          "name": "_setToken",
          "type": "address"
        }
      ],
      "name": "isQuoteAssetExcessOrAtTarget",
      "outputs": [
        {
          "internalType": "bool",
          "name": "",
          "type": "bool"
        }
      ],
      "stateMutability": "view",
      "type": "function"
    },
    {
      "inputs": [
        {
          "internalType": "contract ISetToken",
          "name": "_setToken",
          "type": "address"
        }
      ],
      "name": "isRebalanceDurationElapsed",
      "outputs": [
        {
          "internalType": "bool",
          "name": "",
          "type": "bool"
        }
      ],
      "stateMutability": "view",
      "type": "function"
    },
    {
      "inputs": [
        {
          "internalType": "contract ISetToken",
          "name": "",
          "type": "address"
        }
      ],
      "name": "permissionInfo",
      "outputs": [
        {
          "internalType": "bool",
          "name": "isAnyoneAllowedToBid",
          "type": "bool"
        }
      ],
      "stateMutability": "view",
      "type": "function"
    },
    {
      "inputs": [
        {
          "internalType": "contract ISetToken",
          "name": "_setToken",
          "type": "address"
        }
      ],
      "name": "raiseAssetTargets",
      "outputs": [],
      "stateMutability": "nonpayable",
      "type": "function"
    },
    {
      "inputs": [
        {
          "internalType": "contract ISetToken",
          "name": "",
          "type": "address"
        }
      ],
      "name": "rebalanceInfo",
      "outputs": [
        {
          "internalType": "contract IERC20",
          "name": "quoteAsset",
          "type": "address"
        },
        {
          "internalType": "uint256",
          "name": "rebalanceStartTime",
          "type": "uint256"
        },
        {
          "internalType": "uint256",
          "name": "rebalanceDuration",
          "type": "uint256"
        },
        {
          "internalType": "uint256",
          "name": "positionMultiplier",
          "type": "uint256"
        },
        {
          "internalType": "uint256",
          "name": "raiseTargetPercentage",
          "type": "uint256"
        }
      ],
      "stateMutability": "view",
      "type": "function"
    },
    {
      "inputs": [],
      "name": "removeModule",
      "outputs": [],
      "stateMutability": "nonpayable",
      "type": "function"
    },
    {
      "inputs": [
        {
          "internalType": "contract ISetToken",
          "name": "_setToken",
          "type": "address"
        },
        {
          "internalType": "bool",
          "name": "_status",
          "type": "bool"
        }
      ],
      "name": "setAnyoneBid",
      "outputs": [],
      "stateMutability": "nonpayable",
      "type": "function"
    },
    {
      "inputs": [
        {
          "internalType": "contract ISetToken",
          "name": "_setToken",
          "type": "address"
        },
        {
          "internalType": "address[]",
          "name": "_bidders",
          "type": "address[]"
        },
        {
          "internalType": "bool[]",
          "name": "_statuses",
          "type": "bool[]"
        }
      ],
      "name": "setBidderStatus",
      "outputs": [],
      "stateMutability": "nonpayable",
      "type": "function"
    },
    {
      "inputs": [
        {
          "internalType": "contract ISetToken",
          "name": "_setToken",
          "type": "address"
        },
        {
          "internalType": "uint256",
          "name": "_raiseTargetPercentage",
          "type": "uint256"
        }
      ],
      "name": "setRaiseTargetPercentage",
      "outputs": [],
      "stateMutability": "nonpayable",
      "type": "function"
    },
    {
      "inputs": [
        {
          "internalType": "contract ISetToken",
          "name": "_setToken",
          "type": "address"
        },
        {
          "internalType": "contract IERC20",
          "name": "_quoteAsset",
          "type": "address"
        },
        {
          "internalType": "address[]",
          "name": "_newComponents",
          "type": "address[]"
        },
        {
          "components": [
            {
              "internalType": "uint256",
              "name": "targetUnit",
              "type": "uint256"
            },
            {
              "internalType": "string",
              "name": "priceAdapterName",
              "type": "string"
            },
            {
              "internalType": "bytes",
              "name": "priceAdapterConfigData",
              "type": "bytes"
            }
          ],
          "internalType": "struct AuctionRebalanceModuleV1.AuctionExecutionParams[]",
          "name": "_newComponentsAuctionParams",
          "type": "tuple[]"
        },
        {
          "components": [
            {
              "internalType": "uint256",
              "name": "targetUnit",
              "type": "uint256"
            },
            {
              "internalType": "string",
              "name": "priceAdapterName",
              "type": "string"
            },
            {
              "internalType": "bytes",
              "name": "priceAdapterConfigData",
              "type": "bytes"
            }
          ],
          "internalType": "struct AuctionRebalanceModuleV1.AuctionExecutionParams[]",
          "name": "_oldComponentsAuctionParams",
          "type": "tuple[]"
        },
        {
          "internalType": "bool",
          "name": "_shouldLockSetToken",
          "type": "bool"
        },
        {
          "internalType": "uint256",
          "name": "_rebalanceDuration",
          "type": "uint256"
        },
        {
          "internalType": "uint256",
          "name": "_initialPositionMultiplier",
          "type": "uint256"
        }
      ],
      "name": "startRebalance",
      "outputs": [],
      "stateMutability": "nonpayable",
      "type": "function"
    },
    {
      "inputs": [
        {
          "internalType": "contract ISetToken",
          "name": "_setToken",
          "type": "address"
        }
      ],
      "name": "unlock",
      "outputs": [],
      "stateMutability": "nonpayable",
      "type": "function"
    }
  ],
  "transactionHash": "0x3f6bc71505365f6cc79a32ecc6e883d77b22eef6073e0b731c0257536765eeaa",
  "receipt": {
    "to": null,
    "from": "0x570f581D23a2AB09FD1990279D9DB6f5DcE18F4A",
    "contractAddress": "0x99FF1d1A51Ff29590FDe37aDE46B122e1a19A8Ce",
    "transactionIndex": 2,
    "gasUsed": "4507993",
    "logsBloom": "0x00000000000000000000000000000000000000000000000000000000000000000000000000000000000000000000000000000000000000000000000000000000000000000000000000000000000000000000000000000000000000000000000000000000000000000000000000000000000000000000000000000000000000000000000000000000000000000000000000000000000000000000000000000000000000000000000000000000000000000000000000000000000000000000000000000000000000000000000000000000000000000000000000000000000000000000000000000000000000000000000000000000000000000000000000000000",
    "blockHash": "0x277969417c01c84e27b665e68b560a1c699d4179e265e4e9b4ef79904eab4b33",
    "transactionHash": "0x3f6bc71505365f6cc79a32ecc6e883d77b22eef6073e0b731c0257536765eeaa",
    "logs": [],
    "blockNumber": 10237823,
    "cumulativeGasUsed": "4639012",
    "status": 1,
    "byzantium": true
  },
  "args": [
    "0x9409Ac28260E60e26f5475526cb9F7315edddd17"
  ],
  "numDeployments": 1,
  "solcInputHash": "7fe3b69caaa6e1ae3cb624acb9fde77a",
  "metadata": "{\"compiler\":{\"version\":\"0.8.25+commit.b61c2a91\"},\"language\":\"Solidity\",\"output\":{\"abi\":[{\"inputs\":[{\"internalType\":\"contract IController\",\"name\":\"_controller\",\"type\":\"address\"}],\"stateMutability\":\"nonpayable\",\"type\":\"constructor\"},{\"inputs\":[{\"internalType\":\"address\",\"name\":\"target\",\"type\":\"address\"}],\"name\":\"AddressEmptyCode\",\"type\":\"error\"},{\"inputs\":[{\"internalType\":\"address\",\"name\":\"account\",\"type\":\"address\"}],\"name\":\"AddressInsufficientBalance\",\"type\":\"error\"},{\"inputs\":[],\"name\":\"FailedInnerCall\",\"type\":\"error\"},{\"inputs\":[],\"name\":\"ReentrancyGuardReentrantCall\",\"type\":\"error\"},{\"inputs\":[{\"internalType\":\"address\",\"name\":\"token\",\"type\":\"address\"}],\"name\":\"SafeERC20FailedOperation\",\"type\":\"error\"},{\"anonymous\":false,\"inputs\":[{\"indexed\":true,\"internalType\":\"contract ISetToken\",\"name\":\"setToken\",\"type\":\"address\"},{\"indexed\":false,\"internalType\":\"bool\",\"name\":\"isAnyoneAllowedToBid\",\"type\":\"bool\"}],\"name\":\"AnyoneBidUpdated\",\"type\":\"event\"},{\"anonymous\":false,\"inputs\":[{\"indexed\":true,\"internalType\":\"contract ISetToken\",\"name\":\"setToken\",\"type\":\"address\"},{\"indexed\":false,\"internalType\":\"uint256\",\"name\":\"newPositionMultiplier\",\"type\":\"uint256\"}],\"name\":\"AssetTargetsRaised\",\"type\":\"event\"},{\"anonymous\":false,\"inputs\":[{\"indexed\":true,\"internalType\":\"contract ISetToken\",\"name\":\"setToken\",\"type\":\"address\"},{\"indexed\":true,\"internalType\":\"address\",\"name\":\"sendToken\",\"type\":\"address\"},{\"indexed\":true,\"internalType\":\"address\",\"name\":\"receiveToken\",\"type\":\"address\"},{\"indexed\":false,\"internalType\":\"address\",\"name\":\"bidder\",\"type\":\"address\"},{\"indexed\":false,\"internalType\":\"contract IAuctionPriceAdapterV1\",\"name\":\"priceAdapter\",\"type\":\"address\"},{\"indexed\":false,\"internalType\":\"bool\",\"name\":\"isSellAuction\",\"type\":\"bool\"},{\"indexed\":false,\"internalType\":\"uint256\",\"name\":\"price\",\"type\":\"uint256\"},{\"indexed\":false,\"internalType\":\"uint256\",\"name\":\"netQuantitySentBySet\",\"type\":\"uint256\"},{\"indexed\":false,\"internalType\":\"uint256\",\"name\":\"netQuantityReceivedBySet\",\"type\":\"uint256\"},{\"indexed\":false,\"internalType\":\"uint256\",\"name\":\"protocolFee\",\"type\":\"uint256\"},{\"indexed\":false,\"internalType\":\"uint256\",\"name\":\"setTotalSupply\",\"type\":\"uint256\"}],\"name\":\"BidExecuted\",\"type\":\"event\"},{\"anonymous\":false,\"inputs\":[{\"indexed\":true,\"internalType\":\"contract ISetToken\",\"name\":\"setToken\",\"type\":\"address\"},{\"indexed\":true,\"internalType\":\"address\",\"name\":\"bidder\",\"type\":\"address\"},{\"indexed\":false,\"internalType\":\"bool\",\"name\":\"isBidderAllowed\",\"type\":\"bool\"}],\"name\":\"BidderStatusUpdated\",\"type\":\"event\"},{\"anonymous\":false,\"inputs\":[{\"indexed\":true,\"internalType\":\"contract ISetToken\",\"name\":\"setToken\",\"type\":\"address\"}],\"name\":\"LockedRebalanceEndedEarly\",\"type\":\"event\"},{\"anonymous\":false,\"inputs\":[{\"indexed\":true,\"internalType\":\"contract ISetToken\",\"name\":\"setToken\",\"type\":\"address\"},{\"indexed\":false,\"internalType\":\"uint256\",\"name\":\"newRaiseTargetPercentage\",\"type\":\"uint256\"}],\"name\":\"RaiseTargetPercentageUpdated\",\"type\":\"event\"},{\"anonymous\":false,\"inputs\":[{\"indexed\":true,\"internalType\":\"contract ISetToken\",\"name\":\"setToken\",\"type\":\"address\"},{\"indexed\":true,\"internalType\":\"contract IERC20\",\"name\":\"quoteAsset\",\"type\":\"address\"},{\"indexed\":false,\"internalType\":\"bool\",\"name\":\"isSetTokenLocked\",\"type\":\"bool\"},{\"indexed\":false,\"internalType\":\"uint256\",\"name\":\"rebalanceDuration\",\"type\":\"uint256\"},{\"indexed\":false,\"internalType\":\"uint256\",\"name\":\"initialPositionMultiplier\",\"type\":\"uint256\"},{\"indexed\":false,\"internalType\":\"address[]\",\"name\":\"componentsInvolved\",\"type\":\"address[]\"},{\"components\":[{\"internalType\":\"uint256\",\"name\":\"targetUnit\",\"type\":\"uint256\"},{\"internalType\":\"string\",\"name\":\"priceAdapterName\",\"type\":\"string\"},{\"internalType\":\"bytes\",\"name\":\"priceAdapterConfigData\",\"type\":\"bytes\"}],\"indexed\":false,\"internalType\":\"struct AuctionRebalanceModuleV1.AuctionExecutionParams[]\",\"name\":\"auctionParameters\",\"type\":\"tuple[]\"}],\"name\":\"RebalanceStarted\",\"type\":\"event\"},{\"inputs\":[{\"internalType\":\"contract ISetToken\",\"name\":\"_setToken\",\"type\":\"address\"}],\"name\":\"allTargetsMet\",\"outputs\":[{\"internalType\":\"bool\",\"name\":\"\",\"type\":\"bool\"}],\"stateMutability\":\"view\",\"type\":\"function\"},{\"inputs\":[{\"internalType\":\"contract ISetToken\",\"name\":\"_setToken\",\"type\":\"address\"},{\"internalType\":\"contract IERC20\",\"name\":\"_component\",\"type\":\"address\"},{\"internalType\":\"contract IERC20\",\"name\":\"_quoteAsset\",\"type\":\"address\"},{\"internalType\":\"uint256\",\"name\":\"_componentAmount\",\"type\":\"uint256\"},{\"internalType\":\"uint256\",\"name\":\"_quoteAssetLimit\",\"type\":\"uint256\"},{\"internalType\":\"bool\",\"name\":\"_isSellAuction\",\"type\":\"bool\"}],\"name\":\"bid\",\"outputs\":[],\"stateMutability\":\"nonpayable\",\"type\":\"function\"},{\"inputs\":[{\"internalType\":\"contract ISetToken\",\"name\":\"_setToken\",\"type\":\"address\"}],\"name\":\"canRaiseAssetTargets\",\"outputs\":[{\"internalType\":\"bool\",\"name\":\"\",\"type\":\"bool\"}],\"stateMutability\":\"view\",\"type\":\"function\"},{\"inputs\":[{\"internalType\":\"contract ISetToken\",\"name\":\"_setToken\",\"type\":\"address\"}],\"name\":\"canUnlockEarly\",\"outputs\":[{\"internalType\":\"bool\",\"name\":\"\",\"type\":\"bool\"}],\"stateMutability\":\"view\",\"type\":\"function\"},{\"inputs\":[],\"name\":\"controller\",\"outputs\":[{\"internalType\":\"contract IController\",\"name\":\"\",\"type\":\"address\"}],\"stateMutability\":\"view\",\"type\":\"function\"},{\"inputs\":[{\"internalType\":\"contract ISetToken\",\"name\":\"\",\"type\":\"address\"},{\"internalType\":\"contract IERC20\",\"name\":\"\",\"type\":\"address\"}],\"name\":\"executionInfo\",\"outputs\":[{\"internalType\":\"uint256\",\"name\":\"targetUnit\",\"type\":\"uint256\"},{\"internalType\":\"string\",\"name\":\"priceAdapterName\",\"type\":\"string\"},{\"internalType\":\"bytes\",\"name\":\"priceAdapterConfigData\",\"type\":\"bytes\"}],\"stateMutability\":\"view\",\"type\":\"function\"},{\"inputs\":[{\"internalType\":\"contract ISetToken\",\"name\":\"_setToken\",\"type\":\"address\"}],\"name\":\"getAllowedBidders\",\"outputs\":[{\"internalType\":\"address[]\",\"name\":\"\",\"type\":\"address[]\"}],\"stateMutability\":\"view\",\"type\":\"function\"},{\"inputs\":[{\"internalType\":\"contract ISetToken\",\"name\":\"_setToken\",\"type\":\"address\"},{\"internalType\":\"contract IERC20\",\"name\":\"_component\",\"type\":\"address\"}],\"name\":\"getAuctionSizeAndDirection\",\"outputs\":[{\"internalType\":\"bool\",\"name\":\"isSellAuction\",\"type\":\"bool\"},{\"internalType\":\"uint256\",\"name\":\"componentQuantity\",\"type\":\"uint256\"}],\"stateMutability\":\"view\",\"type\":\"function\"},{\"inputs\":[{\"internalType\":\"contract ISetToken\",\"name\":\"_setToken\",\"type\":\"address\"},{\"internalType\":\"contract IERC20\",\"name\":\"_component\",\"type\":\"address\"},{\"internalType\":\"contract IERC20\",\"name\":\"_quoteAsset\",\"type\":\"address\"},{\"internalType\":\"uint256\",\"name\":\"_componentQuantity\",\"type\":\"uint256\"},{\"internalType\":\"uint256\",\"name\":\"_quoteQuantityLimit\",\"type\":\"uint256\"},{\"internalType\":\"bool\",\"name\":\"_isSellAuction\",\"type\":\"bool\"}],\"name\":\"getBidPreview\",\"outputs\":[{\"components\":[{\"internalType\":\"contract ISetToken\",\"name\":\"setToken\",\"type\":\"address\"},{\"internalType\":\"contract IERC20\",\"name\":\"sendToken\",\"type\":\"address\"},{\"internalType\":\"contract IERC20\",\"name\":\"receiveToken\",\"type\":\"address\"},{\"internalType\":\"contract IAuctionPriceAdapterV1\",\"name\":\"priceAdapter\",\"type\":\"address\"},{\"internalType\":\"bytes\",\"name\":\"priceAdapterConfigData\",\"type\":\"bytes\"},{\"internalType\":\"bool\",\"name\":\"isSellAuction\",\"type\":\"bool\"},{\"internalType\":\"uint256\",\"name\":\"auctionQuantity\",\"type\":\"uint256\"},{\"internalType\":\"uint256\",\"name\":\"componentPrice\",\"type\":\"uint256\"},{\"internalType\":\"uint256\",\"name\":\"quantitySentBySet\",\"type\":\"uint256\"},{\"internalType\":\"uint256\",\"name\":\"quantityReceivedBySet\",\"type\":\"uint256\"},{\"internalType\":\"uint256\",\"name\":\"preBidTokenSentBalance\",\"type\":\"uint256\"},{\"internalType\":\"uint256\",\"name\":\"preBidTokenReceivedBalance\",\"type\":\"uint256\"},{\"internalType\":\"uint256\",\"name\":\"setTotalSupply\",\"type\":\"uint256\"}],\"internalType\":\"struct AuctionRebalanceModuleV1.BidInfo\",\"name\":\"\",\"type\":\"tuple\"}],\"stateMutability\":\"view\",\"type\":\"function\"},{\"inputs\":[{\"internalType\":\"contract ISetToken\",\"name\":\"_setToken\",\"type\":\"address\"}],\"name\":\"getQuoteAssetBalance\",\"outputs\":[{\"internalType\":\"uint256\",\"name\":\"\",\"type\":\"uint256\"}],\"stateMutability\":\"view\",\"type\":\"function\"},{\"inputs\":[{\"internalType\":\"contract ISetToken\",\"name\":\"_setToken\",\"type\":\"address\"}],\"name\":\"getRebalanceComponents\",\"outputs\":[{\"internalType\":\"address[]\",\"name\":\"\",\"type\":\"address[]\"}],\"stateMutability\":\"view\",\"type\":\"function\"},{\"inputs\":[{\"internalType\":\"contract ISetToken\",\"name\":\"_setToken\",\"type\":\"address\"}],\"name\":\"initialize\",\"outputs\":[],\"stateMutability\":\"nonpayable\",\"type\":\"function\"},{\"inputs\":[{\"internalType\":\"contract ISetToken\",\"name\":\"_setToken\",\"type\":\"address\"},{\"internalType\":\"address\",\"name\":\"_bidder\",\"type\":\"address\"}],\"name\":\"isAllowedBidder\",\"outputs\":[{\"internalType\":\"bool\",\"name\":\"\",\"type\":\"bool\"}],\"stateMutability\":\"view\",\"type\":\"function\"},{\"inputs\":[{\"internalType\":\"contract ISetToken\",\"name\":\"_setToken\",\"type\":\"address\"}],\"name\":\"isQuoteAssetExcessOrAtTarget\",\"outputs\":[{\"internalType\":\"bool\",\"name\":\"\",\"type\":\"bool\"}],\"stateMutability\":\"view\",\"type\":\"function\"},{\"inputs\":[{\"internalType\":\"contract ISetToken\",\"name\":\"_setToken\",\"type\":\"address\"}],\"name\":\"isRebalanceDurationElapsed\",\"outputs\":[{\"internalType\":\"bool\",\"name\":\"\",\"type\":\"bool\"}],\"stateMutability\":\"view\",\"type\":\"function\"},{\"inputs\":[{\"internalType\":\"contract ISetToken\",\"name\":\"\",\"type\":\"address\"}],\"name\":\"permissionInfo\",\"outputs\":[{\"internalType\":\"bool\",\"name\":\"isAnyoneAllowedToBid\",\"type\":\"bool\"}],\"stateMutability\":\"view\",\"type\":\"function\"},{\"inputs\":[{\"internalType\":\"contract ISetToken\",\"name\":\"_setToken\",\"type\":\"address\"}],\"name\":\"raiseAssetTargets\",\"outputs\":[],\"stateMutability\":\"nonpayable\",\"type\":\"function\"},{\"inputs\":[{\"internalType\":\"contract ISetToken\",\"name\":\"\",\"type\":\"address\"}],\"name\":\"rebalanceInfo\",\"outputs\":[{\"internalType\":\"contract IERC20\",\"name\":\"quoteAsset\",\"type\":\"address\"},{\"internalType\":\"uint256\",\"name\":\"rebalanceStartTime\",\"type\":\"uint256\"},{\"internalType\":\"uint256\",\"name\":\"rebalanceDuration\",\"type\":\"uint256\"},{\"internalType\":\"uint256\",\"name\":\"positionMultiplier\",\"type\":\"uint256\"},{\"internalType\":\"uint256\",\"name\":\"raiseTargetPercentage\",\"type\":\"uint256\"}],\"stateMutability\":\"view\",\"type\":\"function\"},{\"inputs\":[],\"name\":\"removeModule\",\"outputs\":[],\"stateMutability\":\"nonpayable\",\"type\":\"function\"},{\"inputs\":[{\"internalType\":\"contract ISetToken\",\"name\":\"_setToken\",\"type\":\"address\"},{\"internalType\":\"bool\",\"name\":\"_status\",\"type\":\"bool\"}],\"name\":\"setAnyoneBid\",\"outputs\":[],\"stateMutability\":\"nonpayable\",\"type\":\"function\"},{\"inputs\":[{\"internalType\":\"contract ISetToken\",\"name\":\"_setToken\",\"type\":\"address\"},{\"internalType\":\"address[]\",\"name\":\"_bidders\",\"type\":\"address[]\"},{\"internalType\":\"bool[]\",\"name\":\"_statuses\",\"type\":\"bool[]\"}],\"name\":\"setBidderStatus\",\"outputs\":[],\"stateMutability\":\"nonpayable\",\"type\":\"function\"},{\"inputs\":[{\"internalType\":\"contract ISetToken\",\"name\":\"_setToken\",\"type\":\"address\"},{\"internalType\":\"uint256\",\"name\":\"_raiseTargetPercentage\",\"type\":\"uint256\"}],\"name\":\"setRaiseTargetPercentage\",\"outputs\":[],\"stateMutability\":\"nonpayable\",\"type\":\"function\"},{\"inputs\":[{\"internalType\":\"contract ISetToken\",\"name\":\"_setToken\",\"type\":\"address\"},{\"internalType\":\"contract IERC20\",\"name\":\"_quoteAsset\",\"type\":\"address\"},{\"internalType\":\"address[]\",\"name\":\"_newComponents\",\"type\":\"address[]\"},{\"components\":[{\"internalType\":\"uint256\",\"name\":\"targetUnit\",\"type\":\"uint256\"},{\"internalType\":\"string\",\"name\":\"priceAdapterName\",\"type\":\"string\"},{\"internalType\":\"bytes\",\"name\":\"priceAdapterConfigData\",\"type\":\"bytes\"}],\"internalType\":\"struct AuctionRebalanceModuleV1.AuctionExecutionParams[]\",\"name\":\"_newComponentsAuctionParams\",\"type\":\"tuple[]\"},{\"components\":[{\"internalType\":\"uint256\",\"name\":\"targetUnit\",\"type\":\"uint256\"},{\"internalType\":\"string\",\"name\":\"priceAdapterName\",\"type\":\"string\"},{\"internalType\":\"bytes\",\"name\":\"priceAdapterConfigData\",\"type\":\"bytes\"}],\"internalType\":\"struct AuctionRebalanceModuleV1.AuctionExecutionParams[]\",\"name\":\"_oldComponentsAuctionParams\",\"type\":\"tuple[]\"},{\"internalType\":\"bool\",\"name\":\"_shouldLockSetToken\",\"type\":\"bool\"},{\"internalType\":\"uint256\",\"name\":\"_rebalanceDuration\",\"type\":\"uint256\"},{\"internalType\":\"uint256\",\"name\":\"_initialPositionMultiplier\",\"type\":\"uint256\"}],\"name\":\"startRebalance\",\"outputs\":[],\"stateMutability\":\"nonpayable\",\"type\":\"function\"},{\"inputs\":[{\"internalType\":\"contract ISetToken\",\"name\":\"_setToken\",\"type\":\"address\"}],\"name\":\"unlock\",\"outputs\":[],\"stateMutability\":\"nonpayable\",\"type\":\"function\"}],\"devdoc\":{\"details\":\"Compatible with StreamingFeeModule and BasicIssuanceModule. Review compatibility if used with additional modules.WARNING: If rebalances don't lock the SetToken, there's potential for bids to be front-run by sizable issuance/redemption. This could lead to the SetToken not approaching its target allocation proportionately to the bid size. To counteract this risk, a supply cap can be applied to the SetToken, allowing regular issuance/redemption while preventing front-running with large issuance/redemption.WARNING: This contract does NOT support ERC-777 component tokens or quote assets.WARNING: Please note that the behavior of block.timestamp varies across different EVM chains. This contract does not incorporate additional checks for unique behavior or for elements like sequencer uptime. Ensure you understand these characteristics when interacting with the contract on different EVM chains.\",\"errors\":{\"AddressEmptyCode(address)\":[{\"details\":\"There's no code at `target` (it is not a contract).\"}],\"AddressInsufficientBalance(address)\":[{\"details\":\"The ETH balance of the account is not enough to perform the operation.\"}],\"FailedInnerCall()\":[{\"details\":\"A call to an address target failed. The target may have reverted.\"}],\"ReentrancyGuardReentrantCall()\":[{\"details\":\"Unauthorized reentrant call.\"}],\"SafeERC20FailedOperation(address)\":[{\"details\":\"An operation with an ERC20 token failed.\"}]},\"events\":{\"AnyoneBidUpdated(address,bool)\":{\"details\":\"Emitted upon toggling the bid permission setting via setAnyoneBid()\",\"params\":{\"isAnyoneAllowedToBid\":\"Flag indicating if bids are open to all (true) or restricted (false)\",\"setToken\":\"Reference to the SetToken undergoing rebalancing\"}},\"AssetTargetsRaised(address,uint256)\":{\"details\":\"Emitted upon calling raiseAssetTargets()\",\"params\":{\"newPositionMultiplier\":\"Updated position multiplier for the SetToken rebalance\",\"setToken\":\"Reference to the SetToken undergoing rebalancing\"}},\"BidExecuted(address,address,address,address,address,bool,uint256,uint256,uint256,uint256,uint256)\":{\"details\":\"Emitted upon execution of a bid via the bid() function.\",\"params\":{\"bidder\":\"The address of the bidder.\",\"isSellAuction\":\"Indicates if this is a sell auction (true) or a buy auction (false).\",\"netQuantityReceivedBySet\":\"The net amount of tokens received by the SetToken in the bid.\",\"netQuantitySentBySet\":\"The net amount of tokens sent by the SetToken in the bid.\",\"price\":\"The price of the component in precise units (10 ** 18).\",\"priceAdapter\":\"Instance of the price adapter contract used for this bid.\",\"protocolFee\":\"The amount of the received token allocated as a protocol fee.\",\"receiveToken\":\"The ERC20 token that is being received by the bidder.\",\"sendToken\":\"The ERC20 token that is being sent by the bidder.\",\"setToken\":\"Instance of the SetToken contract that is being rebalanced.\",\"setTotalSupply\":\"The total supply of the SetToken at the time of the bid.\"}},\"BidderStatusUpdated(address,address,bool)\":{\"details\":\"Emitted when the bidding status of an address is changed via setBidderStatus()\",\"params\":{\"bidder\":\"Address whose bidding permission status is toggled\",\"isBidderAllowed\":\"Flag indicating if the address is allowed (true) or not allowed (false) to bid\",\"setToken\":\"Reference to the SetToken undergoing rebalancing\"}},\"LockedRebalanceEndedEarly(address)\":{\"details\":\"Emitted when a locked rebalance is concluded early via the unlock() function.\",\"params\":{\"setToken\":\"Instance of the SetToken contract that is being rebalanced.\"}},\"RaiseTargetPercentageUpdated(address,uint256)\":{\"details\":\"Emitted when the target percentage increase is modified via setRaiseTargetPercentage()\",\"params\":{\"newRaiseTargetPercentage\":\"Updated percentage for potential target unit increases, in precise units (10 ** 18)\",\"setToken\":\"Reference to the SetToken undergoing rebalancing\"}},\"RebalanceStarted(address,address,bool,uint256,uint256,address[],(uint256,string,bytes)[])\":{\"details\":\"Emitted when a rebalance is initiated using the startRebalance() function.\",\"params\":{\"auctionParameters\":\"Array of AuctionExecutionParams structs, containing auction parameters for each component token.\",\"componentsInvolved\":\"Array of addresses of the component tokens involved in the rebalance.\",\"initialPositionMultiplier\":\"Position multiplier when target units were calculated.\",\"isSetTokenLocked\":\"Indicates if the rebalance process locks the SetToken (true) or not (false).\",\"quoteAsset\":\"The ERC20 token that is used as a quote currency for the auctions.\",\"rebalanceDuration\":\"Duration of the rebalance process in seconds.\",\"setToken\":\"Instance of the SetToken contract that is undergoing rebalancing.\"}}},\"kind\":\"dev\",\"methods\":{\"allTargetsMet(address)\":{\"details\":\"Checks externally if all target units for components have been met.\",\"params\":{\"_setToken\":\"Instance of the SetToken to be rebalanced.\"},\"returns\":{\"_0\":\"bool True if all component's target units have been met; false otherwise.\"}},\"bid(address,address,address,uint256,uint256,bool)\":{\"details\":\"ACCESS LIMITED: Only approved addresses can call this function unless isAnyoneAllowedToBid is enabled. This function is used to push the current component units closer to the target units defined in startRebalance(). Bidders specify the amount of the component they intend to buy or sell, and also specify the maximum/minimum amount of the quote asset they are willing to spend/receive. If the component amount is max uint256, the bid will fill the remaining amount to reach the target. The auction parameters, which are set by the manager, are used to determine the price of the component. Any bids that either don't move the component units towards the target, or overshoot the target, will be reverted. If protocol fees are enabled, they are collected in the token received in a bid. SELL AUCTIONS: At the start of the rebalance, sell auctions are available to be filled in their full size. BUY AUCTIONS: Buy auctions can be filled up to the amount of quote asset available in the SetToken. This means that if the SetToken does not contain the quote asset as a component, buy auctions cannot be bid on until sell auctions have been executed and there is quote asset available in the SetToken.\",\"params\":{\"_component\":\"The component for which the auction is to be bid on.\",\"_componentAmount\":\"The amount of component in the bid.\",\"_isSellAuction\":\"The direction of the auction expected by the bidder\",\"_quoteAsset\":\"The ERC20 token expected to be used as the quote asset by the bidder\",\"_quoteAssetLimit\":\"The maximum or minimum amount of quote asset that can be spent or received during the bid.\",\"_setToken\":\"The SetToken to be rebalanced.\"}},\"canRaiseAssetTargets(address)\":{\"details\":\"Checks externally if the conditions to raise asset targets are met.\",\"params\":{\"_setToken\":\"The SetToken being checked.\"},\"returns\":{\"_0\":\"bool True if conditions to raise asset targets are met; false otherwise.\"}},\"canUnlockEarly(address)\":{\"details\":\"Checks externally if the conditions for early unlock are met.\",\"params\":{\"_setToken\":\"The SetToken being checked.\"},\"returns\":{\"_0\":\"bool True if early unlock conditions are met; false otherwise.\"}},\"getAllowedBidders(address)\":{\"details\":\"Retrieves the list of addresses that are permitted to participate in the auction by calling `bid()`.\",\"params\":{\"_setToken\":\"Instance of the SetToken for which to retrieve the list of allowed bidders.\"},\"returns\":{\"_0\":\"address[]          Array of addresses representing the allowed bidders.\"}},\"getAuctionSizeAndDirection(address,address)\":{\"details\":\"Calculates the quantity of a component involved in the rebalancing of the given SetToken, and determines if the component is being bought or sold.\",\"params\":{\"_component\":\"Instance of the IERC20 component to bid on.\",\"_setToken\":\"Instance of the SetToken being rebalanced.\"},\"returns\":{\"componentQuantity\":\"  Quantity of the component involved in the bid.\",\"isSellAuction\":\"      Indicates if this is a sell auction (true) or a buy auction (false).\"}},\"getBidPreview(address,address,address,uint256,uint256,bool)\":{\"details\":\"Generates a preview of the bid for a given component in the rebalancing of the SetToken. It calculates the quantity of the component that will be exchanged and the direction of exchange.\",\"params\":{\"_component\":\"Instance of the component auction to bid on.\",\"_componentQuantity\":\"Quantity of the component involved in the bid.\",\"_isSellAuction\":\"The direction of the auction expected by the bidder\",\"_quoteAsset\":\"The ERC20 token expected to be used as the quote asset by the bidder\",\"_quoteQuantityLimit\":\"Maximum or minimum amount of quote asset spent or received during the bid.\",\"_setToken\":\"Instance of the SetToken being rebalanced.\"},\"returns\":{\"_0\":\"BidInfo              Struct containing data for the bid.\"}},\"getQuoteAssetBalance(address)\":{\"details\":\"Retrieves the balance of the quote asset for a given SetToken.\",\"params\":{\"_setToken\":\"The SetToken whose quote asset balance is being retrieved.\"},\"returns\":{\"_0\":\"uint256 The balance of the quote asset.\"}},\"getRebalanceComponents(address)\":{\"details\":\"Retrieves the array of components that are involved in the rebalancing of the given SetToken.\",\"params\":{\"_setToken\":\"Instance of the SetToken.\"},\"returns\":{\"_0\":\"address[]   Array of component addresses involved in the rebalance.\"}},\"initialize(address)\":{\"details\":\"MANAGER ONLY: Initializes the module for a SetToken, enabling access to AuctionModuleV1 for rebalances. Retrieves the current units for each asset in the Set and sets the targetUnit to match the current unit, effectively preventing any bidding until `startRebalance()` is explicitly called. The position multiplier is also logged to ensure that any changes to the position multiplier do not unintentionally open the Set for rebalancing.\",\"params\":{\"_setToken\":\"Address of the Set Token\"}},\"isAllowedBidder(address,address)\":{\"details\":\"Determines whether the given bidder address is allowed to participate in the auction.\",\"params\":{\"_bidder\":\"Address of the bidder.\",\"_setToken\":\"Instance of the SetToken for which the bid is being placed.\"},\"returns\":{\"_0\":\"bool       True if the given `_bidder` is permitted to bid, false otherwise.\"}},\"isQuoteAssetExcessOrAtTarget(address)\":{\"details\":\"Checks externally if the quote asset is in excess or at target.\",\"params\":{\"_setToken\":\"The SetToken being checked.\"},\"returns\":{\"_0\":\"bool True if the quote asset is in excess or at target; false otherwise.\"}},\"isRebalanceDurationElapsed(address)\":{\"details\":\"Checks externally if the rebalance duration has elapsed for the given SetToken.\",\"params\":{\"_setToken\":\"The SetToken whose rebalance duration is being checked.\"},\"returns\":{\"_0\":\"bool True if the rebalance duration has elapsed; false otherwise.\"}},\"raiseAssetTargets(address)\":{\"details\":\"ACCESS LIMITED: Increases asset targets uniformly when all target units have been met but there is remaining quote asset. Can be called multiple times if necessary. Targets are increased by the percentage specified by raiseAssetTargetsPercentage set by the manager. This helps in reducing tracking error and providing greater granularity in reaching an equilibrium between the excess quote asset and the components to be purchased. However, excessively raising targets may result in under-allocating to the quote asset as more of it is spent buying components to meet the new targets.\",\"params\":{\"_setToken\":\"The SetToken to be rebalanced.\"}},\"removeModule()\":{\"details\":\"Called by a SetToken to notify that this module was removed from the SetToken. Clears the `rebalanceInfo` and `permissionsInfo` of the calling SetToken. IMPORTANT: The auction execution settings of the SetToken, including auction parameters, are NOT DELETED. Restoring a previously removed module requires careful initialization of the execution settings.\"},\"setAnyoneBid(address,bool)\":{\"details\":\"MANAGER ONLY: Toggles whether or not anyone is allowed to call the `bid()` function. If set to true, it bypasses the bidAllowList, allowing any address to call the `bid()` function. The manager can call this function at any time.\",\"params\":{\"_setToken\":\"The SetToken instance.\",\"_status\":\"A boolean indicating if anyone can bid.\"}},\"setBidderStatus(address,address[],bool[])\":{\"details\":\"MANAGER ONLY: Toggles the permission status of specified addresses to call the `bid()` function. The manager can call this function at any time.\",\"params\":{\"_bidders\":\"An array of addresses whose bidding permission status is to be toggled.\",\"_setToken\":\"The SetToken being rebalanced.\",\"_statuses\":\"An array of booleans indicating the new bidding permission status for each corresponding address in `_bidders`.\"}},\"setRaiseTargetPercentage(address,uint256)\":{\"details\":\"MANAGER ONLY: Sets the percentage by which the target units for all components can be increased. Can be called at any time by the manager.\",\"params\":{\"_raiseTargetPercentage\":\"The percentage (in precise units) by which the target units can be increased.\",\"_setToken\":\"The SetToken to be rebalanced.\"}},\"startRebalance(address,address,address[],(uint256,string,bytes)[],(uint256,string,bytes)[],bool,uint256,uint256)\":{\"details\":\"MANAGER ONLY: Initiates the rebalance process by setting target allocations for the SetToken. Opens auctions for filling by the Set's designated bidders. The function takes in new components to be added with their target units and existing components with updated target units (set to 0 if removing). A positionMultiplier is supplied to adjust target units, e.g., in cases where fee accrual affects the positionMultiplier of the SetToken, ensuring proportional allocation among components. If target allocations are not met within the specified duration, the rebalance concludes with the allocations achieved.WARNING: If rebalances don't lock the SetToken, enforce a supply cap on the SetToken to prevent front-running.\",\"params\":{\"_initialPositionMultiplier\":\"Position multiplier at the start of the rebalance.\",\"_newComponents\":\"Addresses of new components to be added.\",\"_newComponentsAuctionParams\":\"AuctionExecutionParams for new components, indexed corresponding to _newComponents.\",\"_oldComponentsAuctionParams\":\"AuctionExecutionParams for existing components, indexed corresponding to                                      the current component positions. Set to 0 for components being removed.\",\"_quoteAsset\":\"ERC20 token used as the quote asset in auctions.\",\"_rebalanceDuration\":\"Duration of the rebalance in seconds.\",\"_setToken\":\"The SetToken to be rebalanced.\",\"_shouldLockSetToken\":\"Indicates if the rebalance should lock the SetToken.\"}},\"unlock(address)\":{\"details\":\"Unlocks the SetToken after rebalancing. Can be called once the rebalance duration has elapsed. Can only be called before the rebalance duration has elapsed if all targets are met, there is excess or at-target quote asset, and raiseTargetPercentage is zero. Resets the raiseTargetPercentage to zero.\",\"params\":{\"_setToken\":\"The SetToken to be unlocked.\"}}},\"title\":\"AuctionRebalanceModuleV1\",\"version\":1},\"userdoc\":{\"kind\":\"user\",\"methods\":{},\"notice\":\"Facilitates rebalances for index sets via single-asset auctions. Managers initiate rebalances specifying target allocations in precise units (scaled by 10^18), quote asset (e.g., WETH, USDC), auction parameters per component, and rebalance duration through startRebalance(). Bidders can participate via bid() for individual components. Excess quote asset can be managed by proportionally increasing the targets using raiseAssetTargets().\",\"version\":1}},\"settings\":{\"compilationTarget\":{\"contracts/modules/AuctionRebalanceModuleV1.sol\":\"AuctionRebalanceModuleV1\"},\"evmVersion\":\"paris\",\"libraries\":{},\"metadata\":{\"bytecodeHash\":\"ipfs\",\"useLiteralContent\":true},\"optimizer\":{\"enabled\":true,\"runs\":200},\"remappings\":[]},\"sources\":{\"@openzeppelin/contracts/token/ERC20/IERC20.sol\":{\"content\":\"// SPDX-License-Identifier: MIT\\n// OpenZeppelin Contracts (last updated v5.0.0) (token/ERC20/IERC20.sol)\\n\\npragma solidity ^0.8.20;\\n\\n/**\\n * @dev Interface of the ERC20 standard as defined in the EIP.\\n */\\ninterface IERC20 {\\n    /**\\n     * @dev Emitted when `value` tokens are moved from one account (`from`) to\\n     * another (`to`).\\n     *\\n     * Note that `value` may be zero.\\n     */\\n    event Transfer(address indexed from, address indexed to, uint256 value);\\n\\n    /**\\n     * @dev Emitted when the allowance of a `spender` for an `owner` is set by\\n     * a call to {approve}. `value` is the new allowance.\\n     */\\n    event Approval(address indexed owner, address indexed spender, uint256 value);\\n\\n    /**\\n     * @dev Returns the value of tokens in existence.\\n     */\\n    function totalSupply() external view returns (uint256);\\n\\n    /**\\n     * @dev Returns the value of tokens owned by `account`.\\n     */\\n    function balanceOf(address account) external view returns (uint256);\\n\\n    /**\\n     * @dev Moves a `value` amount of tokens from the caller's account to `to`.\\n     *\\n     * Returns a boolean value indicating whether the operation succeeded.\\n     *\\n     * Emits a {Transfer} event.\\n     */\\n    function transfer(address to, uint256 value) external returns (bool);\\n\\n    /**\\n     * @dev Returns the remaining number of tokens that `spender` will be\\n     * allowed to spend on behalf of `owner` through {transferFrom}. This is\\n     * zero by default.\\n     *\\n     * This value changes when {approve} or {transferFrom} are called.\\n     */\\n    function allowance(address owner, address spender) external view returns (uint256);\\n\\n    /**\\n     * @dev Sets a `value` amount of tokens as the allowance of `spender` over the\\n     * caller's tokens.\\n     *\\n     * Returns a boolean value indicating whether the operation succeeded.\\n     *\\n     * IMPORTANT: Beware that changing an allowance with this method brings the risk\\n     * that someone may use both the old and the new allowance by unfortunate\\n     * transaction ordering. One possible solution to mitigate this race\\n     * condition is to first reduce the spender's allowance to 0 and set the\\n     * desired value afterwards:\\n     * https://github.com/ethereum/EIPs/issues/20#issuecomment-263524729\\n     *\\n     * Emits an {Approval} event.\\n     */\\n    function approve(address spender, uint256 value) external returns (bool);\\n\\n    /**\\n     * @dev Moves a `value` amount of tokens from `from` to `to` using the\\n     * allowance mechanism. `value` is then deducted from the caller's\\n     * allowance.\\n     *\\n     * Returns a boolean value indicating whether the operation succeeded.\\n     *\\n     * Emits a {Transfer} event.\\n     */\\n    function transferFrom(address from, address to, uint256 value) external returns (bool);\\n}\\n\",\"keccak256\":\"0xc6a8ff0ea489379b61faa647490411b80102578440ab9d84e9a957cc12164e70\",\"license\":\"MIT\"},\"@openzeppelin/contracts/token/ERC20/extensions/IERC20Permit.sol\":{\"content\":\"// SPDX-License-Identifier: MIT\\n// OpenZeppelin Contracts (last updated v5.0.0) (token/ERC20/extensions/IERC20Permit.sol)\\n\\npragma solidity ^0.8.20;\\n\\n/**\\n * @dev Interface of the ERC20 Permit extension allowing approvals to be made via signatures, as defined in\\n * https://eips.ethereum.org/EIPS/eip-2612[EIP-2612].\\n *\\n * Adds the {permit} method, which can be used to change an account's ERC20 allowance (see {IERC20-allowance}) by\\n * presenting a message signed by the account. By not relying on {IERC20-approve}, the token holder account doesn't\\n * need to send a transaction, and thus is not required to hold Ether at all.\\n *\\n * ==== Security Considerations\\n *\\n * There are two important considerations concerning the use of `permit`. The first is that a valid permit signature\\n * expresses an allowance, and it should not be assumed to convey additional meaning. In particular, it should not be\\n * considered as an intention to spend the allowance in any specific way. The second is that because permits have\\n * built-in replay protection and can be submitted by anyone, they can be frontrun. A protocol that uses permits should\\n * take this into consideration and allow a `permit` call to fail. Combining these two aspects, a pattern that may be\\n * generally recommended is:\\n *\\n * ```solidity\\n * function doThingWithPermit(..., uint256 value, uint256 deadline, uint8 v, bytes32 r, bytes32 s) public {\\n *     try token.permit(msg.sender, address(this), value, deadline, v, r, s) {} catch {}\\n *     doThing(..., value);\\n * }\\n *\\n * function doThing(..., uint256 value) public {\\n *     token.safeTransferFrom(msg.sender, address(this), value);\\n *     ...\\n * }\\n * ```\\n *\\n * Observe that: 1) `msg.sender` is used as the owner, leaving no ambiguity as to the signer intent, and 2) the use of\\n * `try/catch` allows the permit to fail and makes the code tolerant to frontrunning. (See also\\n * {SafeERC20-safeTransferFrom}).\\n *\\n * Additionally, note that smart contract wallets (such as Argent or Safe) are not able to produce permit signatures, so\\n * contracts should have entry points that don't rely on permit.\\n */\\ninterface IERC20Permit {\\n    /**\\n     * @dev Sets `value` as the allowance of `spender` over ``owner``'s tokens,\\n     * given ``owner``'s signed approval.\\n     *\\n     * IMPORTANT: The same issues {IERC20-approve} has related to transaction\\n     * ordering also apply here.\\n     *\\n     * Emits an {Approval} event.\\n     *\\n     * Requirements:\\n     *\\n     * - `spender` cannot be the zero address.\\n     * - `deadline` must be a timestamp in the future.\\n     * - `v`, `r` and `s` must be a valid `secp256k1` signature from `owner`\\n     * over the EIP712-formatted function arguments.\\n     * - the signature must use ``owner``'s current nonce (see {nonces}).\\n     *\\n     * For more information on the signature format, see the\\n     * https://eips.ethereum.org/EIPS/eip-2612#specification[relevant EIP\\n     * section].\\n     *\\n     * CAUTION: See Security Considerations above.\\n     */\\n    function permit(\\n        address owner,\\n        address spender,\\n        uint256 value,\\n        uint256 deadline,\\n        uint8 v,\\n        bytes32 r,\\n        bytes32 s\\n    ) external;\\n\\n    /**\\n     * @dev Returns the current nonce for `owner`. This value must be\\n     * included whenever a signature is generated for {permit}.\\n     *\\n     * Every successful call to {permit} increases ``owner``'s nonce by one. This\\n     * prevents a signature from being used multiple times.\\n     */\\n    function nonces(address owner) external view returns (uint256);\\n\\n    /**\\n     * @dev Returns the domain separator used in the encoding of the signature for {permit}, as defined by {EIP712}.\\n     */\\n    // solhint-disable-next-line func-name-mixedcase\\n    function DOMAIN_SEPARATOR() external view returns (bytes32);\\n}\\n\",\"keccak256\":\"0x6008dabfe393240d73d7dd7688033f72740d570aa422254d29a7dce8568f3aff\",\"license\":\"MIT\"},\"@openzeppelin/contracts/token/ERC20/utils/SafeERC20.sol\":{\"content\":\"// SPDX-License-Identifier: MIT\\n// OpenZeppelin Contracts (last updated v5.0.0) (token/ERC20/utils/SafeERC20.sol)\\n\\npragma solidity ^0.8.20;\\n\\nimport {IERC20} from \\\"../IERC20.sol\\\";\\nimport {IERC20Permit} from \\\"../extensions/IERC20Permit.sol\\\";\\nimport {Address} from \\\"../../../utils/Address.sol\\\";\\n\\n/**\\n * @title SafeERC20\\n * @dev Wrappers around ERC20 operations that throw on failure (when the token\\n * contract returns false). Tokens that return no value (and instead revert or\\n * throw on failure) are also supported, non-reverting calls are assumed to be\\n * successful.\\n * To use this library you can add a `using SafeERC20 for IERC20;` statement to your contract,\\n * which allows you to call the safe operations as `token.safeTransfer(...)`, etc.\\n */\\nlibrary SafeERC20 {\\n    using Address for address;\\n\\n    /**\\n     * @dev An operation with an ERC20 token failed.\\n     */\\n    error SafeERC20FailedOperation(address token);\\n\\n    /**\\n     * @dev Indicates a failed `decreaseAllowance` request.\\n     */\\n    error SafeERC20FailedDecreaseAllowance(address spender, uint256 currentAllowance, uint256 requestedDecrease);\\n\\n    /**\\n     * @dev Transfer `value` amount of `token` from the calling contract to `to`. If `token` returns no value,\\n     * non-reverting calls are assumed to be successful.\\n     */\\n    function safeTransfer(IERC20 token, address to, uint256 value) internal {\\n        _callOptionalReturn(token, abi.encodeCall(token.transfer, (to, value)));\\n    }\\n\\n    /**\\n     * @dev Transfer `value` amount of `token` from `from` to `to`, spending the approval given by `from` to the\\n     * calling contract. If `token` returns no value, non-reverting calls are assumed to be successful.\\n     */\\n    function safeTransferFrom(IERC20 token, address from, address to, uint256 value) internal {\\n        _callOptionalReturn(token, abi.encodeCall(token.transferFrom, (from, to, value)));\\n    }\\n\\n    /**\\n     * @dev Increase the calling contract's allowance toward `spender` by `value`. If `token` returns no value,\\n     * non-reverting calls are assumed to be successful.\\n     */\\n    function safeIncreaseAllowance(IERC20 token, address spender, uint256 value) internal {\\n        uint256 oldAllowance = token.allowance(address(this), spender);\\n        forceApprove(token, spender, oldAllowance + value);\\n    }\\n\\n    /**\\n     * @dev Decrease the calling contract's allowance toward `spender` by `requestedDecrease`. If `token` returns no\\n     * value, non-reverting calls are assumed to be successful.\\n     */\\n    function safeDecreaseAllowance(IERC20 token, address spender, uint256 requestedDecrease) internal {\\n        unchecked {\\n            uint256 currentAllowance = token.allowance(address(this), spender);\\n            if (currentAllowance < requestedDecrease) {\\n                revert SafeERC20FailedDecreaseAllowance(spender, currentAllowance, requestedDecrease);\\n            }\\n            forceApprove(token, spender, currentAllowance - requestedDecrease);\\n        }\\n    }\\n\\n    /**\\n     * @dev Set the calling contract's allowance toward `spender` to `value`. If `token` returns no value,\\n     * non-reverting calls are assumed to be successful. Meant to be used with tokens that require the approval\\n     * to be set to zero before setting it to a non-zero value, such as USDT.\\n     */\\n    function forceApprove(IERC20 token, address spender, uint256 value) internal {\\n        bytes memory approvalCall = abi.encodeCall(token.approve, (spender, value));\\n\\n        if (!_callOptionalReturnBool(token, approvalCall)) {\\n            _callOptionalReturn(token, abi.encodeCall(token.approve, (spender, 0)));\\n            _callOptionalReturn(token, approvalCall);\\n        }\\n    }\\n\\n    /**\\n     * @dev Imitates a Solidity high-level call (i.e. a regular function call to a contract), relaxing the requirement\\n     * on the return value: the return value is optional (but if data is returned, it must not be false).\\n     * @param token The token targeted by the call.\\n     * @param data The call data (encoded using abi.encode or one of its variants).\\n     */\\n    function _callOptionalReturn(IERC20 token, bytes memory data) private {\\n        // We need to perform a low level call here, to bypass Solidity's return data size checking mechanism, since\\n        // we're implementing it ourselves. We use {Address-functionCall} to perform this call, which verifies that\\n        // the target address contains contract code and also asserts for success in the low-level call.\\n\\n        bytes memory returndata = address(token).functionCall(data);\\n        if (returndata.length != 0 && !abi.decode(returndata, (bool))) {\\n            revert SafeERC20FailedOperation(address(token));\\n        }\\n    }\\n\\n    /**\\n     * @dev Imitates a Solidity high-level call (i.e. a regular function call to a contract), relaxing the requirement\\n     * on the return value: the return value is optional (but if data is returned, it must not be false).\\n     * @param token The token targeted by the call.\\n     * @param data The call data (encoded using abi.encode or one of its variants).\\n     *\\n     * This is a variant of {_callOptionalReturn} that silents catches all reverts and returns a bool instead.\\n     */\\n    function _callOptionalReturnBool(IERC20 token, bytes memory data) private returns (bool) {\\n        // We need to perform a low level call here, to bypass Solidity's return data size checking mechanism, since\\n        // we're implementing it ourselves. We cannot use {Address-functionCall} here since this should return false\\n        // and not revert is the subcall reverts.\\n\\n        (bool success, bytes memory returndata) = address(token).call(data);\\n        return success && (returndata.length == 0 || abi.decode(returndata, (bool))) && address(token).code.length > 0;\\n    }\\n}\\n\",\"keccak256\":\"0x37bb49513c49c87c4642a891b13b63571bc87013dde806617aa1efb54605f386\",\"license\":\"MIT\"},\"@openzeppelin/contracts/utils/Address.sol\":{\"content\":\"// SPDX-License-Identifier: MIT\\n// OpenZeppelin Contracts (last updated v5.0.0) (utils/Address.sol)\\n\\npragma solidity ^0.8.20;\\n\\n/**\\n * @dev Collection of functions related to the address type\\n */\\nlibrary Address {\\n    /**\\n     * @dev The ETH balance of the account is not enough to perform the operation.\\n     */\\n    error AddressInsufficientBalance(address account);\\n\\n    /**\\n     * @dev There's no code at `target` (it is not a contract).\\n     */\\n    error AddressEmptyCode(address target);\\n\\n    /**\\n     * @dev A call to an address target failed. The target may have reverted.\\n     */\\n    error FailedInnerCall();\\n\\n    /**\\n     * @dev Replacement for Solidity's `transfer`: sends `amount` wei to\\n     * `recipient`, forwarding all available gas and reverting on errors.\\n     *\\n     * https://eips.ethereum.org/EIPS/eip-1884[EIP1884] increases the gas cost\\n     * of certain opcodes, possibly making contracts go over the 2300 gas limit\\n     * imposed by `transfer`, making them unable to receive funds via\\n     * `transfer`. {sendValue} removes this limitation.\\n     *\\n     * https://consensys.net/diligence/blog/2019/09/stop-using-soliditys-transfer-now/[Learn more].\\n     *\\n     * IMPORTANT: because control is transferred to `recipient`, care must be\\n     * taken to not create reentrancy vulnerabilities. Consider using\\n     * {ReentrancyGuard} or the\\n     * https://solidity.readthedocs.io/en/v0.8.20/security-considerations.html#use-the-checks-effects-interactions-pattern[checks-effects-interactions pattern].\\n     */\\n    function sendValue(address payable recipient, uint256 amount) internal {\\n        if (address(this).balance < amount) {\\n            revert AddressInsufficientBalance(address(this));\\n        }\\n\\n        (bool success, ) = recipient.call{value: amount}(\\\"\\\");\\n        if (!success) {\\n            revert FailedInnerCall();\\n        }\\n    }\\n\\n    /**\\n     * @dev Performs a Solidity function call using a low level `call`. A\\n     * plain `call` is an unsafe replacement for a function call: use this\\n     * function instead.\\n     *\\n     * If `target` reverts with a revert reason or custom error, it is bubbled\\n     * up by this function (like regular Solidity function calls). However, if\\n     * the call reverted with no returned reason, this function reverts with a\\n     * {FailedInnerCall} error.\\n     *\\n     * Returns the raw returned data. To convert to the expected return value,\\n     * use https://solidity.readthedocs.io/en/latest/units-and-global-variables.html?highlight=abi.decode#abi-encoding-and-decoding-functions[`abi.decode`].\\n     *\\n     * Requirements:\\n     *\\n     * - `target` must be a contract.\\n     * - calling `target` with `data` must not revert.\\n     */\\n    function functionCall(address target, bytes memory data) internal returns (bytes memory) {\\n        return functionCallWithValue(target, data, 0);\\n    }\\n\\n    /**\\n     * @dev Same as {xref-Address-functionCall-address-bytes-}[`functionCall`],\\n     * but also transferring `value` wei to `target`.\\n     *\\n     * Requirements:\\n     *\\n     * - the calling contract must have an ETH balance of at least `value`.\\n     * - the called Solidity function must be `payable`.\\n     */\\n    function functionCallWithValue(address target, bytes memory data, uint256 value) internal returns (bytes memory) {\\n        if (address(this).balance < value) {\\n            revert AddressInsufficientBalance(address(this));\\n        }\\n        (bool success, bytes memory returndata) = target.call{value: value}(data);\\n        return verifyCallResultFromTarget(target, success, returndata);\\n    }\\n\\n    /**\\n     * @dev Same as {xref-Address-functionCall-address-bytes-}[`functionCall`],\\n     * but performing a static call.\\n     */\\n    function functionStaticCall(address target, bytes memory data) internal view returns (bytes memory) {\\n        (bool success, bytes memory returndata) = target.staticcall(data);\\n        return verifyCallResultFromTarget(target, success, returndata);\\n    }\\n\\n    /**\\n     * @dev Same as {xref-Address-functionCall-address-bytes-}[`functionCall`],\\n     * but performing a delegate call.\\n     */\\n    function functionDelegateCall(address target, bytes memory data) internal returns (bytes memory) {\\n        (bool success, bytes memory returndata) = target.delegatecall(data);\\n        return verifyCallResultFromTarget(target, success, returndata);\\n    }\\n\\n    /**\\n     * @dev Tool to verify that a low level call to smart-contract was successful, and reverts if the target\\n     * was not a contract or bubbling up the revert reason (falling back to {FailedInnerCall}) in case of an\\n     * unsuccessful call.\\n     */\\n    function verifyCallResultFromTarget(\\n        address target,\\n        bool success,\\n        bytes memory returndata\\n    ) internal view returns (bytes memory) {\\n        if (!success) {\\n            _revert(returndata);\\n        } else {\\n            // only check if target is a contract if the call was successful and the return data is empty\\n            // otherwise we already know that it was a contract\\n            if (returndata.length == 0 && target.code.length == 0) {\\n                revert AddressEmptyCode(target);\\n            }\\n            return returndata;\\n        }\\n    }\\n\\n    /**\\n     * @dev Tool to verify that a low level call was successful, and reverts if it wasn't, either by bubbling the\\n     * revert reason or with a default {FailedInnerCall} error.\\n     */\\n    function verifyCallResult(bool success, bytes memory returndata) internal pure returns (bytes memory) {\\n        if (!success) {\\n            _revert(returndata);\\n        } else {\\n            return returndata;\\n        }\\n    }\\n\\n    /**\\n     * @dev Reverts with returndata if present. Otherwise reverts with {FailedInnerCall}.\\n     */\\n    function _revert(bytes memory returndata) private pure {\\n        // Look for revert reason and bubble it up if present\\n        if (returndata.length > 0) {\\n            // The easiest way to bubble the revert reason is using memory via assembly\\n            /// @solidity memory-safe-assembly\\n            assembly {\\n                let returndata_size := mload(returndata)\\n                revert(add(32, returndata), returndata_size)\\n            }\\n        } else {\\n            revert FailedInnerCall();\\n        }\\n    }\\n}\\n\",\"keccak256\":\"0xaf28a975a78550e45f65e559a3ad6a5ad43b9b8a37366999abd1b7084eb70721\",\"license\":\"MIT\"},\"@openzeppelin/contracts/utils/ReentrancyGuard.sol\":{\"content\":\"// SPDX-License-Identifier: MIT\\n// OpenZeppelin Contracts (last updated v5.0.0) (utils/ReentrancyGuard.sol)\\n\\npragma solidity ^0.8.20;\\n\\n/**\\n * @dev Contract module that helps prevent reentrant calls to a function.\\n *\\n * Inheriting from `ReentrancyGuard` will make the {nonReentrant} modifier\\n * available, which can be applied to functions to make sure there are no nested\\n * (reentrant) calls to them.\\n *\\n * Note that because there is a single `nonReentrant` guard, functions marked as\\n * `nonReentrant` may not call one another. This can be worked around by making\\n * those functions `private`, and then adding `external` `nonReentrant` entry\\n * points to them.\\n *\\n * TIP: If you would like to learn more about reentrancy and alternative ways\\n * to protect against it, check out our blog post\\n * https://blog.openzeppelin.com/reentrancy-after-istanbul/[Reentrancy After Istanbul].\\n */\\nabstract contract ReentrancyGuard {\\n    // Booleans are more expensive than uint256 or any type that takes up a full\\n    // word because each write operation emits an extra SLOAD to first read the\\n    // slot's contents, replace the bits taken up by the boolean, and then write\\n    // back. This is the compiler's defense against contract upgrades and\\n    // pointer aliasing, and it cannot be disabled.\\n\\n    // The values being non-zero value makes deployment a bit more expensive,\\n    // but in exchange the refund on every call to nonReentrant will be lower in\\n    // amount. Since refunds are capped to a percentage of the total\\n    // transaction's gas, it is best to keep them low in cases like this one, to\\n    // increase the likelihood of the full refund coming into effect.\\n    uint256 private constant NOT_ENTERED = 1;\\n    uint256 private constant ENTERED = 2;\\n\\n    uint256 private _status;\\n\\n    /**\\n     * @dev Unauthorized reentrant call.\\n     */\\n    error ReentrancyGuardReentrantCall();\\n\\n    constructor() {\\n        _status = NOT_ENTERED;\\n    }\\n\\n    /**\\n     * @dev Prevents a contract from calling itself, directly or indirectly.\\n     * Calling a `nonReentrant` function from another `nonReentrant`\\n     * function is not supported. It is possible to prevent this from happening\\n     * by making the `nonReentrant` function external, and making it call a\\n     * `private` function that does the actual work.\\n     */\\n    modifier nonReentrant() {\\n        _nonReentrantBefore();\\n        _;\\n        _nonReentrantAfter();\\n    }\\n\\n    function _nonReentrantBefore() private {\\n        // On the first call to nonReentrant, _status will be NOT_ENTERED\\n        if (_status == ENTERED) {\\n            revert ReentrancyGuardReentrantCall();\\n        }\\n\\n        // Any calls to nonReentrant after this point will fail\\n        _status = ENTERED;\\n    }\\n\\n    function _nonReentrantAfter() private {\\n        // By storing the original value once again, a refund is triggered (see\\n        // https://eips.ethereum.org/EIPS/eip-2200)\\n        _status = NOT_ENTERED;\\n    }\\n\\n    /**\\n     * @dev Returns true if the reentrancy guard is currently set to \\\"entered\\\", which indicates there is a\\n     * `nonReentrant` function in the call stack.\\n     */\\n    function _reentrancyGuardEntered() internal view returns (bool) {\\n        return _status == ENTERED;\\n    }\\n}\\n\",\"keccak256\":\"0xf980daa263b661ab8ddee7d4fd833c7da7e7995e2c359ff1f17e67e4112f2236\",\"license\":\"MIT\"},\"@openzeppelin/contracts/utils/math/Math.sol\":{\"content\":\"// SPDX-License-Identifier: MIT\\n// OpenZeppelin Contracts (last updated v5.0.0) (utils/math/Math.sol)\\n\\npragma solidity ^0.8.20;\\n\\n/**\\n * @dev Standard math utilities missing in the Solidity language.\\n */\\nlibrary Math {\\n    /**\\n     * @dev Muldiv operation overflow.\\n     */\\n    error MathOverflowedMulDiv();\\n\\n    enum Rounding {\\n        Floor, // Toward negative infinity\\n        Ceil, // Toward positive infinity\\n        Trunc, // Toward zero\\n        Expand // Away from zero\\n    }\\n\\n    /**\\n     * @dev Returns the addition of two unsigned integers, with an overflow flag.\\n     */\\n    function tryAdd(uint256 a, uint256 b) internal pure returns (bool, uint256) {\\n        unchecked {\\n            uint256 c = a + b;\\n            if (c < a) return (false, 0);\\n            return (true, c);\\n        }\\n    }\\n\\n    /**\\n     * @dev Returns the subtraction of two unsigned integers, with an overflow flag.\\n     */\\n    function trySub(uint256 a, uint256 b) internal pure returns (bool, uint256) {\\n        unchecked {\\n            if (b > a) return (false, 0);\\n            return (true, a - b);\\n        }\\n    }\\n\\n    /**\\n     * @dev Returns the multiplication of two unsigned integers, with an overflow flag.\\n     */\\n    function tryMul(uint256 a, uint256 b) internal pure returns (bool, uint256) {\\n        unchecked {\\n            // Gas optimization: this is cheaper than requiring 'a' not being zero, but the\\n            // benefit is lost if 'b' is also tested.\\n            // See: https://github.com/OpenZeppelin/openzeppelin-contracts/pull/522\\n            if (a == 0) return (true, 0);\\n            uint256 c = a * b;\\n            if (c / a != b) return (false, 0);\\n            return (true, c);\\n        }\\n    }\\n\\n    /**\\n     * @dev Returns the division of two unsigned integers, with a division by zero flag.\\n     */\\n    function tryDiv(uint256 a, uint256 b) internal pure returns (bool, uint256) {\\n        unchecked {\\n            if (b == 0) return (false, 0);\\n            return (true, a / b);\\n        }\\n    }\\n\\n    /**\\n     * @dev Returns the remainder of dividing two unsigned integers, with a division by zero flag.\\n     */\\n    function tryMod(uint256 a, uint256 b) internal pure returns (bool, uint256) {\\n        unchecked {\\n            if (b == 0) return (false, 0);\\n            return (true, a % b);\\n        }\\n    }\\n\\n    /**\\n     * @dev Returns the largest of two numbers.\\n     */\\n    function max(uint256 a, uint256 b) internal pure returns (uint256) {\\n        return a > b ? a : b;\\n    }\\n\\n    /**\\n     * @dev Returns the smallest of two numbers.\\n     */\\n    function min(uint256 a, uint256 b) internal pure returns (uint256) {\\n        return a < b ? a : b;\\n    }\\n\\n    /**\\n     * @dev Returns the average of two numbers. The result is rounded towards\\n     * zero.\\n     */\\n    function average(uint256 a, uint256 b) internal pure returns (uint256) {\\n        // (a + b) / 2 can overflow.\\n        return (a & b) + (a ^ b) / 2;\\n    }\\n\\n    /**\\n     * @dev Returns the ceiling of the division of two numbers.\\n     *\\n     * This differs from standard division with `/` in that it rounds towards infinity instead\\n     * of rounding towards zero.\\n     */\\n    function ceilDiv(uint256 a, uint256 b) internal pure returns (uint256) {\\n        if (b == 0) {\\n            // Guarantee the same behavior as in a regular Solidity division.\\n            return a / b;\\n        }\\n\\n        // (a + b - 1) / b can overflow on addition, so we distribute.\\n        return a == 0 ? 0 : (a - 1) / b + 1;\\n    }\\n\\n    /**\\n     * @notice Calculates floor(x * y / denominator) with full precision. Throws if result overflows a uint256 or\\n     * denominator == 0.\\n     * @dev Original credit to Remco Bloemen under MIT license (https://xn--2-umb.com/21/muldiv) with further edits by\\n     * Uniswap Labs also under MIT license.\\n     */\\n    function mulDiv(uint256 x, uint256 y, uint256 denominator) internal pure returns (uint256 result) {\\n        unchecked {\\n            // 512-bit multiply [prod1 prod0] = x * y. Compute the product mod 2^256 and mod 2^256 - 1, then use\\n            // use the Chinese Remainder Theorem to reconstruct the 512 bit result. The result is stored in two 256\\n            // variables such that product = prod1 * 2^256 + prod0.\\n            uint256 prod0 = x * y; // Least significant 256 bits of the product\\n            uint256 prod1; // Most significant 256 bits of the product\\n            assembly {\\n                let mm := mulmod(x, y, not(0))\\n                prod1 := sub(sub(mm, prod0), lt(mm, prod0))\\n            }\\n\\n            // Handle non-overflow cases, 256 by 256 division.\\n            if (prod1 == 0) {\\n                // Solidity will revert if denominator == 0, unlike the div opcode on its own.\\n                // The surrounding unchecked block does not change this fact.\\n                // See https://docs.soliditylang.org/en/latest/control-structures.html#checked-or-unchecked-arithmetic.\\n                return prod0 / denominator;\\n            }\\n\\n            // Make sure the result is less than 2^256. Also prevents denominator == 0.\\n            if (denominator <= prod1) {\\n                revert MathOverflowedMulDiv();\\n            }\\n\\n            ///////////////////////////////////////////////\\n            // 512 by 256 division.\\n            ///////////////////////////////////////////////\\n\\n            // Make division exact by subtracting the remainder from [prod1 prod0].\\n            uint256 remainder;\\n            assembly {\\n                // Compute remainder using mulmod.\\n                remainder := mulmod(x, y, denominator)\\n\\n                // Subtract 256 bit number from 512 bit number.\\n                prod1 := sub(prod1, gt(remainder, prod0))\\n                prod0 := sub(prod0, remainder)\\n            }\\n\\n            // Factor powers of two out of denominator and compute largest power of two divisor of denominator.\\n            // Always >= 1. See https://cs.stackexchange.com/q/138556/92363.\\n\\n            uint256 twos = denominator & (0 - denominator);\\n            assembly {\\n                // Divide denominator by twos.\\n                denominator := div(denominator, twos)\\n\\n                // Divide [prod1 prod0] by twos.\\n                prod0 := div(prod0, twos)\\n\\n                // Flip twos such that it is 2^256 / twos. If twos is zero, then it becomes one.\\n                twos := add(div(sub(0, twos), twos), 1)\\n            }\\n\\n            // Shift in bits from prod1 into prod0.\\n            prod0 |= prod1 * twos;\\n\\n            // Invert denominator mod 2^256. Now that denominator is an odd number, it has an inverse modulo 2^256 such\\n            // that denominator * inv = 1 mod 2^256. Compute the inverse by starting with a seed that is correct for\\n            // four bits. That is, denominator * inv = 1 mod 2^4.\\n            uint256 inverse = (3 * denominator) ^ 2;\\n\\n            // Use the Newton-Raphson iteration to improve the precision. Thanks to Hensel's lifting lemma, this also\\n            // works in modular arithmetic, doubling the correct bits in each step.\\n            inverse *= 2 - denominator * inverse; // inverse mod 2^8\\n            inverse *= 2 - denominator * inverse; // inverse mod 2^16\\n            inverse *= 2 - denominator * inverse; // inverse mod 2^32\\n            inverse *= 2 - denominator * inverse; // inverse mod 2^64\\n            inverse *= 2 - denominator * inverse; // inverse mod 2^128\\n            inverse *= 2 - denominator * inverse; // inverse mod 2^256\\n\\n            // Because the division is now exact we can divide by multiplying with the modular inverse of denominator.\\n            // This will give us the correct result modulo 2^256. Since the preconditions guarantee that the outcome is\\n            // less than 2^256, this is the final result. We don't need to compute the high bits of the result and prod1\\n            // is no longer required.\\n            result = prod0 * inverse;\\n            return result;\\n        }\\n    }\\n\\n    /**\\n     * @notice Calculates x * y / denominator with full precision, following the selected rounding direction.\\n     */\\n    function mulDiv(uint256 x, uint256 y, uint256 denominator, Rounding rounding) internal pure returns (uint256) {\\n        uint256 result = mulDiv(x, y, denominator);\\n        if (unsignedRoundsUp(rounding) && mulmod(x, y, denominator) > 0) {\\n            result += 1;\\n        }\\n        return result;\\n    }\\n\\n    /**\\n     * @dev Returns the square root of a number. If the number is not a perfect square, the value is rounded\\n     * towards zero.\\n     *\\n     * Inspired by Henry S. Warren, Jr.'s \\\"Hacker's Delight\\\" (Chapter 11).\\n     */\\n    function sqrt(uint256 a) internal pure returns (uint256) {\\n        if (a == 0) {\\n            return 0;\\n        }\\n\\n        // For our first guess, we get the biggest power of 2 which is smaller than the square root of the target.\\n        //\\n        // We know that the \\\"msb\\\" (most significant bit) of our target number `a` is a power of 2 such that we have\\n        // `msb(a) <= a < 2*msb(a)`. This value can be written `msb(a)=2**k` with `k=log2(a)`.\\n        //\\n        // This can be rewritten `2**log2(a) <= a < 2**(log2(a) + 1)`\\n        // \\u2192 `sqrt(2**k) <= sqrt(a) < sqrt(2**(k+1))`\\n        // \\u2192 `2**(k/2) <= sqrt(a) < 2**((k+1)/2) <= 2**(k/2 + 1)`\\n        //\\n        // Consequently, `2**(log2(a) / 2)` is a good first approximation of `sqrt(a)` with at least 1 correct bit.\\n        uint256 result = 1 << (log2(a) >> 1);\\n\\n        // At this point `result` is an estimation with one bit of precision. We know the true value is a uint128,\\n        // since it is the square root of a uint256. Newton's method converges quadratically (precision doubles at\\n        // every iteration). We thus need at most 7 iteration to turn our partial result with one bit of precision\\n        // into the expected uint128 result.\\n        unchecked {\\n            result = (result + a / result) >> 1;\\n            result = (result + a / result) >> 1;\\n            result = (result + a / result) >> 1;\\n            result = (result + a / result) >> 1;\\n            result = (result + a / result) >> 1;\\n            result = (result + a / result) >> 1;\\n            result = (result + a / result) >> 1;\\n            return min(result, a / result);\\n        }\\n    }\\n\\n    /**\\n     * @notice Calculates sqrt(a), following the selected rounding direction.\\n     */\\n    function sqrt(uint256 a, Rounding rounding) internal pure returns (uint256) {\\n        unchecked {\\n            uint256 result = sqrt(a);\\n            return result + (unsignedRoundsUp(rounding) && result * result < a ? 1 : 0);\\n        }\\n    }\\n\\n    /**\\n     * @dev Return the log in base 2 of a positive value rounded towards zero.\\n     * Returns 0 if given 0.\\n     */\\n    function log2(uint256 value) internal pure returns (uint256) {\\n        uint256 result = 0;\\n        unchecked {\\n            if (value >> 128 > 0) {\\n                value >>= 128;\\n                result += 128;\\n            }\\n            if (value >> 64 > 0) {\\n                value >>= 64;\\n                result += 64;\\n            }\\n            if (value >> 32 > 0) {\\n                value >>= 32;\\n                result += 32;\\n            }\\n            if (value >> 16 > 0) {\\n                value >>= 16;\\n                result += 16;\\n            }\\n            if (value >> 8 > 0) {\\n                value >>= 8;\\n                result += 8;\\n            }\\n            if (value >> 4 > 0) {\\n                value >>= 4;\\n                result += 4;\\n            }\\n            if (value >> 2 > 0) {\\n                value >>= 2;\\n                result += 2;\\n            }\\n            if (value >> 1 > 0) {\\n                result += 1;\\n            }\\n        }\\n        return result;\\n    }\\n\\n    /**\\n     * @dev Return the log in base 2, following the selected rounding direction, of a positive value.\\n     * Returns 0 if given 0.\\n     */\\n    function log2(uint256 value, Rounding rounding) internal pure returns (uint256) {\\n        unchecked {\\n            uint256 result = log2(value);\\n            return result + (unsignedRoundsUp(rounding) && 1 << result < value ? 1 : 0);\\n        }\\n    }\\n\\n    /**\\n     * @dev Return the log in base 10 of a positive value rounded towards zero.\\n     * Returns 0 if given 0.\\n     */\\n    function log10(uint256 value) internal pure returns (uint256) {\\n        uint256 result = 0;\\n        unchecked {\\n            if (value >= 10 ** 64) {\\n                value /= 10 ** 64;\\n                result += 64;\\n            }\\n            if (value >= 10 ** 32) {\\n                value /= 10 ** 32;\\n                result += 32;\\n            }\\n            if (value >= 10 ** 16) {\\n                value /= 10 ** 16;\\n                result += 16;\\n            }\\n            if (value >= 10 ** 8) {\\n                value /= 10 ** 8;\\n                result += 8;\\n            }\\n            if (value >= 10 ** 4) {\\n                value /= 10 ** 4;\\n                result += 4;\\n            }\\n            if (value >= 10 ** 2) {\\n                value /= 10 ** 2;\\n                result += 2;\\n            }\\n            if (value >= 10 ** 1) {\\n                result += 1;\\n            }\\n        }\\n        return result;\\n    }\\n\\n    /**\\n     * @dev Return the log in base 10, following the selected rounding direction, of a positive value.\\n     * Returns 0 if given 0.\\n     */\\n    function log10(uint256 value, Rounding rounding) internal pure returns (uint256) {\\n        unchecked {\\n            uint256 result = log10(value);\\n            return result + (unsignedRoundsUp(rounding) && 10 ** result < value ? 1 : 0);\\n        }\\n    }\\n\\n    /**\\n     * @dev Return the log in base 256 of a positive value rounded towards zero.\\n     * Returns 0 if given 0.\\n     *\\n     * Adding one to the result gives the number of pairs of hex symbols needed to represent `value` as a hex string.\\n     */\\n    function log256(uint256 value) internal pure returns (uint256) {\\n        uint256 result = 0;\\n        unchecked {\\n            if (value >> 128 > 0) {\\n                value >>= 128;\\n                result += 16;\\n            }\\n            if (value >> 64 > 0) {\\n                value >>= 64;\\n                result += 8;\\n            }\\n            if (value >> 32 > 0) {\\n                value >>= 32;\\n                result += 4;\\n            }\\n            if (value >> 16 > 0) {\\n                value >>= 16;\\n                result += 2;\\n            }\\n            if (value >> 8 > 0) {\\n                result += 1;\\n            }\\n        }\\n        return result;\\n    }\\n\\n    /**\\n     * @dev Return the log in base 256, following the selected rounding direction, of a positive value.\\n     * Returns 0 if given 0.\\n     */\\n    function log256(uint256 value, Rounding rounding) internal pure returns (uint256) {\\n        unchecked {\\n            uint256 result = log256(value);\\n            return result + (unsignedRoundsUp(rounding) && 1 << (result << 3) < value ? 1 : 0);\\n        }\\n    }\\n\\n    /**\\n     * @dev Returns whether a provided rounding mode is considered rounding up for unsigned integers.\\n     */\\n    function unsignedRoundsUp(Rounding rounding) internal pure returns (bool) {\\n        return uint8(rounding) % 2 == 1;\\n    }\\n}\\n\",\"keccak256\":\"0x005ec64c6313f0555d59e278f9a7a5ab2db5bdc72a027f255a37c327af1ec02d\",\"license\":\"MIT\"},\"contracts/interfaces/IAuctionPriceAdapterV1.sol\":{\"content\":\"/*\\n    Licensed under the Apache License, Version 2.0 (the \\\"License\\\");\\n    you may not use this file except in compliance with the License.\\n    You may obtain a copy of the License at\\n\\n    http://www.apache.org/licenses/LICENSE-2.0\\n\\n    Unless required by applicable law or agreed to in writing, software\\n    distributed under the License is distributed on an \\\"AS IS\\\" BASIS,\\n    WITHOUT WARRANTIES OR CONDITIONS OF ANY KIND, either express or implied.\\n    See the License for the specific language governing permissions and\\n    limitations under the License.\\n\\n    SPDX-License-Identifier: Apache-2.0\\n*/\\npragma solidity ^0.8.25;\\n\\n/**\\n * @title  IAuctionPriceAdapterV1\\n * @notice Interface for price adapter implementations for AuctionRebalanceModuleV1.\\n *         Implementations provide a custom price curve for an auction based on various parameters such as\\n *         target auction, time elapsed, bid quantity, and adapter-specific parameters.\\n */\\ninterface IAuctionPriceAdapterV1 {\\n\\n    /**\\n     * @dev Calculates and returns the current price of a component based on the given parameters.\\n     *\\n     * @param _setToken                 Address of the SetToken being rebalanced.\\n     * @param _component                Address of the component token being priced.\\n     * @param _componentQuantity        Quantity of the component being priced.\\n     * @param _timeElapsed              Time elapsed in seconds since the start of the auction.\\n     * @param _duration                 Duration of the auction in seconds.\\n     * @param _priceAdapterConfigData   Encoded configuration data specific to the price adapter.\\n     *\\n     * @return price                    Calculated current component price in precise units (10**18).\\n     */\\n    function getPrice(\\n        address _setToken,\\n        address _component,\\n        uint256 _componentQuantity,\\n        uint256 _timeElapsed,\\n        uint256 _duration,\\n        bytes memory _priceAdapterConfigData\\n    )\\n        external\\n        view\\n        returns (uint256 price);\\n\\n    /**\\n     * @dev Validates the price adapter configuration data for the given parameters.\\n     *\\n     * @param _priceAdapterConfigData   Encoded configuration data specific to the price adapter.\\n     *\\n     * @return isValid                  True if the configuration data is valid, False otherwise.\\n     */\\n    function isPriceAdapterConfigDataValid(\\n        bytes memory _priceAdapterConfigData\\n    )\\n        external\\n        view\\n        returns (bool isValid);\\n}\\n\",\"keccak256\":\"0xf5338a7b18606c3bc977a9ad058e04f5104461448c024261edaeecd9d0b3f5c9\",\"license\":\"Apache-2.0\"},\"contracts/interfaces/IController.sol\":{\"content\":\"/*\\n\\n    Licensed under the Apache License, Version 2.0 (the \\\"License\\\");\\n    you may not use this file except in compliance with the License.\\n    You may obtain a copy of the License at\\n\\n    http://www.apache.org/licenses/LICENSE-2.0\\n\\n    Unless required by applicable law or agreed to in writing, software\\n    distributed under the License is distributed on an \\\"AS IS\\\" BASIS,\\n    WITHOUT WARRANTIES OR CONDITIONS OF ANY KIND, either express or implied.\\n    See the License for the specific language governing permissions and\\n    limitations under the License.\\n\\n    SPDX-License-Identifier: Apache-2.0\\n*/\\npragma solidity ^0.8.25;\\n\\ninterface IController {\\n    function addSet(address _setToken) external;\\n    function feeRecipient() external view returns(address);\\n    function getModuleFee(address _module, uint256 _feeType) external view returns(uint256);\\n    function isModule(address _module) external view returns(bool);\\n    function isSet(address _setToken) external view returns(bool);\\n    function isSystemContract(address _contractAddress) external view returns (bool);\\n    function resourceId(uint256 _id) external view returns(address);\\n}\\n\",\"keccak256\":\"0xb58ec090858cb3042b3a884161b83f666ca00e4dafae2b1f5bf9bae6fba9a56f\",\"license\":\"Apache-2.0\"},\"contracts/interfaces/IIntegrationRegistry.sol\":{\"content\":\"/*\\n    Licensed under the Apache License, Version 2.0 (the \\\"License\\\");\\n    you may not use this file except in compliance with the License.\\n    You may obtain a copy of the License at\\n\\n    http://www.apache.org/licenses/LICENSE-2.0\\n\\n    Unless required by applicable law or agreed to in writing, software\\n    distributed under the License is distributed on an \\\"AS IS\\\" BASIS,\\n    WITHOUT WARRANTIES OR CONDITIONS OF ANY KIND, either express or implied.\\n    See the License for the specific language governing permissions and\\n    limitations under the License.\\n\\n    SPDX-License-Identifier: Apache-2.0\\n*/\\npragma solidity ^0.8.25;\\n\\ninterface IIntegrationRegistry {\\n    function addIntegration(address _module, string memory _id, address _wrapper) external;\\n    function getIntegrationAdapter(address _module, string memory _id) external view returns(address);\\n    function getIntegrationAdapterWithHash(address _module, bytes32 _id) external view returns(address);\\n    function isValidIntegration(address _module, string memory _id) external view returns(bool);\\n}\\n\",\"keccak256\":\"0x23b91e32f0a2a0e36cf34248e4ca870dcf2fbd6092776a5f99389a5d1026d487\",\"license\":\"Apache-2.0\"},\"contracts/interfaces/IModule.sol\":{\"content\":\"/*\\n    Licensed under the Apache License, Version 2.0 (the \\\"License\\\");\\n    you may not use this file except in compliance with the License.\\n    You may obtain a copy of the License at\\n\\n    http://www.apache.org/licenses/LICENSE-2.0\\n\\n    Unless required by applicable law or agreed to in writing, software\\n    distributed under the License is distributed on an \\\"AS IS\\\" BASIS,\\n    WITHOUT WARRANTIES OR CONDITIONS OF ANY KIND, either express or implied.\\n    See the License for the specific language governing permissions and\\n    limitations under the License.\\n\\n    SPDX-License-Identifier: Apache-2.0\\n*/\\npragma solidity ^0.8.25;\\n\\n\\n/**\\n * @title IModule\\n * @author Cryptex\\n *\\n * Interface for interacting with Modules.\\n */\\ninterface IModule {\\n    /**\\n     * Called by a SetToken to notify that this module was removed from the Set token. Any logic can be included\\n     * in case checks need to be made or state needs to be cleared.\\n     */\\n    function removeModule() external;\\n}\\n\",\"keccak256\":\"0xaadca817d7ee92051800e814cde7e76f8dae21548ec882d3c8c2dca34afa3cc4\",\"license\":\"Apache-2.0\"},\"contracts/interfaces/IPriceOracle.sol\":{\"content\":\"/*\\n    Licensed under the Apache License, Version 2.0 (the \\\"License\\\");\\n    you may not use this file except in compliance with the License.\\n    You may obtain a copy of the License at\\n\\n    http://www.apache.org/licenses/LICENSE-2.0\\n\\n    Unless required by applicable law or agreed to in writing, software\\n    distributed under the License is distributed on an \\\"AS IS\\\" BASIS,\\n    WITHOUT WARRANTIES OR CONDITIONS OF ANY KIND, either express or implied.\\n    See the License for the specific language governing permissions and\\n    limitations under the License.\\n\\n    SPDX-License-Identifier: Apache-2.0\\n*/\\npragma solidity ^0.8.25;\\n\\n/**\\n * @title IPriceOracle\\n *\\n * Interface for interacting with PriceOracle\\n */\\ninterface IPriceOracle {\\n\\n    /* ============ Functions ============ */\\n\\n    function getPrice(address _assetOne, address _assetTwo) external view returns (uint256);\\n    function masterQuoteAsset() external view returns (address);\\n}\\n\",\"keccak256\":\"0xeef93e937be976768084f655d2e81934c0bbb789ed8e21b2c30f143297877034\",\"license\":\"Apache-2.0\"},\"contracts/interfaces/ISetToken.sol\":{\"content\":\"/*\\n\\n    Licensed under the Apache License, Version 2.0 (the \\\"License\\\");\\n    you may not use this file except in compliance with the License.\\n    You may obtain a copy of the License at\\n\\n    http://www.apache.org/licenses/LICENSE-2.0\\n\\n    Unless required by applicable law or agreed to in writing, software\\n    distributed under the License is distributed on an \\\"AS IS\\\" BASIS,\\n    WITHOUT WARRANTIES OR CONDITIONS OF ANY KIND, either express or implied.\\n    See the License for the specific language governing permissions and\\n    limitations under the License.\\n\\n    SPDX-License-Identifier: Apache-2.0\\n*/\\npragma solidity ^0.8.25;\\n\\nimport { IERC20 } from \\\"@openzeppelin/contracts/token/ERC20/IERC20.sol\\\";\\n\\n/**\\n * @title ISetToken\\n * @author Cryptex\\n *\\n * Interface for operating with SetTokens.\\n */\\ninterface ISetToken is IERC20 {\\n\\n    /* ============ Enums ============ */\\n\\n    enum ModuleState {\\n        NONE,\\n        PENDING,\\n        INITIALIZED\\n    }\\n\\n    /* ============ Structs ============ */\\n    /**\\n     * The base definition of a SetToken Position\\n     *\\n     * @param component           Address of token in the Position\\n     * @param module              If not in default state, the address of associated module\\n     * @param unit                Each unit is the # of components per 10^18 of a SetToken\\n     * @param positionState       Position ENUM. Default is 0; External is 1\\n     * @param data                Arbitrary data\\n     */\\n    struct Position {\\n        address component;\\n        address module;\\n        int256 unit;\\n        uint8 positionState;\\n        bytes data;\\n    }\\n\\n    /**\\n     * A struct that stores a component's cash position details and external positions\\n     * This data structure allows O(1) access to a component's cash position units and\\n     * virtual units.\\n     *\\n     * @param virtualUnit               Virtual value of a component's DEFAULT position. Stored as virtual for efficiency\\n     *                                  updating all units at once via the position multiplier. Virtual units are achieved\\n     *                                  by dividing a \\\"real\\\" value by the \\\"positionMultiplier\\\"\\n     * @param componentIndex\\n     * @param externalPositionModules   List of external modules attached to each external position. Each module\\n     *                                  maps to an external position\\n     * @param externalPositions         Mapping of module => ExternalPosition struct for a given component\\n     */\\n    struct ComponentPosition {\\n      int256 virtualUnit;\\n      address[] externalPositionModules;\\n      mapping(address => ExternalPosition) externalPositions;\\n    }\\n\\n    /**\\n     * A struct that stores a component's external position details including virtual unit and any\\n     * auxiliary data.\\n     *\\n     * @param virtualUnit       Virtual value of a component's EXTERNAL position.\\n     * @param data              Arbitrary data\\n     */\\n    struct ExternalPosition {\\n      int256 virtualUnit;\\n      bytes data;\\n    }\\n\\n\\n    /* ============ Functions ============ */\\n\\n    function addComponent(address _component) external;\\n    function removeComponent(address _component) external;\\n    function editDefaultPositionUnit(address _component, int256 _realUnit) external;\\n    function addExternalPositionModule(address _component, address _positionModule) external;\\n    function removeExternalPositionModule(address _component, address _positionModule) external;\\n    function editExternalPositionUnit(address _component, address _positionModule, int256 _realUnit) external;\\n    function editExternalPositionData(address _component, address _positionModule, bytes calldata _data) external;\\n\\n    function invoke(address _target, uint256 _value, bytes calldata _data) external returns(bytes memory);\\n\\n    function editPositionMultiplier(int256 _newMultiplier) external;\\n\\n    function mint(address _account, uint256 _quantity) external;\\n    function burn(address _account, uint256 _quantity) external;\\n\\n    function lock() external;\\n    function unlock() external;\\n\\n    function addModule(address _module) external;\\n    function removeModule(address _module) external;\\n    function initializeModule() external;\\n\\n    function setManager(address _manager) external;\\n\\n    function manager() external view returns (address);\\n    function moduleStates(address _module) external view returns (ModuleState);\\n    function getModules() external view returns (address[] memory);\\n\\n    function getDefaultPositionRealUnit(address _component) external view returns(int256);\\n    function getExternalPositionRealUnit(address _component, address _positionModule) external view returns(int256);\\n    function getComponents() external view returns(address[] memory);\\n    function getExternalPositionModules(address _component) external view returns(address[] memory);\\n    function getExternalPositionData(address _component, address _positionModule) external view returns(bytes memory);\\n    function isExternalPositionModule(address _component, address _module) external view returns(bool);\\n    function isComponent(address _component) external view returns(bool);\\n\\n    function positionMultiplier() external view returns (int256);\\n    function getPositions() external view returns (Position[] memory);\\n    function getTotalComponentRealUnits(address _component) external view returns(int256);\\n\\n    function isInitializedModule(address _module) external view returns(bool);\\n    function isPendingModule(address _module) external view returns(bool);\\n    function isLocked() external view returns (bool);\\n    function locker() external view returns (address);\\n}\\n\",\"keccak256\":\"0x0c03965f4aa010b1d7e63c16a3b5793d1083ed102a91b44fed26830ac485216f\",\"license\":\"Apache-2.0\"},\"contracts/interfaces/ISetValuer.sol\":{\"content\":\"/*\\n    Licensed under the Apache License, Version 2.0 (the \\\"License\\\");\\n    you may not use this file except in compliance with the License.\\n    You may obtain a copy of the License at\\n\\n    http://www.apache.org/licenses/LICENSE-2.0\\n\\n    Unless required by applicable law or agreed to in writing, software\\n    distributed under the License is distributed on an \\\"AS IS\\\" BASIS,\\n    WITHOUT WARRANTIES OR CONDITIONS OF ANY KIND, either express or implied.\\n    See the License for the specific language governing permissions and\\n    limitations under the License.\\n\\n    SPDX-License-Identifier: Apache-2.0\\n*/\\npragma solidity ^0.8.25;\\n\\nimport { ISetToken } from \\\"../interfaces/ISetToken.sol\\\";\\n\\ninterface ISetValuer {\\n    function calculateSetTokenValuation(ISetToken _setToken, address _quoteAsset) external view returns (uint256);\\n}\\n\",\"keccak256\":\"0x425653d94e195a80e64b6d600a649a19894f0cca029677d361af6e9d80f8fe29\",\"license\":\"Apache-2.0\"},\"contracts/lib/AddressArrayUtils.sol\":{\"content\":\"/*\\n\\n    Licensed under the Apache License, Version 2.0 (the \\\"License\\\");\\n    you may not use this file except in compliance with the License.\\n    You may obtain a copy of the License at\\n\\n    http://www.apache.org/licenses/LICENSE-2.0\\n\\n    Unless required by applicable law or agreed to in writing, software\\n    distributed under the License is distributed on an \\\"AS IS\\\" BASIS,\\n    WITHOUT WARRANTIES OR CONDITIONS OF ANY KIND, either express or implied.\\n    See the License for the specific language governing permissions and\\n    limitations under the License.\\n\\n    SPDX-License-Identifier: Apache-2.0\\n\\n*/\\n\\npragma solidity ^0.8.25;\\n\\n/**\\n * @title AddressArrayUtils\\n * @author Cryptex\\n *\\n * Utility functions to handle Address Arrays\\n */\\nlibrary AddressArrayUtils {\\n\\n    /**\\n     * Finds the index of the first occurrence of the given element.\\n     * @param A The input array to search\\n     * @param a The value to find\\n     * @return Returns (index and isIn) for the first occurrence starting from index 0\\n     */\\n    function indexOf(address[] memory A, address a) internal pure returns (uint256, bool) {\\n        uint256 length = A.length;\\n        for (uint256 i = 0; i < length; i++) {\\n            if (A[i] == a) {\\n                return (i, true);\\n            }\\n        }\\n        return (type(uint256).max, false);\\n    }\\n\\n    /**\\n    * Returns true if the value is present in the list. Uses indexOf internally.\\n    * @param A The input array to search\\n    * @param a The value to find\\n    * @return Returns isIn for the first occurrence starting from index 0\\n    */\\n    function contains(address[] memory A, address a) internal pure returns (bool) {\\n        (, bool isIn) = indexOf(A, a);\\n        return isIn;\\n    }\\n\\n    /**\\n    * Returns true if there are 2 elements that are the same in an array\\n    * @param A The input array to search\\n    * @return Returns boolean for the first occurrence of a duplicate\\n    */\\n    function hasDuplicate(address[] memory A) internal pure returns(bool) {\\n        require(A.length > 0, \\\"A is empty\\\");\\n\\n        for (uint256 i = 0; i < A.length - 1; i++) {\\n            address current = A[i];\\n            for (uint256 j = i + 1; j < A.length; j++) {\\n                if (current == A[j]) {\\n                    return true;\\n                }\\n            }\\n        }\\n        return false;\\n    }\\n\\n    /**\\n     * @param A The input array to search\\n     * @param a The address to remove\\n     * @return Returns the array with the object removed.\\n     */\\n    function remove(address[] memory A, address a)\\n        internal\\n        pure\\n        returns (address[] memory)\\n    {\\n        (uint256 index, bool isIn) = indexOf(A, a);\\n        if (!isIn) {\\n            revert(\\\"Address not in array.\\\");\\n        } else {\\n            (address[] memory _A,) = pop(A, index);\\n            return _A;\\n        }\\n    }\\n\\n    /**\\n     * @param A The input array to search\\n     * @param a The address to remove\\n     */\\n    function removeStorage(address[] storage A, address a)\\n        internal\\n    {\\n        (uint256 index, bool isIn) = indexOf(A, a);\\n        if (!isIn) {\\n            revert(\\\"Address not in array.\\\");\\n        } else {\\n            uint256 lastIndex = A.length - 1; // If the array would be empty, the previous line would throw, so no underflow here\\n            if (index != lastIndex) { A[index] = A[lastIndex]; }\\n            A.pop();\\n        }\\n    }\\n\\n    /**\\n    * Removes specified index from array\\n    * @param A The input array to search\\n    * @param index The index to remove\\n    * @return Returns the new array and the removed entry\\n    */\\n    function pop(address[] memory A, uint256 index)\\n        internal\\n        pure\\n        returns (address[] memory, address)\\n    {\\n        uint256 length = A.length;\\n        require(index < A.length, \\\"Index must be < A length\\\");\\n        address[] memory newAddresses = new address[](length - 1);\\n        for (uint256 i = 0; i < index; i++) {\\n            newAddresses[i] = A[i];\\n        }\\n        for (uint256 j = index + 1; j < length; j++) {\\n            newAddresses[j - 1] = A[j];\\n        }\\n        return (newAddresses, A[index]);\\n    }\\n\\n    /**\\n     * Returns the combination of the two arrays\\n     * @param A The first array\\n     * @param B The second array\\n     * @return Returns A extended by B\\n     */\\n    function extend(address[] memory A, address[] memory B) internal pure returns (address[] memory) {\\n        uint256 aLength = A.length;\\n        uint256 bLength = B.length;\\n        address[] memory newAddresses = new address[](aLength + bLength);\\n        for (uint256 i = 0; i < aLength; i++) {\\n            newAddresses[i] = A[i];\\n        }\\n        for (uint256 j = 0; j < bLength; j++) {\\n            newAddresses[aLength + j] = B[j];\\n        }\\n        return newAddresses;\\n    }\\n\\n    /**\\n     * Validate that address and uint array lengths match. Validate address array is not empty\\n     * and contains no duplicate elements.\\n     *\\n     * @param A         Array of addresses\\n     * @param B         Array of uint\\n     */\\n    function validatePairsWithArray(address[] memory A, uint[] memory B) internal pure {\\n        require(A.length == B.length, \\\"Array length mismatch\\\");\\n        _validateLengthAndUniqueness(A);\\n    }\\n\\n    /**\\n     * Validate that address and bool array lengths match. Validate address array is not empty\\n     * and contains no duplicate elements.\\n     *\\n     * @param A         Array of addresses\\n     * @param B         Array of bool\\n     */\\n    function validatePairsWithArray(address[] memory A, bool[] memory B) internal pure {\\n        require(A.length == B.length, \\\"Array length mismatch\\\");\\n        _validateLengthAndUniqueness(A);\\n    }\\n\\n    /**\\n     * Validate that address and string array lengths match. Validate address array is not empty\\n     * and contains no duplicate elements.\\n     *\\n     * @param A         Array of addresses\\n     * @param B         Array of strings\\n     */\\n    function validatePairsWithArray(address[] memory A, string[] memory B) internal pure {\\n        require(A.length == B.length, \\\"Array length mismatch\\\");\\n        _validateLengthAndUniqueness(A);\\n    }\\n\\n    /**\\n     * Validate that address array lengths match, and calling address array are not empty\\n     * and contain no duplicate elements.\\n     *\\n     * @param A         Array of addresses\\n     * @param B         Array of addresses\\n     */\\n    function validatePairsWithArray(address[] memory A, address[] memory B) internal pure {\\n        require(A.length == B.length, \\\"Array length mismatch\\\");\\n        _validateLengthAndUniqueness(A);\\n    }\\n\\n    /**\\n     * Validate that address and bytes array lengths match. Validate address array is not empty\\n     * and contains no duplicate elements.\\n     *\\n     * @param A         Array of addresses\\n     * @param B         Array of bytes\\n     */\\n    function validatePairsWithArray(address[] memory A, bytes[] memory B) internal pure {\\n        require(A.length == B.length, \\\"Array length mismatch\\\");\\n        _validateLengthAndUniqueness(A);\\n    }\\n\\n    /**\\n     * Validate address array is not empty and contains no duplicate elements.\\n     *\\n     * @param A          Array of addresses\\n     */\\n    function _validateLengthAndUniqueness(address[] memory A) internal pure {\\n        require(A.length > 0, \\\"Array length must be > 0\\\");\\n        require(!hasDuplicate(A), \\\"Cannot duplicate addresses\\\");\\n    }\\n}\\n\",\"keccak256\":\"0x47fae741aebe3050ea834fa4e3ebf9ab988fa10a883b11c9ffadfc77d35d460d\",\"license\":\"Apache-2.0\"},\"contracts/lib/ExplicitERC20.sol\":{\"content\":\"/*\\n    Licensed under the Apache License, Version 2.0 (the \\\"License\\\");\\n    you may not use this file except in compliance with the License.\\n    You may obtain a copy of the License at\\n\\n    http://www.apache.org/licenses/LICENSE-2.0\\n\\n    Unless required by applicable law or agreed to in writing, software\\n    distributed under the License is distributed on an \\\"AS IS\\\" BASIS,\\n    WITHOUT WARRANTIES OR CONDITIONS OF ANY KIND, either express or implied.\\n    See the License for the specific language governing permissions and\\n    limitations under the License.\\n\\n    SPDX-License-Identifier: Apache-2.0\\n*/\\n\\npragma solidity ^0.8.25;\\n\\nimport { IERC20 } from \\\"@openzeppelin/contracts/token/ERC20/IERC20.sol\\\";\\nimport { SafeERC20 } from \\\"@openzeppelin/contracts/token/ERC20/utils/SafeERC20.sol\\\";\\n\\n\\n/**\\n * @title ExplicitERC20\\n *\\n * Utility functions for ERC20 transfers that require the explicit amount to be transferred.\\n */\\nlibrary ExplicitERC20 {\\n    /**\\n     * When given allowance, transfers a token from the \\\"_from\\\" to the \\\"_to\\\" of quantity \\\"_quantity\\\".\\n     * Ensures that the recipient has received the correct quantity (ie no fees taken on transfer)\\n     *\\n     * @param _token           ERC20 token to approve\\n     * @param _from            The account to transfer tokens from\\n     * @param _to              The account to transfer tokens to\\n     * @param _quantity        The quantity to transfer\\n     */\\n    function transferFrom(\\n        IERC20 _token,\\n        address _from,\\n        address _to,\\n        uint256 _quantity\\n    )\\n        internal\\n    {\\n        // Call specified ERC20 contract to transfer tokens (via proxy).\\n        if (_quantity > 0) {\\n            uint256 existingBalance = _token.balanceOf(_to);\\n\\n            SafeERC20.safeTransferFrom(\\n                _token,\\n                _from,\\n                _to,\\n                _quantity\\n            );\\n\\n            uint256 newBalance = _token.balanceOf(_to);\\n\\n            // Verify transfer quantity is reflected in balance\\n            require(\\n                newBalance == (existingBalance + _quantity),\\n                \\\"Invalid post transfer balance\\\"\\n            );\\n        }\\n    }\\n}\\n\",\"keccak256\":\"0x235480d094d4e6e53f18cd66438fb45a0306bbd1d46c91e47ce262f378337c86\",\"license\":\"Apache-2.0\"},\"contracts/lib/Invoke.sol\":{\"content\":\"/*\\n    Licensed under the Apache License, Version 2.0 (the \\\"License\\\");\\n    you may not use this file except in compliance with the License.\\n    You may obtain a copy of the License at\\n\\n    http://www.apache.org/licenses/LICENSE-2.0\\n\\n    Unless required by applicable law or agreed to in writing, software\\n    distributed under the License is distributed on an \\\"AS IS\\\" BASIS,\\n    WITHOUT WARRANTIES OR CONDITIONS OF ANY KIND, either express or implied.\\n    See the License for the specific language governing permissions and\\n    limitations under the License.\\n\\n    SPDX-License-Identifier: Apache-2.0\\n*/\\n\\npragma solidity ^0.8.25;\\n\\nimport { IERC20 } from \\\"@openzeppelin/contracts/token/ERC20/IERC20.sol\\\";\\n\\nimport { ISetToken } from \\\"../interfaces/ISetToken.sol\\\";\\n\\n\\n/**\\n * @title Invoke\\n * A collection of common utility functions for interacting with the SetToken's invoke function\\n */\\nlibrary Invoke {\\n\\n    /* ============ Internal ============ */\\n\\n    /**\\n     * Instructs the SetToken to set approvals of the ERC20 token to a spender.\\n     *\\n     * @param _setToken        SetToken instance to invoke\\n     * @param _token           ERC20 token to approve\\n     * @param _spender         The account allowed to spend the SetToken's balance\\n     * @param _quantity        The quantity of allowance to allow\\n     */\\n    function invokeApprove(\\n        ISetToken _setToken,\\n        address _token,\\n        address _spender,\\n        uint256 _quantity\\n    )\\n        internal\\n    {\\n        bytes memory callData = abi.encodeWithSignature(\\\"approve(address,uint256)\\\", _spender, _quantity);\\n        _setToken.invoke(_token, 0, callData);\\n    }\\n\\n    /**\\n     * Instructs the SetToken to transfer the ERC20 token to a recipient.\\n     *\\n     * @param _setToken        SetToken instance to invoke\\n     * @param _token           ERC20 token to transfer\\n     * @param _to              The recipient account\\n     * @param _quantity        The quantity to transfer\\n     */\\n    function invokeTransfer(\\n        ISetToken _setToken,\\n        address _token,\\n        address _to,\\n        uint256 _quantity\\n    )\\n        internal\\n    {\\n        if (_quantity > 0) {\\n            bytes memory callData = abi.encodeWithSignature(\\\"transfer(address,uint256)\\\", _to, _quantity);\\n\\n            bytes memory returnData = _setToken.invoke(_token, 0, callData);\\n            if (returnData.length > 0) {\\n                require(abi.decode(returnData, (bool)), \\\"ERC20 transfer failed\\\");\\n            }\\n        }\\n    }\\n\\n    /**\\n     * Instructs the SetToken to transfer the ERC20 token to a recipient.\\n     * The new SetToken balance must equal the existing balance less the quantity transferred\\n     *\\n     * @param _setToken        SetToken instance to invoke\\n     * @param _token           ERC20 token to transfer\\n     * @param _to              The recipient account\\n     * @param _quantity        The quantity to transfer\\n     */\\n    function strictInvokeTransfer(\\n        ISetToken _setToken,\\n        address _token,\\n        address _to,\\n        uint256 _quantity\\n    )\\n        internal\\n    {\\n        if (_quantity > 0) {\\n            // Retrieve current balance of token for the SetToken\\n            uint256 existingBalance = IERC20(_token).balanceOf(address(_setToken));\\n\\n            Invoke.invokeTransfer(_setToken, _token, _to, _quantity);\\n\\n            // Get new balance of transferred token for SetToken\\n            uint256 newBalance = IERC20(_token).balanceOf(address(_setToken));\\n\\n            // Verify only the transfer quantity is subtracted\\n            require(\\n                newBalance == (existingBalance - _quantity),\\n                \\\"Invalid post transfer balance\\\"\\n            );\\n        }\\n    }\\n\\n    /**\\n     * Instructs the SetToken to unwrap the passed quantity of WETH\\n     *\\n     * @param _setToken        SetToken instance to invoke\\n     * @param _weth            WETH address\\n     * @param _quantity        The quantity to unwrap\\n     */\\n    function invokeUnwrapWETH(ISetToken _setToken, address _weth, uint256 _quantity) internal {\\n        bytes memory callData = abi.encodeWithSignature(\\\"withdraw(uint256)\\\", _quantity);\\n        _setToken.invoke(_weth, 0, callData);\\n    }\\n\\n    /**\\n     * Instructs the SetToken to wrap the passed quantity of ETH\\n     *\\n     * @param _setToken        SetToken instance to invoke\\n     * @param _weth            WETH address\\n     * @param _quantity        The quantity to unwrap\\n     */\\n    function invokeWrapWETH(ISetToken _setToken, address _weth, uint256 _quantity) internal {\\n        bytes memory callData = abi.encodeWithSignature(\\\"deposit()\\\");\\n        _setToken.invoke(_weth, _quantity, callData);\\n    }\\n}\\n\",\"keccak256\":\"0x77d9448dd5af50f4ac9b51db8ee8038bbdc18b7952902e615c0d07f6846c876f\",\"license\":\"Apache-2.0\"},\"contracts/lib/ModuleBase.sol\":{\"content\":\"/*\\n    Licensed under the Apache License, Version 2.0 (the \\\"License\\\");\\n    you may not use this file except in compliance with the License.\\n    You may obtain a copy of the License at\\n\\n    http://www.apache.org/licenses/LICENSE-2.0\\n\\n    Unless required by applicable law or agreed to in writing, software\\n    distributed under the License is distributed on an \\\"AS IS\\\" BASIS,\\n    WITHOUT WARRANTIES OR CONDITIONS OF ANY KIND, either express or implied.\\n    See the License for the specific language governing permissions and\\n    limitations under the License.\\n\\n    SPDX-License-Identifier: Apache-2.0\\n*/\\n\\npragma solidity ^0.8.25;\\n\\nimport { IERC20 } from \\\"@openzeppelin/contracts/token/ERC20/IERC20.sol\\\";\\n\\nimport { AddressArrayUtils } from \\\"../lib/AddressArrayUtils.sol\\\";\\nimport { ExplicitERC20 } from \\\"../lib/ExplicitERC20.sol\\\";\\nimport { IController } from \\\"../interfaces/IController.sol\\\";\\nimport { IModule } from \\\"../interfaces/IModule.sol\\\";\\nimport { ISetToken } from \\\"../interfaces/ISetToken.sol\\\";\\nimport { Invoke } from \\\"./Invoke.sol\\\";\\nimport { Position } from \\\"./Position.sol\\\";\\nimport { PreciseUnitMath } from \\\"../lib/PreciseUnitMath.sol\\\";\\nimport { ResourceIdentifier } from \\\"./ResourceIdentifier.sol\\\";\\n\\n/**\\n * @title ModuleBase\\n *\\n * Abstract class that houses common Module-related state and functions.\\n *\\n * CHANGELOG:\\n * - 4/21/21: Delegated modifier logic to internal helpers to reduce contract size\\n *\\n */\\nabstract contract ModuleBase is IModule {\\n    using AddressArrayUtils for address[];\\n    using Invoke for ISetToken;\\n    using Position for ISetToken;\\n    using PreciseUnitMath for uint256;\\n    using ResourceIdentifier for IController;\\n\\n    /* ============ State Variables ============ */\\n\\n    // Address of the controller\\n    IController public controller;\\n\\n    /* ============ Modifiers ============ */\\n\\n    modifier onlyManagerAndValidSet(ISetToken _setToken) {\\n        _validateOnlyManagerAndValidSet(_setToken);\\n        _;\\n    }\\n\\n    modifier onlySetManager(ISetToken _setToken, address _caller) {\\n        _validateOnlySetManager(_setToken, _caller);\\n        _;\\n    }\\n\\n    modifier onlyValidAndInitializedSet(ISetToken _setToken) {\\n        _validateOnlyValidAndInitializedSet(_setToken);\\n        _;\\n    }\\n\\n    /**\\n     * Throws if the sender is not a SetToken's module or module not enabled\\n     */\\n    modifier onlyModule(ISetToken _setToken) {\\n        _validateOnlyModule(_setToken);\\n        _;\\n    }\\n\\n    /**\\n     * Utilized during module initializations to check that the module is in pending state\\n     * and that the SetToken is valid\\n     */\\n    modifier onlyValidAndPendingSet(ISetToken _setToken) {\\n        _validateOnlyValidAndPendingSet(_setToken);\\n        _;\\n    }\\n\\n    /* ============ Constructor ============ */\\n\\n    /**\\n     * Set state variables and map asset pairs to their oracles\\n     *\\n     * @param _controller             Address of controller contract\\n     */\\n    constructor(IController _controller) {\\n        controller = _controller;\\n    }\\n\\n    /* ============ Internal Functions ============ */\\n\\n    /**\\n     * Transfers tokens from an address (that has set allowance on the module).\\n     *\\n     * @param  _token          The address of the ERC20 token\\n     * @param  _from           The address to transfer from\\n     * @param  _to             The address to transfer to\\n     * @param  _quantity       The number of tokens to transfer\\n     */\\n    function transferFrom(IERC20 _token, address _from, address _to, uint256 _quantity) internal {\\n        ExplicitERC20.transferFrom(_token, _from, _to, _quantity);\\n    }\\n\\n    /**\\n     * Gets the integration for the module with the passed in name. Validates that the address is not empty\\n     */\\n    function getAndValidateAdapter(string memory _integrationName) internal view returns(address) {\\n        bytes32 integrationHash = getNameHash(_integrationName);\\n        return getAndValidateAdapterWithHash(integrationHash);\\n    }\\n\\n    /**\\n     * Gets the integration for the module with the passed in hash. Validates that the address is not empty\\n     */\\n    function getAndValidateAdapterWithHash(bytes32 _integrationHash) internal view returns(address) {\\n        address adapter = controller.getIntegrationRegistry().getIntegrationAdapterWithHash(\\n            address(this),\\n            _integrationHash\\n        );\\n\\n        require(adapter != address(0), \\\"Must be valid adapter\\\");\\n        return adapter;\\n    }\\n\\n    /**\\n     * Gets the total fee for this module of the passed in index (fee % * quantity)\\n     */\\n    function getModuleFee(uint256 _feeIndex, uint256 _quantity) internal view returns(uint256) {\\n        uint256 feePercentage = controller.getModuleFee(address(this), _feeIndex);\\n        return _quantity.preciseMul(feePercentage);\\n    }\\n\\n    /**\\n     * Pays the _feeQuantity from the _setToken denominated in _token to the protocol fee recipient\\n     */\\n    function payProtocolFeeFromSetToken(ISetToken _setToken, address _token, uint256 _feeQuantity) internal {\\n        if (_feeQuantity > 0) {\\n            _setToken.strictInvokeTransfer(_token, controller.feeRecipient(), _feeQuantity);\\n        }\\n    }\\n\\n    /**\\n     * Returns true if the module is in process of initialization on the SetToken\\n     */\\n    function isSetPendingInitialization(ISetToken _setToken) internal view returns(bool) {\\n        return _setToken.isPendingModule(address(this));\\n    }\\n\\n    /**\\n     * Returns true if the address is the SetToken's manager\\n     */\\n    function isSetManager(ISetToken _setToken, address _toCheck) internal view returns(bool) {\\n        return _setToken.manager() == _toCheck;\\n    }\\n\\n    /**\\n     * Returns true if SetToken must be enabled on the controller\\n     * and module is registered on the SetToken\\n     */\\n    function isSetValidAndInitialized(ISetToken _setToken) internal view returns(bool) {\\n        return controller.isSet(address(_setToken)) &&\\n            _setToken.isInitializedModule(address(this));\\n    }\\n\\n    /**\\n     * Hashes the string and returns a bytes32 value\\n     */\\n    function getNameHash(string memory _name) internal pure returns(bytes32) {\\n        return keccak256(bytes(_name));\\n    }\\n\\n    /* ============== Modifier Helpers ===============\\n     * Internal functions used to reduce bytecode size\\n     */\\n\\n    /**\\n     * Caller must SetToken manager and SetToken must be valid and initialized\\n     */\\n    function _validateOnlyManagerAndValidSet(ISetToken _setToken) internal view {\\n       require(isSetManager(_setToken, msg.sender), \\\"Must be the SetToken manager\\\");\\n       require(isSetValidAndInitialized(_setToken), \\\"Must be a valid and initialized SetToken\\\");\\n    }\\n\\n    /**\\n     * Caller must SetToken manager\\n     */\\n    function _validateOnlySetManager(ISetToken _setToken, address _caller) internal view {\\n        require(isSetManager(_setToken, _caller), \\\"Must be the SetToken manager\\\");\\n    }\\n\\n    /**\\n     * SetToken must be valid and initialized\\n     */\\n    function _validateOnlyValidAndInitializedSet(ISetToken _setToken) internal view {\\n        require(isSetValidAndInitialized(_setToken), \\\"Must be a valid and initialized SetToken\\\");\\n    }\\n\\n    /**\\n     * Caller must be initialized module and module must be enabled on the controller\\n     */\\n    function _validateOnlyModule(ISetToken _setToken) internal view {\\n        require(\\n            _setToken.moduleStates(msg.sender) == ISetToken.ModuleState.INITIALIZED,\\n            \\\"Only the module can call\\\"\\n        );\\n\\n        require(\\n            controller.isModule(msg.sender),\\n            \\\"Module must be enabled on controller\\\"\\n        );\\n    }\\n\\n    /**\\n     * SetToken must be in a pending state and module must be in pending state\\n     */\\n    function _validateOnlyValidAndPendingSet(ISetToken _setToken) internal view {\\n        require(controller.isSet(address(_setToken)), \\\"Must be controller-enabled SetToken\\\");\\n        require(isSetPendingInitialization(_setToken), \\\"Must be pending initialization\\\");\\n    }\\n}\\n\",\"keccak256\":\"0xd8f53dbf01d99fa65276d224f3a39249134052e54471668dbc44665c005e9746\",\"license\":\"Apache-2.0\"},\"contracts/lib/Position.sol\":{\"content\":\"/*\\n    Copyright 2020 Set Labs Inc.\\n\\n    Licensed under the Apache License, Version 2.0 (the \\\"License\\\");\\n    you may not use this file except in compliance with the License.\\n    You may obtain a copy of the License at\\n\\n    http://www.apache.org/licenses/LICENSE-2.0\\n\\n    Unless required by applicable law or agreed to in writing, software\\n    distributed under the License is distributed on an \\\"AS IS\\\" BASIS,\\n    WITHOUT WARRANTIES OR CONDITIONS OF ANY KIND, either express or implied.\\n    See the License for the specific language governing permissions and\\n    limitations under the License.\\n\\n    SPDX-License-Identifier: Apache-2.0\\n*/\\n\\npragma solidity ^0.8.25;\\n\\nimport { IERC20 } from \\\"@openzeppelin/contracts/token/ERC20/IERC20.sol\\\";\\n\\n\\nimport { ISetToken } from \\\"../interfaces/ISetToken.sol\\\";\\nimport { PreciseUnitMath } from \\\"../lib/PreciseUnitMath.sol\\\";\\n\\n\\n/**\\n * @title Position\\n * @author Set Protocol\\n *\\n * Collection of helper functions for handling and updating SetToken Positions\\n *\\n * CHANGELOG:\\n *  - Updated editExternalPosition to work when no external position is associated with module\\n */\\nlibrary Position {\\n\\n    using PreciseUnitMath for uint256;\\n\\n    /* ============ Helper ============ */\\n\\n    /**\\n     * Returns whether the SetToken has a default position for a given component (if the real unit is > 0)\\n     */\\n    function hasDefaultPosition(ISetToken _setToken, address _component) internal view returns(bool) {\\n        return _setToken.getDefaultPositionRealUnit(_component) > 0;\\n    }\\n\\n    /**\\n     * Returns whether the SetToken has an external position for a given component (if # of position modules is > 0)\\n     */\\n    function hasExternalPosition(ISetToken _setToken, address _component) internal view returns(bool) {\\n        return _setToken.getExternalPositionModules(_component).length > 0;\\n    }\\n\\n    /**\\n     * Returns whether the SetToken component default position real unit is greater than or equal to units passed in.\\n     */\\n    function hasSufficientDefaultUnits(ISetToken _setToken, address _component, uint256 _unit) internal view returns(bool) {\\n        return _setToken.getDefaultPositionRealUnit(_component) >= int256(_unit);\\n    }\\n\\n    /**\\n     * Returns whether the SetToken component external position is greater than or equal to the real units passed in.\\n     */\\n    function hasSufficientExternalUnits(\\n        ISetToken _setToken,\\n        address _component,\\n        address _positionModule,\\n        uint256 _unit\\n    )\\n        internal\\n        view\\n        returns(bool)\\n    {\\n       return _setToken.getExternalPositionRealUnit(_component, _positionModule) >= int256(_unit);\\n    }\\n\\n    /**\\n     * If the position does not exist, create a new Position and add to the SetToken. If it already exists,\\n     * then set the position units. If the new units is 0, remove the position. Handles adding/removing of\\n     * components where needed (in light of potential external positions).\\n     *\\n     * @param _setToken           Address of SetToken being modified\\n     * @param _component          Address of the component\\n     * @param _newUnit            Quantity of Position units - must be >= 0\\n     */\\n    function editDefaultPosition(ISetToken _setToken, address _component, uint256 _newUnit) internal {\\n        bool isPositionFound = hasDefaultPosition(_setToken, _component);\\n        if (!isPositionFound && _newUnit > 0) {\\n            // If there is no Default Position and no External Modules, then component does not exist\\n            if (!hasExternalPosition(_setToken, _component)) {\\n                _setToken.addComponent(_component);\\n            }\\n        } else if (isPositionFound && _newUnit == 0) {\\n            // If there is a Default Position and no external positions, remove the component\\n            if (!hasExternalPosition(_setToken, _component)) {\\n                _setToken.removeComponent(_component);\\n            }\\n        }\\n\\n        _setToken.editDefaultPositionUnit(_component, int256(_newUnit));\\n        _setToken.editDefaultPositionUnit(_component, int256(_newUnit));\\n    }\\n\\n    /**\\n     * Update an external position and remove and external positions or components if necessary. The logic flows as follows:\\n     * 1) If component is not already added then add component and external position.\\n     * 2) If component is added but no existing external position using the passed module exists then add the external position.\\n     * 3) If the existing position is being added to then just update the unit and data\\n     * 4) If the position is being closed and no other external positions or default positions are associated with the component\\n     *    then untrack the component and remove external position.\\n     * 5) If the position is being closed and other existing positions still exist for the component then just remove the\\n     *    external position.\\n     *\\n     * @param _setToken         SetToken being updated\\n     * @param _component        Component position being updated\\n     * @param _module           Module external position is associated with\\n     * @param _newUnit          Position units of new external position\\n     * @param _data             Arbitrary data associated with the position\\n     */\\n    function editExternalPosition(\\n        ISetToken _setToken,\\n        address _component,\\n        address _module,\\n        int256 _newUnit,\\n        bytes memory _data\\n    )\\n        internal\\n    {\\n        if (_newUnit != 0) {\\n            if (!_setToken.isComponent(_component)) {\\n                _setToken.addComponent(_component);\\n                _setToken.addExternalPositionModule(_component, _module);\\n            } else if (!_setToken.isExternalPositionModule(_component, _module)) {\\n                _setToken.addExternalPositionModule(_component, _module);\\n            }\\n            _setToken.editExternalPositionUnit(_component, _module, _newUnit);\\n            _setToken.editExternalPositionData(_component, _module, _data);\\n        } else {\\n            require(_data.length == 0, \\\"Passed data must be null\\\");\\n            // If no default or external position remaining then remove component from components array\\n            if (_setToken.getExternalPositionRealUnit(_component, _module) != 0) {\\n                address[] memory positionModules = _setToken.getExternalPositionModules(_component);\\n                if (_setToken.getDefaultPositionRealUnit(_component) == 0 && positionModules.length == 1) {\\n                    require(positionModules[0] == _module, \\\"External positions must be 0 to remove component\\\");\\n                    _setToken.removeComponent(_component);\\n                }\\n                _setToken.removeExternalPositionModule(_component, _module);\\n            }\\n        }\\n    }\\n\\n    /**\\n     * Get total notional amount of Default position\\n     *\\n     * @param _setTokenSupply     Supply of SetToken in precise units (10^18)\\n     * @param _positionUnit       Quantity of Position units\\n     *\\n     * @return                    Total notional amount of units\\n     */\\n    function getDefaultTotalNotional(uint256 _setTokenSupply, uint256 _positionUnit) internal pure returns (uint256) {\\n        return _setTokenSupply.preciseMul(_positionUnit);\\n    }\\n\\n    /**\\n     * Get position unit from total notional amount\\n     *\\n     * @param _setTokenSupply     Supply of SetToken in precise units (10^18)\\n     * @param _totalNotional      Total notional amount of component prior to\\n     * @return                    Default position unit\\n     */\\n    function getDefaultPositionUnit(uint256 _setTokenSupply, uint256 _totalNotional) internal pure returns (uint256) {\\n        return _totalNotional.preciseDiv(_setTokenSupply);\\n    }\\n\\n    /**\\n     * Get the total tracked balance - total supply * position unit\\n     *\\n     * @param _setToken           Address of the SetToken\\n     * @param _component          Address of the component\\n     * @return                    Notional tracked balance\\n     */\\n    function getDefaultTrackedBalance(ISetToken _setToken, address _component) internal view returns(uint256) {\\n        int256 positionUnit = _setToken.getDefaultPositionRealUnit(_component);\\n        return _setToken.totalSupply().preciseMul(uint256(positionUnit));\\n    }\\n\\n    /**\\n     * Calculates the new default position unit and performs the edit with the new unit\\n     *\\n     * @param _setToken                 Address of the SetToken\\n     * @param _component                Address of the component\\n     * @param _setTotalSupply           Current SetToken supply\\n     * @param _componentPreviousBalance Pre-action component balance\\n     * @return                          Current component balance\\n     * @return                          Previous position unit\\n     * @return                          New position unit\\n     */\\n    function calculateAndEditDefaultPosition(\\n        ISetToken _setToken,\\n        address _component,\\n        uint256 _setTotalSupply,\\n        uint256 _componentPreviousBalance\\n    )\\n        internal\\n        returns(uint256, uint256, uint256)\\n    {\\n        uint256 currentBalance = IERC20(_component).balanceOf(address(_setToken));\\n        uint256 positionUnit = uint256(_setToken.getDefaultPositionRealUnit(_component));\\n\\n        uint256 newTokenUnit;\\n        if (currentBalance > 0) {\\n            newTokenUnit = calculateDefaultEditPositionUnit(\\n                _setTotalSupply,\\n                _componentPreviousBalance,\\n                currentBalance,\\n                positionUnit\\n            );\\n        } else {\\n            newTokenUnit = 0;\\n        }\\n\\n        editDefaultPosition(_setToken, _component, newTokenUnit);\\n\\n        return (currentBalance, positionUnit, newTokenUnit);\\n    }\\n\\n    /**\\n     * Calculate the new position unit given total notional values pre and post executing an action that changes SetToken state\\n     * The intention is to make updates to the units without accidentally picking up airdropped assets as well.\\n     *\\n     * @param _setTokenSupply     Supply of SetToken in precise units (10^18)\\n     * @param _preTotalNotional   Total notional amount of component prior to executing action\\n     * @param _postTotalNotional  Total notional amount of component after the executing action\\n     * @param _prePositionUnit    Position unit of SetToken prior to executing action\\n     * @return                    New position unit\\n     */\\n    function calculateDefaultEditPositionUnit(\\n        uint256 _setTokenSupply,\\n        uint256 _preTotalNotional,\\n        uint256 _postTotalNotional,\\n        uint256 _prePositionUnit\\n    )\\n        internal\\n        pure\\n        returns (uint256)\\n    {\\n        // If pre action total notional amount is greater then subtract post action total notional and calculate new position units\\n        uint256 airdroppedAmount = _preTotalNotional - (_prePositionUnit.preciseMul(_setTokenSupply));\\n        return (_postTotalNotional- airdroppedAmount).preciseDiv(_setTokenSupply);\\n    }\\n}\\n\",\"keccak256\":\"0x7c1073c874e59063ad6c32d6b6d2e8a33e7f72dc0f7ce108df2d4743f905978c\",\"license\":\"Apache-2.0\"},\"contracts/lib/PreciseUnitMath.sol\":{\"content\":\"/*\\n    Copyright 2020 Set Labs Inc.\\n\\n    Licensed under the Apache License, Version 2.0 (the \\\"License\\\");\\n    you may not use this file except in compliance with the License.\\n    You may obtain a copy of the License at\\n\\n    http://www.apache.org/licenses/LICENSE-2.0\\n\\n    Unless required by applicable law or agreed to in writing, software\\n    distributed under the License is distributed on an \\\"AS IS\\\" BASIS,\\n    WITHOUT WARRANTIES OR CONDITIONS OF ANY KIND, either express or implied.\\n    See the License for the specific language governing permissions and\\n    limitations under the License.\\n\\n    SPDX-License-Identifier: Apache-2.0\\n*/\\n\\npragma solidity ^0.8.25;\\n\\n\\n/**\\n * @title PreciseUnitMath\\n * @author Set Protocol\\n *\\n * Arithmetic for fixed-point numbers with 18 decimals of precision. Some functions taken from\\n * dYdX's BaseMath library.\\n *\\n */\\nlibrary PreciseUnitMath {\\n\\n    // The number One in precise units.\\n    uint256 constant internal PRECISE_UNIT = 10 ** 18;\\n    int256 constant internal PRECISE_UNIT_INT = 10 ** 18;\\n\\n    // Max unsigned integer value\\n    uint256 constant internal MAX_UINT_256 = type(uint256).max;\\n    // Max and min signed integer value\\n    int256 constant internal MAX_INT_256 = type(int256).max;\\n    int256 constant internal MIN_INT_256 = type(int256).min;\\n\\n    /**\\n     * @dev Getter function since constants can't be read directly from libraries.\\n     */\\n    function preciseUnit() internal pure returns (uint256) {\\n        return PRECISE_UNIT;\\n    }\\n\\n    /**\\n     * @dev Getter function since constants can't be read directly from libraries.\\n     */\\n    function preciseUnitInt() internal pure returns (int256) {\\n        return PRECISE_UNIT_INT;\\n    }\\n\\n    /**\\n     * @dev Getter function since constants can't be read directly from libraries.\\n     */\\n    function maxUint256() internal pure returns (uint256) {\\n        return MAX_UINT_256;\\n    }\\n\\n    /**\\n     * @dev Getter function since constants can't be read directly from libraries.\\n     */\\n    function maxInt256() internal pure returns (int256) {\\n        return MAX_INT_256;\\n    }\\n\\n    /**\\n     * @dev Getter function since constants can't be read directly from libraries.\\n     */\\n    function minInt256() internal pure returns (int256) {\\n        return MIN_INT_256;\\n    }\\n\\n    /**\\n     * @dev Multiplies value a by value b (result is rounded down). It's assumed that the value b is the significand\\n     * of a number with 18 decimals precision.\\n     */\\n    function preciseMul(uint256 a, uint256 b) internal pure returns (uint256) {\\n        return (a * b) / PRECISE_UNIT;\\n    }\\n\\n    /**\\n     * @dev Multiplies value a by value b (result is rounded towards zero). It's assumed that the value b is the\\n     * significand of a number with 18 decimals precision.\\n     */\\n    function preciseMul(int256 a, int256 b) internal pure returns (int256) {\\n        return (a * b) / PRECISE_UNIT_INT;\\n    }\\n\\n    /**\\n     * @dev Multiplies value a by value b (result is rounded up). It's assumed that the value b is the significand\\n     * of a number with 18 decimals precision.\\n     */\\n    function preciseMulCeil(uint256 a, uint256 b) internal pure returns (uint256) {\\n        if (a == 0 || b == 0) {\\n            return 0;\\n        }\\n        return (((a * b) - 1) / PRECISE_UNIT) + 1;\\n    }\\n\\n    /**\\n     * @dev Divides value a by value b (result is rounded down).\\n     */\\n    function preciseDiv(uint256 a, uint256 b) internal pure returns (uint256) {\\n        return (a * PRECISE_UNIT) / b;\\n    }\\n\\n\\n    /**\\n     * @dev Divides value a by value b (result is rounded towards 0).\\n     */\\n    function preciseDiv(int256 a, int256 b) internal pure returns (int256) {\\n        return (a * PRECISE_UNIT_INT) / b;\\n    }\\n\\n    /**\\n     * @dev Divides value a by value b (result is rounded up or away from 0).\\n     */\\n    function preciseDivCeil(uint256 a, uint256 b) internal pure returns (uint256) {\\n        require(b != 0, \\\"Cant divide by 0\\\");\\n\\n        return a > 0 ? (((a * PRECISE_UNIT) - 1) / b) + 1 : 0;\\n    }\\n\\n    /**\\n     * @dev Divides value a by value b (result is rounded up or away from 0). When `a` is 0, 0 is\\n     * returned. When `b` is 0, method reverts with divide-by-zero error.\\n     */\\n    function preciseDivCeil(int256 a, int256 b) internal pure returns (int256) {\\n        require(b != 0, \\\"Cant divide by 0\\\");\\n\\n        a *= PRECISE_UNIT_INT;\\n        int256 c = a / b;\\n\\n        if (a % b != 0) {\\n            // a ^ b == 0 case is covered by the previous if statement, hence it won't resolve to --c\\n            (a ^ b > 0) ? ++c : --c;\\n        }\\n\\n        return c;\\n    }\\n\\n    /**\\n     * @dev Divides value a by value b (result is rounded down - positive numbers toward 0 and negative away from 0).\\n     */\\n    function divDown(int256 a, int256 b) internal pure returns (int256) {\\n        require(b != 0, \\\"Cant divide by 0\\\");\\n        require(a != MIN_INT_256 || b != -1, \\\"Invalid input\\\");\\n\\n        int256 result = a / b;\\n        if (a ^ b < 0 && a % b != 0) {\\n            result -= 1;\\n        }\\n\\n        return result;\\n    }\\n\\n    /**\\n     * @dev Multiplies value a by value b where rounding is towards the lesser number.\\n     * (positive values are rounded towards zero and negative values are rounded away from 0).\\n     */\\n    function conservativePreciseMul(int256 a, int256 b) internal pure returns (int256) {\\n        return divDown(a * b, PRECISE_UNIT_INT);\\n    }\\n\\n    /**\\n     * @dev Divides value a by value b where rounding is towards the lesser number.\\n     * (positive values are rounded towards zero and negative values are rounded away from 0).\\n     */\\n    function conservativePreciseDiv(int256 a, int256 b) internal pure returns (int256) {\\n        return divDown(a * PRECISE_UNIT_INT, b);\\n    }\\n\\n    /**\\n    * @dev Performs the power on a specified value, reverts on overflow.\\n    */\\n    function safePower(\\n        uint256 a,\\n        uint256 pow\\n    )\\n        internal\\n        pure\\n        returns (uint256)\\n    {\\n        require(a > 0, \\\"Value must be positive\\\");\\n\\n        uint256 result = 1;\\n        for (uint256 i = 0; i < pow; i++){\\n            uint256 previousResult = result;\\n\\n            // Using safemath multiplication prevents overflows\\n            result = previousResult * a;\\n        }\\n\\n        return result;\\n    }\\n\\n    /**\\n     * @dev Returns true if a =~ b within range, false otherwise.\\n     */\\n    function approximatelyEquals(uint256 a, uint256 b, uint256 range) internal pure returns (bool) {\\n        return a <= (b + range) && a >= (b - range);\\n    }\\n\\n    /**\\n     * Returns the absolute value of int256 `a` as a uint256\\n     */\\n    function abs(int256 a) internal pure returns (uint) {\\n        return a >= 0 ? uint256(a) : uint256(a * -1);\\n    }\\n\\n    /**\\n     * Returns the negation of a\\n     */\\n    function neg(int256 a) internal pure returns (int256) {\\n        require(a > MIN_INT_256, \\\"Inversion overflow\\\");\\n        return -a;\\n    }\\n}\\n\",\"keccak256\":\"0xaa6e22e2aa6274b8a41a83c1fc5a5b3243e59bef761f1a7d0b4cfcf48a2f8175\",\"license\":\"Apache-2.0\"},\"contracts/lib/ResourceIdentifier.sol\":{\"content\":\"/*\\n    Licensed under the Apache License, Version 2.0 (the \\\"License\\\");\\n    you may not use this file except in compliance with the License.\\n    You may obtain a copy of the License at\\n\\n    http://www.apache.org/licenses/LICENSE-2.0\\n\\n    Unless required by applicable law or agreed to in writing, software\\n    distributed under the License is distributed on an \\\"AS IS\\\" BASIS,\\n    WITHOUT WARRANTIES OR CONDITIONS OF ANY KIND, either express or implied.\\n    See the License for the specific language governing permissions and\\n    limitations under the License.\\n\\n    SPDX-License-Identifier: Apache-2.0\\n*/\\n\\npragma solidity ^0.8.25;\\n\\nimport { IController } from \\\"../interfaces/IController.sol\\\";\\nimport { IIntegrationRegistry } from \\\"../interfaces/IIntegrationRegistry.sol\\\";\\nimport { IPriceOracle } from \\\"../interfaces/IPriceOracle.sol\\\";\\nimport { ISetValuer } from \\\"../interfaces/ISetValuer.sol\\\";\\n\\n/**\\n * @title ResourceIdentifier\\n *\\n * A collection of utility functions to fetch information related to Resource contracts in the system\\n */\\nlibrary ResourceIdentifier {\\n\\n    // IntegrationRegistry will always be resource ID 0 in the system\\n    uint256 constant internal INTEGRATION_REGISTRY_RESOURCE_ID = 0;\\n    // PriceOracle will always be resource ID 1 in the system\\n    uint256 constant internal PRICE_ORACLE_RESOURCE_ID = 1;\\n    // SetValuer resource will always be resource ID 2 in the system\\n    uint256 constant internal SET_VALUER_RESOURCE_ID = 2;\\n\\n    /* ============ Internal ============ */\\n\\n    /**\\n     * Gets the instance of integration registry stored on Controller. Note: IntegrationRegistry is stored as index 0 on\\n     * the Controller\\n     */\\n    function getIntegrationRegistry(IController _controller) internal view returns (IIntegrationRegistry) {\\n        return IIntegrationRegistry(_controller.resourceId(INTEGRATION_REGISTRY_RESOURCE_ID));\\n    }\\n\\n    /**\\n     * Gets instance of price oracle on Controller. Note: PriceOracle is stored as index 1 on the Controller\\n     */\\n    function getPriceOracle(IController _controller) internal view returns (IPriceOracle) {\\n        return IPriceOracle(_controller.resourceId(PRICE_ORACLE_RESOURCE_ID));\\n    }\\n\\n    /**\\n     * Gets the instance of Set valuer on Controller. Note: SetValuer is stored as index 2 on the Controller\\n     */\\n    function getSetValuer(IController _controller) internal view returns (ISetValuer) {\\n        return ISetValuer(_controller.resourceId(SET_VALUER_RESOURCE_ID));\\n    }\\n}\\n\",\"keccak256\":\"0xde0ae8b07c11f602b5848656756b4de46cee7ff4744cc45f055a8380c674cbfc\",\"license\":\"Apache-2.0\"},\"contracts/modules/AuctionRebalanceModuleV1.sol\":{\"content\":\"/*\\n    Licensed under the Apache License, Version 2.0 (the \\\"License\\\");\\n    you may not use this file except in compliance with the License.\\n    You may obtain a copy of the License at\\n\\n    http://www.apache.org/licenses/LICENSE-2.0\\n\\n    Unless required by applicable law or agreed to in writing, software\\n    distributed under the License is distributed on an \\\"AS IS\\\" BASIS,\\n    WITHOUT WARRANTIES OR CONDITIONS OF ANY KIND, either express or implied.\\n    See the License for the specific language governing permissions and\\n    limitations under the License.\\n\\n    SPDX-License-Identifier: Apache-2.0\\n*/\\n\\npragma solidity ^0.8.25;\\n\\n\\nimport { IERC20 } from \\\"@openzeppelin/contracts/token/ERC20/IERC20.sol\\\";\\nimport { Math } from \\\"@openzeppelin/contracts/utils/math/Math.sol\\\";\\nimport { ReentrancyGuard } from \\\"@openzeppelin/contracts/utils/ReentrancyGuard.sol\\\";\\n\\nimport { AddressArrayUtils } from \\\"../lib/AddressArrayUtils.sol\\\";\\nimport { IAuctionPriceAdapterV1 } from \\\"../interfaces/IAuctionPriceAdapterV1.sol\\\";\\nimport { IController } from \\\"../interfaces/IController.sol\\\";\\nimport { Invoke } from \\\"../lib/Invoke.sol\\\";\\nimport { ISetToken } from \\\"../interfaces/ISetToken.sol\\\";\\nimport { ModuleBase } from \\\"../lib/ModuleBase.sol\\\";\\nimport { Position } from \\\"../lib/Position.sol\\\";\\nimport { PreciseUnitMath } from \\\"../lib/PreciseUnitMath.sol\\\";\\n\\n/**\\n * @title AuctionRebalanceModuleV1\\n * @notice Facilitates rebalances for index sets via single-asset auctions. Managers initiate\\n * rebalances specifying target allocations in precise units (scaled by 10^18), quote asset\\n * (e.g., WETH, USDC), auction parameters per component, and rebalance duration through\\n * startRebalance(). Bidders can participate via bid() for individual components. Excess\\n * quote asset can be managed by proportionally increasing the targets using raiseAssetTargets().\\n *\\n * @dev Compatible with StreamingFeeModule and BasicIssuanceModule. Review compatibility if used\\n * with additional modules.\\n * @dev WARNING: If rebalances don't lock the SetToken, there's potential for bids to be front-run\\n * by sizable issuance/redemption. This could lead to the SetToken not approaching its target allocation\\n * proportionately to the bid size. To counteract this risk, a supply cap can be applied to the SetToken,\\n * allowing regular issuance/redemption while preventing front-running with large issuance/redemption.\\n * @dev WARNING: This contract does NOT support ERC-777 component tokens or quote assets.\\n * @dev WARNING: Please note that the behavior of block.timestamp varies across different EVM chains.\\n * This contract does not incorporate additional checks for unique behavior or for elements like sequencer uptime.\\n * Ensure you understand these characteristics when interacting with the contract on different EVM chains.\\n */\\ncontract AuctionRebalanceModuleV1 is ModuleBase, ReentrancyGuard {\\n    using Position for uint256;\\n    using PreciseUnitMath for uint256;\\n    using Math for uint256;\\n    using Position for ISetToken;\\n    using Invoke for ISetToken;\\n    using AddressArrayUtils for address[];\\n    using AddressArrayUtils for IERC20[];\\n\\n    /* ============ Structs ============ */\\n\\n    struct AuctionExecutionParams {\\n        uint256 targetUnit;                      // Target quantity of the component in Set, in precise units (10 ** 18).\\n        string priceAdapterName;                 // Identifier for the price adapter to be used.\\n        bytes priceAdapterConfigData;            // Encoded data for configuring the chosen price adapter.\\n    }\\n\\n    struct BidPermissionInfo {\\n        bool isAnyoneAllowedToBid;               // Flag indicating if bids are open to anyone (true) or restricted (false).\\n        address[] biddersHistory;                // List of addresses that have been permissioned to bid.\\n        mapping(address => bool) bidAllowList;   // Mapping of addresses to a boolean indicating if they are allowed to bid.\\n    }\\n\\n    struct RebalanceInfo {\\n        IERC20 quoteAsset;                       // Reference to the ERC20 token used to quote auctions.\\n        uint256 rebalanceStartTime;              // Unix timestamp marking the start of the rebalance.\\n        uint256 rebalanceDuration;               // Duration of the rebalance in seconds.\\n        uint256 positionMultiplier;              // Position multiplier when target units were calculated.\\n        uint256 raiseTargetPercentage;           // Optional percentage to increase all target units if allowed, in precise units.\\n        address[] rebalanceComponents;           // List of component tokens involved in the rebalance.\\n    }\\n\\n    struct BidInfo {\\n        ISetToken setToken;                      // Instance of the SetToken contract that is being rebalanced.\\n        IERC20 sendToken;                        // The ERC20 token being sent in this bid.\\n        IERC20 receiveToken;                     // The ERC20 token being received in this bid.\\n        IAuctionPriceAdapterV1 priceAdapter;     // Instance of the price adapter contract used for this bid.\\n        bytes priceAdapterConfigData;            // Data for configuring the price adapter.\\n        bool isSellAuction;                      // Indicates if this is a sell auction (true) or a buy auction (false).\\n        uint256 auctionQuantity;                 // The quantity of the component being auctioned.\\n        uint256 componentPrice;                  // The price of the component as quoted by the price adapter.\\n        uint256 quantitySentBySet;               // Quantity of tokens sent by SetToken in this bid.\\n        uint256 quantityReceivedBySet;           // Quantity of tokens received by SetToken in this bid.\\n        uint256 preBidTokenSentBalance;          // Balance of tokens being sent by SetToken before the bid.\\n        uint256 preBidTokenReceivedBalance;      // Balance of tokens being received by SetToken before the bid.\\n        uint256 setTotalSupply;                  // Total supply of the SetToken at the time of the bid.\\n    }\\n\\n    /* ============ Events ============ */\\n\\n    /**\\n     * @dev Emitted when the target percentage increase is modified via setRaiseTargetPercentage()\\n     * @param setToken                   Reference to the SetToken undergoing rebalancing\\n     * @param newRaiseTargetPercentage   Updated percentage for potential target unit increases, in precise units (10 ** 18)\\n     */\\n    event RaiseTargetPercentageUpdated(\\n        ISetToken indexed setToken,\\n        uint256 newRaiseTargetPercentage\\n    );\\n\\n    /**\\n     * @dev Emitted upon calling raiseAssetTargets()\\n     * @param setToken                Reference to the SetToken undergoing rebalancing\\n     * @param newPositionMultiplier   Updated position multiplier for the SetToken rebalance\\n     */\\n    event AssetTargetsRaised(\\n        ISetToken indexed setToken,\\n        uint256 newPositionMultiplier\\n    );\\n\\n    /**\\n     * @dev Emitted upon toggling the bid permission setting via setAnyoneBid()\\n     * @param setToken               Reference to the SetToken undergoing rebalancing\\n     * @param isAnyoneAllowedToBid   Flag indicating if bids are open to all (true) or restricted (false)\\n     */\\n    event AnyoneBidUpdated(\\n        ISetToken indexed setToken,\\n        bool isAnyoneAllowedToBid\\n    );\\n\\n    /**\\n     * @dev Emitted when the bidding status of an address is changed via setBidderStatus()\\n     * @param setToken          Reference to the SetToken undergoing rebalancing\\n     * @param bidder            Address whose bidding permission status is toggled\\n     * @param isBidderAllowed   Flag indicating if the address is allowed (true) or not allowed (false) to bid\\n     */\\n    event BidderStatusUpdated(\\n        ISetToken indexed setToken,\\n        address indexed bidder,\\n        bool isBidderAllowed\\n    );\\n\\n    /**\\n     * @dev Emitted when a rebalance is initiated using the startRebalance() function.\\n     * @param setToken                    Instance of the SetToken contract that is undergoing rebalancing.\\n     * @param quoteAsset                  The ERC20 token that is used as a quote currency for the auctions.\\n     * @param isSetTokenLocked            Indicates if the rebalance process locks the SetToken (true) or not (false).\\n     * @param rebalanceDuration           Duration of the rebalance process in seconds.\\n     * @param initialPositionMultiplier   Position multiplier when target units were calculated.\\n     * @param componentsInvolved          Array of addresses of the component tokens involved in the rebalance.\\n     * @param auctionParameters           Array of AuctionExecutionParams structs, containing auction parameters for each component token.\\n     */\\n    event RebalanceStarted(\\n        ISetToken indexed setToken,\\n        IERC20 indexed quoteAsset,\\n        bool isSetTokenLocked,\\n        uint256 rebalanceDuration,\\n        uint256 initialPositionMultiplier,\\n        address[] componentsInvolved,\\n        AuctionExecutionParams[] auctionParameters\\n    );\\n\\n    /**\\n     * @dev Emitted upon execution of a bid via the bid() function.\\n     * @param setToken                   Instance of the SetToken contract that is being rebalanced.\\n     * @param sendToken                  The ERC20 token that is being sent by the bidder.\\n     * @param receiveToken               The ERC20 token that is being received by the bidder.\\n     * @param bidder                     The address of the bidder.\\n     * @param priceAdapter               Instance of the price adapter contract used for this bid.\\n     * @param isSellAuction              Indicates if this is a sell auction (true) or a buy auction (false).\\n     * @param price                      The price of the component in precise units (10 ** 18).\\n     * @param netQuantitySentBySet       The net amount of tokens sent by the SetToken in the bid.\\n     * @param netQuantityReceivedBySet   The net amount of tokens received by the SetToken in the bid.\\n     * @param protocolFee                The amount of the received token allocated as a protocol fee.\\n     * @param setTotalSupply             The total supply of the SetToken at the time of the bid.\\n     */\\n    event BidExecuted(\\n        ISetToken indexed setToken,\\n        address indexed sendToken,\\n        address indexed receiveToken,\\n        address bidder,\\n        IAuctionPriceAdapterV1 priceAdapter,\\n        bool isSellAuction,\\n        uint256 price,\\n        uint256 netQuantitySentBySet,\\n        uint256 netQuantityReceivedBySet,\\n        uint256 protocolFee,\\n        uint256 setTotalSupply\\n    );\\n\\n    /**\\n     * @dev Emitted when a locked rebalance is concluded early via the unlock() function.\\n     * @param setToken            Instance of the SetToken contract that is being rebalanced.\\n     */\\n    event LockedRebalanceEndedEarly(\\n        ISetToken indexed setToken\\n    );\\n\\n\\n    /* ============ Constants ============ */\\n\\n    uint256 private constant AUCTION_MODULE_V1_PROTOCOL_FEE_INDEX = 0;   // Index of the protocol fee percentage assigned to this module in the Controller.\\n\\n    /* ============ State Variables ============ */\\n\\n    mapping(ISetToken => mapping(IERC20 => AuctionExecutionParams)) public executionInfo;   // Maps SetToken to component tokens and their respective auction execution parameters.\\n    mapping(ISetToken => BidPermissionInfo) public permissionInfo;                          // Maps SetToken to information regarding bid permissions during a rebalance.\\n    mapping(ISetToken => RebalanceInfo) public rebalanceInfo;                               // Maps SetToken to data relevant to the most recent rebalance.\\n\\n    /* ============ Modifiers ============ */\\n\\n    modifier onlyAllowedBidder(ISetToken _setToken) {\\n        _validateOnlyAllowedBidder(_setToken);\\n        _;\\n    }\\n\\n    /* ============ Constructor ============ */\\n\\n    constructor(IController _controller) ModuleBase(_controller) {}\\n\\n    /* ============ External Functions ============ */\\n\\n    /**\\n     * @dev MANAGER ONLY: Initiates the rebalance process by setting target allocations for the SetToken. Opens auctions\\n     * for filling by the Set's designated bidders. The function takes in new components to be added with their target units\\n     * and existing components with updated target units (set to 0 if removing). A positionMultiplier is supplied to adjust\\n     * target units, e.g., in cases where fee accrual affects the positionMultiplier of the SetToken, ensuring proportional\\n     * allocation among components. If target allocations are not met within the specified duration, the rebalance concludes\\n     * with the allocations achieved.\\n     *\\n     * @dev WARNING: If rebalances don't lock the SetToken, enforce a supply cap on the SetToken to prevent front-running.\\n     *\\n     * @param _setToken                     The SetToken to be rebalanced.\\n     * @param _quoteAsset                   ERC20 token used as the quote asset in auctions.\\n     * @param _newComponents                Addresses of new components to be added.\\n     * @param _newComponentsAuctionParams   AuctionExecutionParams for new components, indexed corresponding to _newComponents.\\n     * @param _oldComponentsAuctionParams   AuctionExecutionParams for existing components, indexed corresponding to\\n     *                                      the current component positions. Set to 0 for components being removed.\\n     * @param _shouldLockSetToken           Indicates if the rebalance should lock the SetToken.\\n     * @param _rebalanceDuration            Duration of the rebalance in seconds.\\n     * @param _initialPositionMultiplier    Position multiplier at the start of the rebalance.\\n     */\\n    function startRebalance(\\n        ISetToken _setToken,\\n        IERC20 _quoteAsset,\\n        address[] calldata _newComponents,\\n        AuctionExecutionParams[] memory _newComponentsAuctionParams,\\n        AuctionExecutionParams[] memory _oldComponentsAuctionParams,\\n        bool _shouldLockSetToken,\\n        uint256 _rebalanceDuration,\\n        uint256 _initialPositionMultiplier\\n    )\\n        external\\n        onlyManagerAndValidSet(_setToken)\\n    {\\n        // Lock the SetToken if the _shouldLockSetToken flag is true and the SetToken is not already locked by this module\\n        if (_shouldLockSetToken && _setToken.locker() != address(this)) {\\n            _setToken.lock();\\n        }\\n\\n        // Aggregate components and auction parameters\\n        (address[] memory allComponents, AuctionExecutionParams[] memory allAuctionParams) = _aggregateComponentsAndAuctionParams(\\n            _setToken.getComponents(),\\n            _newComponents,\\n            _newComponentsAuctionParams,\\n            _oldComponentsAuctionParams\\n        );\\n\\n        // Set the execution information\\n        for (uint256 i = 0; i < allComponents.length; i++) {\\n            require(!_setToken.hasExternalPosition(allComponents[i]), \\\"External positions not allowed\\\");\\n            executionInfo[_setToken][IERC20(allComponents[i])] = allAuctionParams[i];\\n        }\\n\\n        // Set the rebalance information\\n        rebalanceInfo[_setToken].quoteAsset = _quoteAsset;\\n        rebalanceInfo[_setToken].rebalanceStartTime = block.timestamp;\\n        rebalanceInfo[_setToken].rebalanceDuration = _rebalanceDuration;\\n        rebalanceInfo[_setToken].positionMultiplier = _initialPositionMultiplier;\\n        rebalanceInfo[_setToken].rebalanceComponents = allComponents;\\n\\n        // Emit the RebalanceStarted event\\n        emit RebalanceStarted(_setToken, _quoteAsset, _shouldLockSetToken, _rebalanceDuration, _initialPositionMultiplier, allComponents, allAuctionParams);\\n    }\\n\\n   /**\\n     * @dev ACCESS LIMITED: Only approved addresses can call this function unless isAnyoneAllowedToBid is enabled. This function\\n     * is used to push the current component units closer to the target units defined in startRebalance().\\n     *\\n     * Bidders specify the amount of the component they intend to buy or sell, and also specify the maximum/minimum amount\\n     * of the quote asset they are willing to spend/receive. If the component amount is max uint256, the bid will fill\\n     * the remaining amount to reach the target.\\n     *\\n     * The auction parameters, which are set by the manager, are used to determine the price of the component. Any bids that\\n     * either don't move the component units towards the target, or overshoot the target, will be reverted.\\n     *\\n     * If protocol fees are enabled, they are collected in the token received in a bid.\\n     *\\n     * SELL AUCTIONS:\\n     * At the start of the rebalance, sell auctions are available to be filled in their full size.\\n     *\\n     * BUY AUCTIONS:\\n     * Buy auctions can be filled up to the amount of quote asset available in the SetToken. This means that if the SetToken\\n     * does not contain the quote asset as a component, buy auctions cannot be bid on until sell auctions have been executed\\n     * and there is quote asset available in the SetToken.\\n     *\\n     * @param _setToken          The SetToken to be rebalanced.\\n     * @param _component         The component for which the auction is to be bid on.\\n     * @param _quoteAsset        The ERC20 token expected to be used as the quote asset by the bidder\\n     * @param _componentAmount   The amount of component in the bid.\\n     * @param _quoteAssetLimit   The maximum or minimum amount of quote asset that can be spent or received during the bid.\\n     * @param _isSellAuction     The direction of the auction expected by the bidder\\n     */\\n    function bid(\\n        ISetToken _setToken,\\n        IERC20 _component,\\n        IERC20 _quoteAsset,\\n        uint256 _componentAmount,\\n        uint256 _quoteAssetLimit,\\n        bool _isSellAuction\\n    )\\n        external\\n        nonReentrant\\n        onlyAllowedBidder(_setToken)\\n    {\\n        // Validate whether the bid targets are legitimate\\n        _validateBidTargets(_setToken, _component, _quoteAsset, _componentAmount);\\n\\n        // Create the bid information structure\\n        BidInfo memory bidInfo = _createBidInfo(_setToken, _component, _componentAmount, _quoteAssetLimit, _isSellAuction);\\n\\n        // Execute the token transfer specified in the bid information\\n        _executeBid(bidInfo);\\n\\n        // Accrue protocol fee and store the amount\\n        uint256 protocolFeeAmount = _accrueProtocolFee(bidInfo);\\n\\n        // Update the position state and store the net amounts\\n        (uint256 netAmountSent, uint256 netAmountReceived) = _updatePositionState(bidInfo);\\n\\n        // Emit the BidExecuted event\\n        emit BidExecuted(\\n            bidInfo.setToken,\\n            address(bidInfo.sendToken),\\n            address(bidInfo.receiveToken),\\n            msg.sender,\\n            bidInfo.priceAdapter,\\n            bidInfo.isSellAuction,\\n            bidInfo.componentPrice,\\n            netAmountSent,\\n            netAmountReceived,\\n            protocolFeeAmount,\\n            bidInfo.setTotalSupply\\n        );\\n    }\\n\\n    /**\\n     * @dev ACCESS LIMITED: Increases asset targets uniformly when all target units have been met but there is remaining quote asset.\\n     * Can be called multiple times if necessary. Targets are increased by the percentage specified by raiseAssetTargetsPercentage set by the manager.\\n     * This helps in reducing tracking error and providing greater granularity in reaching an equilibrium between the excess quote asset\\n     * and the components to be purchased. However, excessively raising targets may result in under-allocating to the quote asset as more of\\n     * it is spent buying components to meet the new targets.\\n     *\\n     * @param _setToken   The SetToken to be rebalanced.\\n     */\\n    function raiseAssetTargets(ISetToken _setToken)\\n        external\\n        onlyAllowedBidder(_setToken)\\n        virtual\\n    {\\n        // Ensure the rebalance is in progress\\n        require(!_isRebalanceDurationElapsed(_setToken), \\\"Rebalance must be in progress\\\");\\n\\n        // Ensure that all targets are met and there is excess quote asset\\n        require(_canRaiseAssetTargets(_setToken), \\\"Targets not met or quote asset =~ 0\\\");\\n\\n        // Calculate the new positionMultiplier\\n        uint256 newPositionMultiplier = rebalanceInfo[_setToken].positionMultiplier.preciseDiv(\\n            PreciseUnitMath.preciseUnit() + rebalanceInfo[_setToken].raiseTargetPercentage\\n        );\\n\\n        // Update the positionMultiplier in the RebalanceInfo struct\\n        rebalanceInfo[_setToken].positionMultiplier = newPositionMultiplier;\\n\\n        // Emit the AssetTargetsRaised event\\n        emit AssetTargetsRaised(_setToken, newPositionMultiplier);\\n    }\\n\\n    /**\\n     * @dev Unlocks the SetToken after rebalancing. Can be called once the rebalance duration has elapsed.\\n     * Can only be called before the rebalance duration has elapsed if all targets are met, there is excess\\n     * or at-target quote asset, and raiseTargetPercentage is zero. Resets the raiseTargetPercentage to zero.\\n     *\\n     * @param _setToken The SetToken to be unlocked.\\n     */\\n    function unlock(ISetToken _setToken) external {\\n        bool isRebalanceDurationElapsed_ = _isRebalanceDurationElapsed(_setToken);\\n        bool canUnlockEarly_ = _canUnlockEarly(_setToken);\\n\\n        // Ensure that either the rebalance duration has elapsed or the conditions for early unlock are met\\n        require(isRebalanceDurationElapsed_ || canUnlockEarly_, \\\"Cannot unlock early unless all targets are met and raiseTargetPercentage is zero\\\");\\n\\n        // If unlocking early, update the state\\n        if (canUnlockEarly_) {\\n            delete rebalanceInfo[_setToken].rebalanceDuration;\\n            emit LockedRebalanceEndedEarly(_setToken);\\n        }\\n\\n        // Reset the raiseTargetPercentage to zero\\n        rebalanceInfo[_setToken].raiseTargetPercentage = 0;\\n\\n        // Unlock the SetToken\\n        _setToken.unlock();\\n    }\\n\\n    /**\\n     * @dev MANAGER ONLY: Sets the percentage by which the target units for all components can be increased.\\n     * Can be called at any time by the manager.\\n     *\\n     * @param _setToken               The SetToken to be rebalanced.\\n     * @param _raiseTargetPercentage  The percentage (in precise units) by which the target units can be increased.\\n     */\\n    function setRaiseTargetPercentage(\\n        ISetToken _setToken,\\n        uint256 _raiseTargetPercentage\\n    )\\n        external\\n        onlyManagerAndValidSet(_setToken)\\n    {\\n        // Update the raise target percentage in the RebalanceInfo struct\\n        rebalanceInfo[_setToken].raiseTargetPercentage = _raiseTargetPercentage;\\n\\n        // Emit an event to log the updated raise target percentage\\n        emit RaiseTargetPercentageUpdated(_setToken, _raiseTargetPercentage);\\n    }\\n\\n    /**\\n     * @dev MANAGER ONLY: Toggles the permission status of specified addresses to call the `bid()` function.\\n     * The manager can call this function at any time.\\n     *\\n     * @param _setToken  The SetToken being rebalanced.\\n     * @param _bidders   An array of addresses whose bidding permission status is to be toggled.\\n     * @param _statuses  An array of booleans indicating the new bidding permission status for each corresponding address in `_bidders`.\\n     */\\n    function setBidderStatus(\\n        ISetToken _setToken,\\n        address[] memory _bidders,\\n        bool[] memory _statuses\\n    )\\n        external\\n        onlyManagerAndValidSet(_setToken)\\n    {\\n        // Validate that the input arrays have the same length\\n        _bidders.validatePairsWithArray(_statuses);\\n\\n        // Iterate through the input arrays and update the permission status for each bidder\\n        for (uint256 i = 0; i < _bidders.length; i++) {\\n            _updateBiddersHistory(_setToken, _bidders[i], _statuses[i]);\\n            permissionInfo[_setToken].bidAllowList[_bidders[i]] = _statuses[i];\\n\\n            // Emit an event to log the updated permission status\\n            emit BidderStatusUpdated(_setToken, _bidders[i], _statuses[i]);\\n        }\\n    }\\n\\n    /**\\n     * @dev MANAGER ONLY: Toggles whether or not anyone is allowed to call the `bid()` function.\\n     * If set to true, it bypasses the bidAllowList, allowing any address to call the `bid()` function.\\n     * The manager can call this function at any time.\\n     *\\n     * @param _setToken  The SetToken instance.\\n     * @param _status    A boolean indicating if anyone can bid.\\n     */\\n    function setAnyoneBid(\\n        ISetToken _setToken,\\n        bool _status\\n    )\\n        external\\n        onlyManagerAndValidSet(_setToken)\\n    {\\n        // Update the anyoneBid status in the PermissionInfo struct\\n        permissionInfo[_setToken].isAnyoneAllowedToBid = _status;\\n\\n        // Emit an event to log the updated anyoneBid status\\n        emit AnyoneBidUpdated(_setToken, _status);\\n    }\\n\\n\\n    /**\\n     * @dev MANAGER ONLY: Initializes the module for a SetToken, enabling access to AuctionModuleV1 for rebalances.\\n     * Retrieves the current units for each asset in the Set and sets the targetUnit to match the current unit, effectively\\n     * preventing any bidding until `startRebalance()` is explicitly called. The position multiplier is also logged to ensure that\\n     * any changes to the position multiplier do not unintentionally open the Set for rebalancing.\\n     *\\n     * @param _setToken   Address of the Set Token\\n     */\\n    function initialize(ISetToken _setToken)\\n        external\\n        onlySetManager(_setToken, msg.sender)\\n        onlyValidAndPendingSet(_setToken)\\n    {\\n        ISetToken.Position[] memory positions = _setToken.getPositions();\\n\\n        for (uint256 i = 0; i < positions.length; i++) {\\n            ISetToken.Position memory position = positions[i];\\n            require(position.positionState == 0, \\\"External positions not allowed\\\");\\n            executionInfo[_setToken][IERC20(position.component)].targetUnit = uint256(position.unit);\\n        }\\n\\n        rebalanceInfo[_setToken].positionMultiplier = uint256(_setToken.positionMultiplier());\\n        _setToken.initializeModule();\\n    }\\n\\n\\n    /**\\n     * @dev Called by a SetToken to notify that this module was removed from the SetToken.\\n     * Clears the `rebalanceInfo` and `permissionsInfo` of the calling SetToken.\\n     * IMPORTANT: The auction execution settings of the SetToken, including auction parameters,\\n     * are NOT DELETED. Restoring a previously removed module requires careful initialization of\\n     * the execution settings.\\n     */\\n    function removeModule() external override {\\n        BidPermissionInfo storage tokenPermissionInfo = permissionInfo[ISetToken(msg.sender)];\\n\\n        for (uint256 i = 0; i < tokenPermissionInfo.biddersHistory.length; i++) {\\n            tokenPermissionInfo.bidAllowList[tokenPermissionInfo.biddersHistory[i]] = false;\\n        }\\n\\n        delete rebalanceInfo[ISetToken(msg.sender)];\\n        delete permissionInfo[ISetToken(msg.sender)];\\n    }\\n\\n\\n    /* ============ External View Functions ============ */\\n\\n    /**\\n     * @dev Checks externally if the rebalance duration has elapsed for the given SetToken.\\n     *\\n     * @param _setToken The SetToken whose rebalance duration is being checked.\\n     * @return bool True if the rebalance duration has elapsed; false otherwise.\\n     */\\n    function isRebalanceDurationElapsed(ISetToken _setToken) external view returns (bool) {\\n        return _isRebalanceDurationElapsed(_setToken);\\n    }\\n\\n    /**\\n     * @dev Retrieves the array of components that are involved in the rebalancing of the given SetToken.\\n     *\\n     * @param _setToken    Instance of the SetToken.\\n     *\\n     * @return address[]   Array of component addresses involved in the rebalance.\\n     */\\n    function getRebalanceComponents(ISetToken _setToken)\\n        external\\n        view\\n        onlyValidAndInitializedSet(_setToken)\\n        returns (address[] memory)\\n    {\\n        return rebalanceInfo[_setToken].rebalanceComponents;\\n    }\\n\\n    /**\\n     * @dev Calculates the quantity of a component involved in the rebalancing of the given SetToken,\\n     * and determines if the component is being bought or sold.\\n     *\\n     * @param _setToken    Instance of the SetToken being rebalanced.\\n     * @param _component   Instance of the IERC20 component to bid on.\\n     *\\n     * @return isSellAuction       Indicates if this is a sell auction (true) or a buy auction (false).\\n     * @return componentQuantity   Quantity of the component involved in the bid.\\n     */\\n    function getAuctionSizeAndDirection(\\n        ISetToken _setToken,\\n        IERC20 _component\\n    )\\n        external\\n        view\\n        onlyValidAndInitializedSet(_setToken)\\n        returns (bool isSellAuction, uint256 componentQuantity)\\n    {\\n        require(\\n            rebalanceInfo[_setToken].rebalanceComponents.contains(address(_component)),\\n            \\\"Component not part of rebalance\\\"\\n        );\\n\\n        uint256 totalSupply = _setToken.totalSupply();\\n        return _calculateAuctionSizeAndDirection(_setToken, _component, totalSupply);\\n    }\\n\\n    /**\\n     * @dev Retrieves the balance of the quote asset for a given SetToken.\\n     *\\n     * @param _setToken The SetToken whose quote asset balance is being retrieved.\\n     * @return uint256 The balance of the quote asset.\\n     */\\n    function getQuoteAssetBalance(ISetToken _setToken) external view returns (uint256) {\\n        RebalanceInfo storage rebalance = rebalanceInfo[_setToken];\\n        return IERC20(rebalance.quoteAsset).balanceOf(address(_setToken));\\n    }\\n\\n    /**\\n     * @dev Generates a preview of the bid for a given component in the rebalancing of the SetToken.\\n     * It calculates the quantity of the component that will be exchanged and the direction of exchange.\\n     *\\n     * @param _setToken             Instance of the SetToken being rebalanced.\\n     * @param _component            Instance of the component auction to bid on.\\n     * @param _quoteAsset           The ERC20 token expected to be used as the quote asset by the bidder\\n     * @param _componentQuantity    Quantity of the component involved in the bid.\\n     * @param _quoteQuantityLimit   Maximum or minimum amount of quote asset spent or received during the bid.\\n     * @param _isSellAuction     The direction of the auction expected by the bidder\\n     *\\n     * @return BidInfo              Struct containing data for the bid.\\n     */\\n    function getBidPreview(\\n        ISetToken _setToken,\\n        IERC20 _component,\\n        IERC20 _quoteAsset,\\n        uint256 _componentQuantity,\\n        uint256 _quoteQuantityLimit,\\n        bool _isSellAuction\\n    )\\n        external\\n        view\\n        onlyValidAndInitializedSet(_setToken)\\n        returns (BidInfo memory)\\n    {\\n        _validateBidTargets(_setToken, _component, _quoteAsset, _componentQuantity);\\n        BidInfo memory bidInfo = _createBidInfo(_setToken, _component, _componentQuantity, _quoteQuantityLimit, _isSellAuction);\\n\\n        return bidInfo;\\n    }\\n\\n    /**\\n     * @dev Checks externally if the conditions for early unlock are met.\\n     *\\n     * @param _setToken The SetToken being checked.\\n     * @return bool True if early unlock conditions are met; false otherwise.\\n     */\\n    function canUnlockEarly(ISetToken _setToken) external view returns (bool) {\\n        return _canUnlockEarly(_setToken);\\n    }\\n\\n    /**\\n     * @dev Checks externally if the conditions to raise asset targets are met.\\n     *\\n     * @param _setToken The SetToken being checked.\\n     * @return bool True if conditions to raise asset targets are met; false otherwise.\\n     */\\n    function canRaiseAssetTargets(ISetToken _setToken) external view returns (bool) {\\n        return _canRaiseAssetTargets(_setToken);\\n    }\\n\\n    /**\\n     * @dev Checks externally if all target units for components have been met.\\n     *\\n     * @param _setToken Instance of the SetToken to be rebalanced.\\n     * @return bool True if all component's target units have been met; false otherwise.\\n     */\\n    function allTargetsMet(ISetToken _setToken) external view returns (bool) {\\n        return _allTargetsMet(_setToken);\\n    }\\n\\n    /**\\n     * @dev Checks externally if the quote asset is in excess or at target.\\n     *\\n     * @param _setToken The SetToken being checked.\\n     * @return bool True if the quote asset is in excess or at target; false otherwise.\\n     */\\n    function isQuoteAssetExcessOrAtTarget(ISetToken _setToken) external view returns (bool) {\\n        return _isQuoteAssetExcessOrAtTarget(_setToken);\\n    }\\n\\n    /**\\n     * @dev Determines whether the given bidder address is allowed to participate in the auction.\\n     *\\n     * @param _setToken   Instance of the SetToken for which the bid is being placed.\\n     * @param _bidder     Address of the bidder.\\n     *\\n     * @return bool       True if the given `_bidder` is permitted to bid, false otherwise.\\n     */\\n    function isAllowedBidder(ISetToken _setToken, address _bidder)\\n        external\\n        view\\n        onlyValidAndInitializedSet(_setToken)\\n        returns (bool)\\n    {\\n        return _isAllowedBidder(_setToken, _bidder);\\n    }\\n\\n    /**\\n     * @dev Retrieves the list of addresses that are permitted to participate in the auction by calling `bid()`.\\n     *\\n     * @param _setToken           Instance of the SetToken for which to retrieve the list of allowed bidders.\\n     *\\n     * @return address[]          Array of addresses representing the allowed bidders.\\n     */\\n    function getAllowedBidders(ISetToken _setToken)\\n        external\\n        view\\n        onlyValidAndInitializedSet(_setToken)\\n        returns (address[] memory)\\n    {\\n        return permissionInfo[_setToken].biddersHistory;\\n    }\\n\\n    /* ============ Internal Functions ============ */\\n\\n    /**\\n     * @dev Aggregates the current SetToken components with the new components and validates their auction parameters.\\n     * Ensures that the sizes of the new components and new auction parameters arrays are the same, and that the number of current component auction parameters\\n     * matches the number of current components. Additionally, it validates that the price adapter exists, the price adapter configuration data is valid for the adapter,\\n     * and the target unit is greater than zero for new components. The function reverts if there is a duplicate component or if the array lengths are mismatched.\\n     *\\n     * @param _currentComponents          The current set of SetToken components.\\n     * @param _newComponents              The new components to add to the allocation.\\n     * @param _newComponentsAuctionParams The auction params for the new components, corresponding by index.\\n     * @param _oldComponentsAuctionParams The auction params for the old components, corresponding by index.\\n     * @return aggregateComponents        Combined array of current and new components, without duplicates.\\n     * @return aggregateAuctionParams     Combined array of old and new component auction params, without duplicates.\\n     */\\n    function _aggregateComponentsAndAuctionParams(\\n        address[] memory _currentComponents,\\n        address[] calldata _newComponents,\\n        AuctionExecutionParams[] memory _newComponentsAuctionParams,\\n        AuctionExecutionParams[] memory _oldComponentsAuctionParams\\n    )\\n        internal\\n        view\\n        returns (address[] memory aggregateComponents, AuctionExecutionParams[] memory aggregateAuctionParams)\\n    {\\n        // Validate input arrays: new components and new auction params must have the same length,\\n        // old components and old auction params must have the same length.\\n        require(_newComponents.length == _newComponentsAuctionParams.length, \\\"New components and params length mismatch\\\");\\n        require(_currentComponents.length == _oldComponentsAuctionParams.length, \\\"Old components and params length mismatch\\\");\\n\\n        // Aggregate the current components and new components\\n        aggregateComponents = _currentComponents.extend(_newComponents);\\n\\n        // Ensure there are no duplicates in the aggregated components\\n        require(!aggregateComponents.hasDuplicate(), \\\"Cannot have duplicate components\\\");\\n\\n        // Aggregate and validate the old and new auction params\\n        aggregateAuctionParams = _concatAndValidateAuctionParams(_oldComponentsAuctionParams, _newComponentsAuctionParams);\\n    }\\n\\n    /**\\n     * @dev Validates that the component is an eligible target for bids during the rebalance. Bids cannot be placed explicitly\\n     * on the rebalance quote asset, it may only be implicitly bid by being the quote asset for other component bids.\\n     *\\n     * @param _setToken          The SetToken instance involved in the rebalance.\\n     * @param _component         The component to be validated.\\n     * @param _quoteAsset        The ERC20 token expected to be used as the quote asset by the bidder\\n     * @param _componentAmount   The amount of component in the bid.\\n     */\\n    function _validateBidTargets(\\n        ISetToken _setToken,\\n        IERC20 _component,\\n        IERC20 _quoteAsset,\\n        uint256 _componentAmount\\n    )\\n        internal\\n        view\\n    {\\n        IERC20 quoteAsset = rebalanceInfo[_setToken].quoteAsset;\\n        // Ensure that the component is not the quote asset, as it cannot be explicitly bid on.\\n        require(_component != quoteAsset, \\\"Cannot bid explicitly on Quote Asset\\\");\\n\\n        // Ensure that the auction quote asset matches the quote asset expected by the bidder.\\n        require(_quoteAsset == quoteAsset, \\\"Quote asset mismatch\\\");\\n\\n        // Ensure that the component is part of the rebalance.\\n        require(rebalanceInfo[_setToken].rebalanceComponents.contains(address(_component)), \\\"Component not part of rebalance\\\");\\n\\n        // Ensure that the SetToken doesn't have an external position for the component.\\n        require(!_setToken.hasExternalPosition(address(_component)), \\\"External positions not allowed\\\");\\n\\n        // Ensure that the rebalance is in progress.\\n        require(!_isRebalanceDurationElapsed(_setToken), \\\"Rebalance must be in progress\\\");\\n\\n        // Ensure that the component amount is greater than zero.\\n        require(_componentAmount > 0, \\\"Component amount must be > 0\\\");\\n    }\\n\\n    /**\\n     * @dev Creates and returns a BidInfo struct. The function reverts if the auction target has already been met.\\n     *\\n     * @param _setToken             The SetToken instance involved in the rebalance.\\n     * @param _component            The component to bid on.\\n     * @param _componentQuantity    The amount of component in the bid.\\n     * @param _quoteQuantityLimit   The max/min amount of quote asset to be spent/received during the bid.\\n     * @param _isSellAuction     The direction of the auction expected by the bidder\\n     *\\n     * @return bidInfo              Struct containing data for the bid.\\n     */\\n    function _createBidInfo(\\n        ISetToken _setToken,\\n        IERC20 _component,\\n        uint256 _componentQuantity,\\n        uint256 _quoteQuantityLimit,\\n        bool _isSellAuction\\n    )\\n        internal\\n        view\\n        returns (BidInfo memory bidInfo)\\n    {\\n        // Populate the bid info structure with basic information.\\n        bidInfo.setToken = _setToken;\\n        bidInfo.setTotalSupply = _setToken.totalSupply();\\n        bidInfo.priceAdapter = _getAuctionPriceAdapter(_setToken, _component);\\n        bidInfo.priceAdapterConfigData = executionInfo[_setToken][_component].priceAdapterConfigData;\\n\\n        // Calculate the auction size and direction.\\n        (bidInfo.isSellAuction, bidInfo.auctionQuantity) = _calculateAuctionSizeAndDirection(\\n            _setToken,\\n            _component,\\n            bidInfo.setTotalSupply\\n        );\\n\\n        // Ensure that the auction direction matches the direction expected by the bidder.\\n        require(bidInfo.isSellAuction == _isSellAuction, \\\"Auction direction mismatch\\\");\\n\\n        // Settle the auction if the component quantity is max uint256.\\n        // Ensure that the component quantity in the bid does not exceed the available auction quantity.\\n        if (_componentQuantity == type(uint256).max) {\\n            _componentQuantity = bidInfo.auctionQuantity;\\n        } else {\\n            require(_componentQuantity <= bidInfo.auctionQuantity, \\\"Bid size exceeds auction quantity\\\");\\n        }\\n\\n        // Set the sendToken and receiveToken based on the auction type (sell or buy).\\n        (bidInfo.sendToken, bidInfo.receiveToken) = _getSendAndReceiveTokens(bidInfo.isSellAuction, _setToken, _component);\\n\\n        // Retrieve the current price for the component.\\n        bidInfo.componentPrice = bidInfo.priceAdapter.getPrice(\\n            address(_setToken),\\n            address(_component),\\n            _componentQuantity,\\n            block.timestamp - rebalanceInfo[_setToken].rebalanceStartTime,\\n            rebalanceInfo[_setToken].rebalanceDuration,\\n            bidInfo.priceAdapterConfigData\\n        );\\n\\n        // Calculate the quantity of quote asset involved in the bid.\\n        uint256 quoteAssetQuantity = _calculateQuoteAssetQuantity(\\n            bidInfo.isSellAuction,\\n            _componentQuantity,\\n            bidInfo.componentPrice\\n        );\\n\\n        // Store pre-bid token balances for later use.\\n        bidInfo.preBidTokenSentBalance = bidInfo.sendToken.balanceOf(address(_setToken));\\n        bidInfo.preBidTokenReceivedBalance = bidInfo.receiveToken.balanceOf(address(_setToken));\\n\\n        // Validate quote asset quantity against bidder's limit.\\n        _validateQuoteAssetQuantity(\\n            bidInfo.isSellAuction,\\n            quoteAssetQuantity,\\n            _quoteQuantityLimit,\\n            bidInfo.preBidTokenSentBalance\\n        );\\n\\n        // Calculate quantities sent and received by the Set during the bid.\\n        (bidInfo.quantitySentBySet, bidInfo.quantityReceivedBySet) = _calculateQuantitiesForBid(\\n            bidInfo.isSellAuction,\\n            _componentQuantity,\\n            quoteAssetQuantity\\n        );\\n    }\\n\\n    /**\\n     * @notice Determines tokens involved in the bid based on auction type.\\n     * @param isSellAuction       Is the auction a sell type.\\n     * @param _setToken           The SetToken involved in the rebalance.\\n     * @param _component          The component involved in the auction.\\n     * @return                    The tokens to send and receive in the bid.\\n     */\\n    function _getSendAndReceiveTokens(bool isSellAuction, ISetToken _setToken, IERC20 _component) private view returns (IERC20, IERC20) {\\n        return isSellAuction ? (_component, IERC20(rebalanceInfo[_setToken].quoteAsset)) : (IERC20(rebalanceInfo[_setToken].quoteAsset), _component);\\n    }\\n\\n    /**\\n     * @notice Calculates the quantity of quote asset involved in the bid.\\n     * @param isSellAuction        Is the auction a sell type.\\n     * @param _componentQuantity   The amount of component in the bid.\\n     * @param _componentPrice      The price of the component.\\n     * @return                     The quantity of quote asset in the bid.\\n     */\\n    function _calculateQuoteAssetQuantity(bool isSellAuction, uint256 _componentQuantity, uint256 _componentPrice) private pure returns (uint256) {\\n        return isSellAuction ? _componentQuantity.preciseMulCeil(_componentPrice) : _componentQuantity.preciseMul(_componentPrice);\\n    }\\n\\n    /**\\n     * @notice Validates the quote asset quantity against bidder's limit.\\n     * @param isSellAuction            Is the auction a sell type.\\n     * @param quoteAssetQuantity       The quantity of quote asset in the bid.\\n     * @param _quoteQuantityLimit      The max/min amount of quote asset to be spent/received.\\n     * @param preBidTokenSentBalance   The balance of tokens sent before the bid.\\n     */\\n    function _validateQuoteAssetQuantity(bool isSellAuction, uint256 quoteAssetQuantity, uint256 _quoteQuantityLimit, uint256 preBidTokenSentBalance) private pure {\\n        if (isSellAuction) {\\n            require(quoteAssetQuantity <= _quoteQuantityLimit, \\\"Quote asset quantity exceeds limit\\\");\\n        } else {\\n            require(quoteAssetQuantity >= _quoteQuantityLimit, \\\"Quote asset quantity below limit\\\");\\n            require(quoteAssetQuantity <= preBidTokenSentBalance, \\\"Insufficient quote asset balance\\\");\\n        }\\n    }\\n\\n    /**\\n     * @notice Calculates the quantities sent and received by the Set during the bid.\\n     * @param isSellAuction        Is the auction a sell type.\\n     * @param _componentQuantity   The amount of component in the bid.\\n     * @param quoteAssetQuantity   The quantity of quote asset in the bid.\\n     * @return                     The quantities of tokens sent and received by the Set.\\n     */\\n    function _calculateQuantitiesForBid(bool isSellAuction, uint256 _componentQuantity, uint256 quoteAssetQuantity) private pure returns (uint256, uint256) {\\n        return isSellAuction ? (_componentQuantity, quoteAssetQuantity) : (quoteAssetQuantity, _componentQuantity);\\n    }\\n\\n    /**\\n     * @dev Calculates the size and direction of the auction for a given component. Determines whether the component\\n     * is being bought or sold and the quantity required to settle the auction.\\n     *\\n     * @param _setToken            The SetToken instance to be rebalanced.\\n     * @param _component           The component whose auction size and direction need to be calculated.\\n     * @param _totalSupply         The total supply of the SetToken.\\n     *\\n     * @return isSellAuction       Indicates if this is a sell auction (true) or a buy auction (false).\\n     * @return maxComponentQty     The maximum quantity of the component to be exchanged to settle the auction.\\n     */\\n    function _calculateAuctionSizeAndDirection(\\n        ISetToken _setToken,\\n        IERC20 _component,\\n        uint256 _totalSupply\\n    )\\n        internal\\n        view\\n        returns (bool isSellAuction, uint256 maxComponentQty)\\n    {\\n        uint256 protocolFee = controller.getModuleFee(address(this), AUCTION_MODULE_V1_PROTOCOL_FEE_INDEX);\\n\\n        // Retrieve the current and target units, and notional amounts of the component\\n        (\\n            uint256 currentUnit,\\n            uint256 targetUnit,\\n            uint256 currentNotional,\\n            uint256 targetNotional\\n        ) = _getUnitsAndNotionalAmounts(_setToken, _component, _totalSupply);\\n\\n        // Ensure that the current unit and target unit are not the same\\n        require(currentUnit != targetUnit, \\\"Target already met\\\");\\n\\n        // Determine whether the component is being sold (sendToken) or bought\\n        isSellAuction = targetNotional < currentNotional;\\n\\n        // Calculate the max quantity of the component to be exchanged. If buying, account for the protocol fees.\\n        maxComponentQty = isSellAuction\\n            ? (currentNotional- targetNotional)\\n            : (targetNotional - currentNotional).preciseDiv(PreciseUnitMath.preciseUnit() - protocolFee);\\n    }\\n\\n      /**\\n     * @dev Executes the bid by performing token transfers.\\n     *\\n     * @param _bidInfo      Struct containing the bid information.\\n     */\\n    function _executeBid(\\n        BidInfo memory _bidInfo\\n    )\\n        internal\\n    {\\n        // Transfer the received tokens from the sender to the SetToken.\\n        transferFrom(\\n            _bidInfo.receiveToken,\\n            msg.sender,\\n            address(_bidInfo.setToken),\\n            _bidInfo.quantityReceivedBySet\\n        );\\n\\n        // Invoke the transfer of the sent tokens from the SetToken to the sender.\\n        _bidInfo.setToken.strictInvokeTransfer(\\n            address(_bidInfo.sendToken),\\n            msg.sender,\\n            _bidInfo.quantitySentBySet\\n        );\\n    }\\n\\n    /**\\n     * @dev Calculates the protocol fee based on the tokens received during the bid and transfers it\\n     * from the SetToken to the protocol recipient.\\n     *\\n     * @param _bidInfo  Struct containing information related to the bid.\\n     *\\n     * @return uint256  The amount of the received tokens taken as a protocol fee.\\n     */\\n    function _accrueProtocolFee(BidInfo memory _bidInfo) internal returns (uint256) {\\n        IERC20 receiveToken = IERC20(_bidInfo.receiveToken);\\n        ISetToken setToken = _bidInfo.setToken;\\n\\n        // Calculate the amount of tokens exchanged during the bid.\\n        uint256 exchangedQuantity = receiveToken.balanceOf(address(setToken)) - _bidInfo.preBidTokenReceivedBalance;\\n\\n        // Calculate the protocol fee.\\n        uint256 protocolFee = getModuleFee(AUCTION_MODULE_V1_PROTOCOL_FEE_INDEX, exchangedQuantity);\\n\\n        // Transfer the protocol fee from the SetToken to the protocol recipient.\\n        payProtocolFeeFromSetToken(setToken, address(_bidInfo.receiveToken), protocolFee);\\n\\n        return protocolFee;\\n    }\\n\\n    /**\\n     * @dev Updates the positions of the SetToken after the bid. This function should be called\\n     * after the protocol fees have been accrued. It calculates and returns the net amount of tokens\\n     * used and received during the bid.\\n     *\\n     * @param _bidInfo  Struct containing information related to the bid.\\n     *\\n     * @return uint256  The net amount of send tokens used in the bid.\\n     * @return uint256  The net amount of receive tokens after accounting for protocol fees.\\n     */\\n    function _updatePositionState(BidInfo memory _bidInfo)\\n        internal\\n        returns (uint256, uint256)\\n    {\\n        ISetToken setToken = _bidInfo.setToken;\\n\\n        // Calculate and update positions for send tokens.\\n        (uint256 postBidSendTokenBalance,,) = setToken.calculateAndEditDefaultPosition(\\n            address(_bidInfo.sendToken),\\n            _bidInfo.setTotalSupply,\\n            _bidInfo.preBidTokenSentBalance\\n        );\\n\\n        // Calculate and update positions for receive tokens.\\n        (uint256 postBidReceiveTokenBalance,,) = setToken.calculateAndEditDefaultPosition(\\n            address(_bidInfo.receiveToken),\\n            _bidInfo.setTotalSupply,\\n            _bidInfo.preBidTokenReceivedBalance\\n        );\\n\\n        // Calculate the net amount of tokens used and received.\\n        uint256 netSendAmount = _bidInfo.preBidTokenSentBalance - postBidSendTokenBalance;\\n        uint256 netReceiveAmount = postBidReceiveTokenBalance - _bidInfo.preBidTokenReceivedBalance;\\n\\n        return (netSendAmount, netReceiveAmount);\\n    }\\n\\n    /**\\n     * @dev Retrieves the unit and notional amount values for the current position and target.\\n     * These are necessary to calculate the bid size and direction.\\n     *\\n     * @param _setToken             Instance of the SetToken to be rebalanced.\\n     * @param _component            The component to calculate notional amounts for.\\n     * @param _totalSupply          SetToken total supply.\\n     *\\n     * @return uint256              Current default position real unit of the component.\\n     * @return uint256              Normalized unit of the bid target.\\n     * @return uint256              Current notional amount, based on total notional amount of SetToken default position.\\n     * @return uint256              Target notional amount, based on total SetToken supply multiplied by targetUnit.\\n     */\\n    function _getUnitsAndNotionalAmounts(\\n        ISetToken _setToken,\\n        IERC20 _component,\\n        uint256 _totalSupply\\n    )\\n        internal\\n        view\\n        returns (uint256, uint256, uint256, uint256)\\n    {\\n        uint256 currentUnit = _getDefaultPositionRealUnit(_setToken, _component);\\n        uint256 targetUnit = _getNormalizedTargetUnit(_setToken, _component);\\n\\n        uint256 currentNotionalAmount = _totalSupply.getDefaultTotalNotional(currentUnit);\\n        uint256 targetNotionalAmount = _totalSupply.preciseMulCeil(targetUnit);\\n\\n        return (currentUnit, targetUnit, currentNotionalAmount, targetNotionalAmount);\\n    }\\n\\n    /**\\n     * @dev Checks if all target units for components have been met.\\n     *\\n     * @param _setToken        Instance of the SetToken to be rebalanced.\\n     *\\n     * @return bool            True if all component's target units have been met; false otherwise.\\n     */\\n    function _allTargetsMet(ISetToken _setToken) internal view returns (bool) {\\n        address[] memory rebalanceComponents = rebalanceInfo[_setToken].rebalanceComponents;\\n\\n        for (uint256 i = 0; i < rebalanceComponents.length; i++) {\\n            if (_targetUnmet(_setToken, rebalanceComponents[i])) {\\n                return false;\\n            }\\n        }\\n\\n        return true;\\n    }\\n\\n    /**\\n     * @dev Determines if the target units for a given component are met. Takes into account minor rounding errors.\\n     * WETH is not checked as it is allowed to float around its target.\\n     *\\n     * @param _setToken        Instance of the SetToken to be rebalanced.\\n     * @param _component       Component whose target is evaluated.\\n     *\\n     * @return bool            True if component's target units are met; false otherwise.\\n     */\\n    function _targetUnmet(\\n        ISetToken _setToken,\\n        address _component\\n    )\\n        internal\\n        view\\n        returns(bool)\\n    {\\n        if (_component == address(rebalanceInfo[_setToken].quoteAsset)) return false;\\n\\n        uint256 normalizedTargetUnit = _getNormalizedTargetUnit(_setToken, IERC20(_component));\\n        uint256 currentUnit = _getDefaultPositionRealUnit(_setToken, IERC20(_component));\\n\\n        return (normalizedTargetUnit > 0)\\n            ? !normalizedTargetUnit.approximatelyEquals(currentUnit, 1)\\n            : normalizedTargetUnit != currentUnit;\\n    }\\n\\n    /**\\n     * @dev Retrieves the SetToken's default position real unit.\\n     *\\n     * @param _setToken        Instance of the SetToken.\\n     * @param _component       Component to fetch the default position for.\\n     *\\n     * @return uint256         Real unit position.\\n     */\\n    function _getDefaultPositionRealUnit(\\n        ISetToken _setToken,\\n        IERC20 _component\\n    )\\n        internal\\n        view\\n        returns (uint256)\\n    {\\n        return uint256(_setToken.getDefaultPositionRealUnit(address(_component)));\\n    }\\n\\n    /**\\n     * @dev Calculates and retrieves the normalized target unit value for a given component.\\n     *\\n     * @param _setToken        Instance of the SetToken.\\n     * @param _component       Component whose normalized target unit is required.\\n     *\\n     * @return uint256         Normalized target unit of the component.\\n     */\\n    function _getNormalizedTargetUnit(\\n        ISetToken _setToken,\\n        IERC20 _component\\n    )\\n        internal\\n        view\\n        returns(uint256)\\n    {\\n        // (targetUnit * current position multiplier) / position multiplier at the start of rebalance\\n        return (\\n            executionInfo[_setToken][_component].targetUnit* uint256(_setToken.positionMultiplier())\\n        )/ rebalanceInfo[_setToken].positionMultiplier;\\n    }\\n\\n    /**\\n     * @dev Checks if the specified address is allowed to call the bid for the SetToken.\\n     * If `anyoneBid` is set to true, any address is allowed, otherwise the address\\n     * must be explicitly approved.\\n     *\\n     * @param _setToken         Instance of the SetToken to be rebalanced.\\n     * @param _bidder           Address of the bidder.\\n     *\\n     * @return bool             True if the address is allowed to bid, false otherwise.\\n     */\\n    function _isAllowedBidder(\\n        ISetToken _setToken,\\n        address _bidder\\n    )\\n        internal\\n        view\\n        returns (bool)\\n    {\\n        BidPermissionInfo storage permissions = permissionInfo[_setToken];\\n        return permissions.isAnyoneAllowedToBid || permissions.bidAllowList[_bidder];\\n    }\\n\\n    /**\\n     * @dev Updates the permission status of a bidder and maintains a history. This function adds\\n     * the bidder to the history if being permissioned, and removes it if being unpermissioned.\\n     * Ensures that AddressArrayUtils does not throw by verifying the presence of the address\\n     * before removal.\\n     *\\n     * @param _setToken         Instance of the SetToken.\\n     * @param _bidder           Address of the bidder whose permission is being updated.\\n     * @param _status           The permission status being set (true for permissioned, false for unpermissioned).\\n     */\\n    function _updateBiddersHistory(\\n        ISetToken _setToken,\\n        address _bidder,\\n        bool _status\\n    )\\n        internal\\n    {\\n        if (_status && !permissionInfo[_setToken].biddersHistory.contains(_bidder)) {\\n            permissionInfo[_setToken].biddersHistory.push(_bidder);\\n        } else if(!_status && permissionInfo[_setToken].biddersHistory.contains(_bidder)) {\\n            permissionInfo[_setToken].biddersHistory.removeStorage(_bidder);\\n        }\\n    }\\n\\n    /**\\n     * @dev Checks if the rebalance duration has elapsed for the given SetToken.\\n     *\\n     * @param _setToken The SetToken whose rebalance duration is being checked.\\n     * @return bool True if the rebalance duration has elapsed; false otherwise.\\n     */\\n    function _isRebalanceDurationElapsed(ISetToken _setToken) internal view returns (bool) {\\n        RebalanceInfo storage rebalance = rebalanceInfo[_setToken];\\n        return (rebalance.rebalanceStartTime + rebalance.rebalanceDuration) <= block.timestamp;\\n    }\\n\\n    /**\\n     * @dev Checks if the conditions for early unlock are met.\\n     *\\n     * @param _setToken The SetToken being checked.\\n     * @return bool True if early unlock conditions are met; false otherwise.\\n     */\\n    function _canUnlockEarly(ISetToken _setToken) internal view returns (bool) {\\n        RebalanceInfo storage rebalance = rebalanceInfo[_setToken];\\n        return _allTargetsMet(_setToken) && _isQuoteAssetExcessOrAtTarget(_setToken) && rebalance.raiseTargetPercentage == 0;\\n    }\\n\\n    /**\\n     * @dev Checks if the quote asset is in excess or at target.\\n     *\\n     * @param _setToken The SetToken being checked.\\n     * @return bool True if the quote asset is in excess or at target; false otherwise.\\n     */\\n    function _isQuoteAssetExcessOrAtTarget(ISetToken _setToken) internal view returns (bool) {\\n        RebalanceInfo storage rebalance = rebalanceInfo[_setToken];\\n        bool isExcess = _getDefaultPositionRealUnit(_setToken, rebalance.quoteAsset) > _getNormalizedTargetUnit(_setToken, rebalance.quoteAsset);\\n        bool isAtTarget = _getDefaultPositionRealUnit(_setToken, rebalance.quoteAsset).approximatelyEquals(_getNormalizedTargetUnit(_setToken, rebalance.quoteAsset), 1);\\n        return isExcess || isAtTarget;\\n    }\\n\\n    /**\\n     * @dev Checks if the conditions to raise asset targets are met.\\n     *\\n     * @param _setToken The SetToken being checked.\\n     * @return bool True if conditions to raise asset targets are met; false otherwise.\\n     */\\n    function _canRaiseAssetTargets(ISetToken _setToken) internal view returns (bool) {\\n        RebalanceInfo storage rebalance = rebalanceInfo[_setToken];\\n        bool isQuoteAssetExcess = _getDefaultPositionRealUnit(_setToken, rebalance.quoteAsset) > _getNormalizedTargetUnit(_setToken, rebalance.quoteAsset);\\n        return _allTargetsMet(_setToken) && isQuoteAssetExcess;\\n    }\\n\\n    /**\\n     * @dev Retrieves the price adapter address for a component after verifying its existence\\n     * in the IntegrationRegistry. This function ensures the validity of the adapter during a bid.\\n     *\\n     * @param _setToken        Instance of the SetToken to be rebalanced.\\n     * @param _component       Component whose price adapter is to be fetched.\\n     *\\n     * @return IAuctionPriceAdapter    The price adapter's address.\\n     */\\n    function _getAuctionPriceAdapter(\\n        ISetToken _setToken,\\n        IERC20 _component\\n    )\\n        internal\\n        view\\n        returns(IAuctionPriceAdapterV1)\\n    {\\n        return IAuctionPriceAdapterV1(getAndValidateAdapter(executionInfo[_setToken][_component].priceAdapterName));\\n    }\\n\\n    /**\\n     * @dev Concatenates two arrays of AuctionExecutionParams after validating them.\\n     *\\n     * @param _oldAuctionParams     The first array of AuctionExecutionParams.\\n     * @param _newAuctionParams     The second array of AuctionExecutionParams.\\n     * @return concatenatedParams   The concatenated array of AuctionExecutionParams.\\n     */\\n    function _concatAndValidateAuctionParams(\\n        AuctionExecutionParams[] memory _oldAuctionParams,\\n        AuctionExecutionParams[] memory _newAuctionParams\\n    )\\n        internal\\n        view\\n        returns (AuctionExecutionParams[] memory concatenatedParams)\\n    {\\n        uint256 oldLength = _oldAuctionParams.length;\\n        uint256 newLength = _newAuctionParams.length;\\n\\n        // Initialize the concatenated array with the combined size of the input arrays\\n        concatenatedParams = new AuctionExecutionParams[](oldLength + newLength);\\n\\n        // Copy and validate the old auction params\\n        for (uint256 i = 0; i < oldLength; i++) {\\n            _validateAuctionExecutionPriceParams(_oldAuctionParams[i]);\\n            concatenatedParams[i] = _oldAuctionParams[i];\\n        }\\n\\n        // Append and validate the new auction params\\n        for (uint256 j = 0; j < newLength; j++) {\\n            require(_newAuctionParams[j].targetUnit > 0, \\\"New component target unit must be greater than 0\\\");\\n            _validateAuctionExecutionPriceParams(_newAuctionParams[j]);\\n            concatenatedParams[oldLength + j] = _newAuctionParams[j];\\n        }\\n\\n        return concatenatedParams;\\n    }\\n\\n    /**\\n     * @dev Validates the given auction execution price adapter params.\\n     *\\n     * @param auctionParams The auction parameters to validate.\\n     */\\n    function _validateAuctionExecutionPriceParams(AuctionExecutionParams memory auctionParams) internal view {\\n        IAuctionPriceAdapterV1 adapter = IAuctionPriceAdapterV1(getAndValidateAdapter(auctionParams.priceAdapterName));\\n        require(adapter.isPriceAdapterConfigDataValid(auctionParams.priceAdapterConfigData), \\\"Price adapter config data invalid\\\");\\n    }\\n\\n    /* ============== Modifier Helpers ===============\\n     * Internal functions used to reduce bytecode size\\n     */\\n\\n    /*\\n     * Bidder must be permissioned for SetToken\\n     */\\n    function _validateOnlyAllowedBidder(ISetToken _setToken) internal view {\\n        require(_isAllowedBidder(_setToken, msg.sender), \\\"Address not permitted to bid\\\");\\n    }\\n}\\n\",\"keccak256\":\"0x589db0c9c4a8b9ad54722349834dd131d0201ccf301b4215e9ea727584af7789\",\"license\":\"Apache-2.0\"}},\"version\":1}",
  "bytecode": "0x6080604052348015600f57600080fd5b5060405161504a38038061504a833981016040819052602c916054565b600080546001600160a01b0319166001600160a01b0392909216919091179055600180556082565b600060208284031215606557600080fd5b81516001600160a01b0381168114607b57600080fd5b9392505050565b614fb9806100916000396000f3fe608060405234801561001057600080fd5b50600436106101585760003560e01c80638d50c6c1116100c3578063d4f005321161007c578063d4f005321461031d578063dc7bc58514610330578063dc8abe2e14610343578063f4787698146103bd578063f77c4791146103d0578063ff0932a1146103fb57600080fd5b80638d50c6c11461029d5780638e0f7756146102be578063b26faa0a146102d1578063c2098812146102e4578063c3824c48146102f7578063c4d66de81461030a57600080fd5b8063421dec4d11610115578063421dec4d1461020a57806345e3db3e1461022c578063602ab35d1461024f5780636db4a2621461026f578063737531ba14610282578063847ef08d1461029557600080fd5b80630b2c85eb1461015d57806323ab55ec1461018c578063270e5590146101ac5780632f6c493c146101cf57806339a88f80146101e457806341cefcd1146101f7575b600080fd5b61017061016b3660046141f5565b61040e565b6040805192151583526020830191909152015b60405180910390f35b61019f61019a366004614247565b61057d565b6040516101839190614307565b6101bf6101ba3660046143fa565b6105b7565b6040519015158152602001610183565b6101e26101dd3660046143fa565b6105c8565b005b6101bf6101f23660046143fa565b61072d565b6101bf6102053660046143fa565b610738565b61021d6102183660046141f5565b610743565b60405161018393929190614417565b6101bf61023a3660046143fa565b60036020526000908152604090205460ff1681565b61026261025d3660046143fa565b610881565b6040516101839190614487565b6101e261027d366004614247565b610906565b6101e261029036600461449a565b610a30565b6101e2610a97565b6102b06102ab3660046143fa565b610b82565b604051908152602001610183565b6101e26102cc366004614745565b610c0b565b6101e26102df36600461487f565b610f39565b6101bf6102f23660046143fa565b6110bb565b6101bf6103053660046141f5565b6110c6565b6101e26103183660046143fa565b6110e4565b61026261032b3660046143fa565b6112c0565b6101bf61033e3660046143fa565b611342565b61038b6103513660046143fa565b6004602081905260009182526040909120805460018201546002830154600384015493909401546001600160a01b03909216939092909185565b604080516001600160a01b0390961686526020860194909452928401919091526060830152608082015260a001610183565b6101e26103cb366004614954565b61134d565b6000546103e3906001600160a01b031681565b6040516001600160a01b039091168152602001610183565b6101e26104093660046143fa565b6113af565b6000808361041b81611518565b6104ae8460046000886001600160a01b03166001600160a01b0316815260200190815260200160002060050180548060200260200160405190810160405280929190818152602001828054801561049b57602002820191906000526020600020905b81546001600160a01b0316815260019091019060200180831161047d575b505050505061158190919063ffffffff16565b6104ff5760405162461bcd60e51b815260206004820152601f60248201527f436f6d706f6e656e74206e6f742070617274206f6620726562616c616e63650060448201526064015b60405180910390fd5b6000856001600160a01b03166318160ddd6040518163ffffffff1660e01b8152600401602060405180830381865afa15801561053f573d6000803e3d6000fd5b505050506040513d601f19601f820116820180604052508101906105639190614982565b9050610570868683611597565b9350935050509250929050565b6105856140aa565b8661058f81611518565b61059b888888886116bb565b60006105aa8989888888611940565b9998505050505050505050565b60006105c282611d97565b92915050565b60006105d382611df4565b905060006105e083611e2a565b905081806105eb5750805b6106765760405162461bcd60e51b815260206004820152605060248201527f43616e6e6f7420756e6c6f636b206561726c7920756e6c65737320616c6c207460448201527f61726765747320617265206d657420616e64207261697365546172676574506560648201526f7263656e74616765206973207a65726f60801b608482015260a4016104f6565b80156106c1576001600160a01b038316600081815260046020526040808220600201829055517f7ebe07e0f6679ed2dd131ed9d9498112c84991ccae90b0568240bf0dbf680d5c9190a25b6001600160a01b03831660008181526004602081905260408083208201839055805163a69df4b560e01b8152905163a69df4b59382840193909282900301818387803b15801561071057600080fd5b505af1158015610724573d6000803e3d6000fd5b50505050505050565b60006105c282611e2a565b60006105c282611e6d565b6002602090815260009283526040808420909152908252902080546001820180549192916107709061499b565b80601f016020809104026020016040519081016040528092919081815260200182805461079c9061499b565b80156107e95780601f106107be576101008083540402835291602001916107e9565b820191906000526020600020905b8154815290600101906020018083116107cc57829003601f168201915b5050505050908060020180546107fe9061499b565b80601f016020809104026020016040519081016040528092919081815260200182805461082a9061499b565b80156108775780601f1061084c57610100808354040283529160200191610877565b820191906000526020600020905b81548152906001019060200180831161085a57829003601f168201915b5050505050905083565b60608161088d81611518565b6001600160a01b038316600090815260036020908152604091829020600101805483518184028101840190945280845290918301828280156108f857602002820191906000526020600020905b81546001600160a01b031681526001909101906020018083116108da575b505050505091505b50919050565b61090e611f02565b8561091881611f2c565b610924878787876116bb565b60006109338888878787611940565b905061093e81611f82565b600061094982611fbf565b905060008061095784612067565b9150915083604001516001600160a01b031684602001516001600160a01b031685600001516001600160a01b03167f96310ab47353685e74601a419fddb52db22b6ce0f72cb735c35ff494289dd6423388606001518960a001518a60e0015189898c8e6101800151604051610a129897969594939291906001600160a01b03988916815296909716602087015293151560408601526060850192909252608084015260a083015260c082015260e08101919091526101000190565b60405180910390a45050505050610a2860018055565b505050505050565b81610a3a81612108565b6001600160a01b03831660008181526004602081905260409182902001849055517f6a1e9ac0e71aa1dc7854a57bce846b04b1aae20dc994b832098200d9236d1d4a90610a8a9085815260200190565b60405180910390a2505050565b336000908152600360205260408120905b6001820154811015610b0d576000826002016000846001018481548110610ad157610ad16149cf565b6000918252602080832091909101546001600160a01b031683528201929092526040019020805460ff1916911515919091179055600101610aa8565b50336000908152600460208190526040822080546001600160a01b031916815560018101839055600281018390556003810183905590810182905590610b566005830182614138565b5050336000908152600360205260408120805460ff1916815590610b7d6001830182614138565b505050565b6001600160a01b038181166000818152600460208190526040808320805491516370a0823160e01b815292830194909452919391909116906370a0823190602401602060405180830381865afa158015610be0573d6000803e3d6000fd5b505050506040513d601f19601f82011682018060405250810190610c049190614982565b9392505050565b88610c1581612108565b838015610c955750306001600160a01b03168a6001600160a01b031663d7b96d4e6040518163ffffffff1660e01b8152600401602060405180830381865afa158015610c65573d6000803e3d6000fd5b505050506040513d601f19601f82011682018060405250810190610c8991906149e5565b6001600160a01b031614155b15610cee57896001600160a01b031663f83d08ba6040518163ffffffff1660e01b8152600401600060405180830381600087803b158015610cd557600080fd5b505af1158015610ce9573d6000803e3d6000fd5b505050505b600080610d638c6001600160a01b03166399d50d5d6040518163ffffffff1660e01b8152600401600060405180830381865afa158015610d32573d6000803e3d6000fd5b505050506040513d6000823e601f3d908101601f19168201604052610d5a9190810190614a02565b8b8b8b8b61215e565b9150915060005b8251811015610e7f57610da8838281518110610d8857610d886149cf565b60200260200101518e6001600160a01b03166122d590919063ffffffff16565b15610dc55760405162461bcd60e51b81526004016104f690614a9b565b818181518110610dd757610dd76149cf565b6020026020010151600260008f6001600160a01b03166001600160a01b031681526020019081526020016000206000858481518110610e1857610e186149cf565b60200260200101516001600160a01b03166001600160a01b03168152602001908152602001600020600082015181600001556020820151816001019081610e5f9190614b1a565b5060408201516002820190610e749082614b1a565b505050600101610d6a565b506001600160a01b038c8116600090815260046020908152604090912080546001600160a01b031916928e1692909217825542600183015560028201879055600382018690558351610ed79260050191850190614156565b508a6001600160a01b03168c6001600160a01b03167f2ca831858de887d2ca1c692d1940334f1d3f6c80c9101a306201d66397cf9be68888888787604051610f23959493929190614bd9565b60405180910390a3505050505050505050505050565b82610f4381612108565b610f4d8383612351565b60005b83518110156110b457610f9685858381518110610f6f57610f6f6149cf565b6020026020010151858481518110610f8957610f896149cf565b60200260200101516123a7565b828181518110610fa857610fa86149cf565b602002602001015160036000876001600160a01b03166001600160a01b031681526020019081526020016000206002016000868481518110610fec57610fec6149cf565b60200260200101516001600160a01b03166001600160a01b0316815260200190815260200160002060006101000a81548160ff02191690831515021790555083818151811061103d5761103d6149cf565b60200260200101516001600160a01b0316856001600160a01b03167f4e771e3486d7afcce48115112ca75bc21bc33ac6d6261f7d273b9c582060671785848151811061108b5761108b6149cf565b60200260200101516040516110a4911515815260200190565b60405180910390a3600101610f50565b5050505050565b60006105c282611df4565b6000826110d281611518565b6110dc848461254d565b949350505050565b80336110f08282612597565b826110fa816125ed565b6000846001600160a01b031663802758606040518163ffffffff1660e01b8152600401600060405180830381865afa15801561113a573d6000803e3d6000fd5b505050506040513d6000823e601f3d908101601f191682016040526111629190810190614cd6565b905060005b81518110156111ea576000828281518110611184576111846149cf565b60200260200101519050806060015160ff166000146111b55760405162461bcd60e51b81526004016104f690614a9b565b6040808201516001600160a01b03808a1660009081526002602090815284822095519092168152939052912055600101611167565b50846001600160a01b0316635230c3966040518163ffffffff1660e01b8152600401602060405180830381865afa158015611229573d6000803e3d6000fd5b505050506040513d601f19601f8201168201806040525081019061124d9190614982565b6001600160a01b03861660008181526004602081905260408083206003019490945583516307ff078f60e11b815293519293630ffe0f1e938183019392909182900301818387803b1580156112a157600080fd5b505af11580156112b5573d6000803e3d6000fd5b505050505050505050565b6060816112cc81611518565b6001600160a01b038316600090815260046020908152604091829020600501805483518184028101840190945280845290918301828280156108f8576020028201919060005260206000209081546001600160a01b031681526001909101906020018083116108da575050505050915050919050565b60006105c282612708565b8161135781612108565b6001600160a01b038316600081815260036020908152604091829020805460ff191686151590811790915591519182527f1fed19c0eee5ddf8ef482a13e2f0c3ec5c1390b1e39160fe52eabd651ecc7dba9101610a8a565b806113b981611f2c565b6113c282611df4565b1561140f5760405162461bcd60e51b815260206004820152601d60248201527f526562616c616e6365206d75737420626520696e2070726f677265737300000060448201526064016104f6565b61141882611d97565b6114705760405162461bcd60e51b815260206004820152602360248201527f54617267657473206e6f74206d6574206f722071756f7465206173736574203d60448201526207e20360ec1b60648201526084016104f6565b6001600160a01b0382166000908152600460208190526040822001546114c4906114a290670de0b6b3a7640000614e1e565b6001600160a01b038516600090815260046020526040902060030154906127c9565b6001600160a01b0384166000818152600460205260409081902060030183905551919250907fe4c448aaaad94925b669914540bde1ea0123c0b2320e4cf6ea0ad7a1818a1c9890610a8a9084815260200190565b611521816127e8565b61157e5760405162461bcd60e51b815260206004820152602860248201527f4d75737420626520612076616c696420616e6420696e697469616c697a65642060448201526729b2ba2a37b5b2b760c11b60648201526084016104f6565b50565b60008061158e84846128c7565b95945050505050565b6000805460405163792aa04f60e01b815230600482015260248101839052829182916001600160a01b039091169063792aa04f90604401602060405180830381865afa1580156115eb573d6000803e3d6000fd5b505050506040513d601f19601f8201168201806040525081019061160f9190614982565b90506000806000806116228a8a8a612932565b935093509350935082840361166e5760405162461bcd60e51b815260206004820152601260248201527115185c99d95d08185b1c9958591e481b595d60721b60448201526064016104f6565b8181109650866116a25761169d61168d86670de0b6b3a7640000614e31565b6116978484614e31565b906127c9565b6116ac565b6116ac8183614e31565b95505050505050935093915050565b6001600160a01b0380851660009081526004602052604090205481169084168190036117355760405162461bcd60e51b8152602060048201526024808201527f43616e6e6f7420626964206578706c696369746c79206f6e2051756f746520416044820152631cdcd95d60e21b60648201526084016104f6565b806001600160a01b0316836001600160a01b03161461178d5760405162461bcd60e51b81526020600482015260146024820152730a2eadee8ca40c2e6e6cae840dad2e6dac2e8c6d60631b60448201526064016104f6565b61181e8460046000886001600160a01b03166001600160a01b0316815260200190815260200160002060050180548060200260200160405190810160405280929190818152602001828054801561049b576020028201919060005260206000209081546001600160a01b0316815260019091019060200180831161047d57505050505061158190919063ffffffff16565b61186a5760405162461bcd60e51b815260206004820152601f60248201527f436f6d706f6e656e74206e6f742070617274206f6620726562616c616e63650060448201526064016104f6565b61187d6001600160a01b038616856122d5565b1561189a5760405162461bcd60e51b81526004016104f690614a9b565b6118a385611df4565b156118f05760405162461bcd60e51b815260206004820152601d60248201527f526562616c616e6365206d75737420626520696e2070726f677265737300000060448201526064016104f6565b600082116110b45760405162461bcd60e51b815260206004820152601c60248201527f436f6d706f6e656e7420616d6f756e74206d757374206265203e20300000000060448201526064016104f6565b6119486140aa565b6001600160a01b038616808252604080516318160ddd60e01b815290516318160ddd916004808201926020929091908290030181865afa158015611990573d6000803e3d6000fd5b505050506040513d601f19601f820116820180604052508101906119b49190614982565b6101808201526119c48686612981565b6001600160a01b0390811660608301528681166000908152600260208181526040808420948a1684529390529190200180546119ff9061499b565b80601f0160208091040260200160405190810160405280929190818152602001828054611a2b9061499b565b8015611a785780601f10611a4d57610100808354040283529160200191611a78565b820191906000526020600020905b815481529060010190602001808311611a5b57829003601f168201915b50505050508160800181905250611a958686836101800151611597565b60c0830152151560a0820181905282151514611af35760405162461bcd60e51b815260206004820152601a60248201527f41756374696f6e20646972656374696f6e206d69736d6174636800000000000060448201526064016104f6565b6000198403611b08578060c001519350611b66565b8060c00151841115611b665760405162461bcd60e51b815260206004820152602160248201527f4269642073697a6520657863656564732061756374696f6e207175616e7469746044820152607960f81b60648201526084016104f6565b611b758160a001518787612a3e565b6001600160a01b039081166040808501919091529181166020808501919091526060840151898316600090815260049092529290206001015491169063104b9b6490889088908890611bc79042614e31565b6001600160a01b038c166000908152600460208190526040918290206002015460808a015192516001600160e01b031960e08a901b168152611c0f9796959493919201614e44565b602060405180830381865afa158015611c2c573d6000803e3d6000fd5b505050506040513d601f19601f82011682018060405250810190611c509190614982565b60e0820181905260a0820151600091611c6b91908790612a91565b60208301516040516370a0823160e01b81526001600160a01b038a811660048301529293509116906370a0823190602401602060405180830381865afa158015611cb9573d6000803e3d6000fd5b505050506040513d601f19601f82011682018060405250810190611cdd9190614982565b61014083015260408083015190516370a0823160e01b81526001600160a01b038981166004830152909116906370a0823190602401602060405180830381865afa158015611d2f573d6000803e3d6000fd5b505050506040513d601f19601f82011682018060405250810190611d539190614982565b82610160018181525050611d728260a001518286856101400151612ab1565b611d818260a001518683612bbd565b6101208401526101008301525095945050505050565b6001600160a01b0380821660009081526004602052604081208054919290918391611dc491869116612bd6565b8254611dda9086906001600160a01b0316612c93565b119050611de684612708565b80156110dc57509392505050565b6001600160a01b0381166000908152600460205260408120600281015460018201544291611e2191614e1e565b11159392505050565b6001600160a01b0381166000908152600460205260408120611e4b83612708565b8015611e5b5750611e5b83611e6d565b8015610c045750600401541592915050565b6001600160a01b0380821660009081526004602052604081208054919290918391611e9a91869116612bd6565b8254611eb09086906001600160a01b0316612c93565b835491109150600090611ef190611ed19087906001600160a01b0316612bd6565b8454600190611eea9089906001600160a01b0316612c93565b9190612cdd565b9050818061158e5750949350505050565b600260015403611f2557604051633ee5aeb560e01b815260040160405180910390fd5b6002600155565b611f36813361254d565b61157e5760405162461bcd60e51b815260206004820152601c60248201527f41646472657373206e6f74207065726d697474656420746f206269640000000060448201526064016104f6565b611f9b8160400151338360000151846101200151612d08565b6020810151610100820151825161157e926001600160a01b03909116913390612d14565b604081810151825161016084015192516370a0823160e01b81526001600160a01b038083166004830152600094859290918516906370a0823190602401602060405180830381865afa158015612019573d6000803e3d6000fd5b505050506040513d601f19601f8201168201806040525081019061203d9190614982565b6120479190614e31565b90506000612056600083612e5e565b905061158e83876040015183612ede565b80516020820151610180830151610140840151600093849390928492612099926001600160a01b038616929091612f6f565b5050905060006120cd8660400151876101800151886101600151866001600160a01b0316612f6f909392919063ffffffff16565b505090506000828761014001516120e49190614e31565b90506000876101600151836120f99190614e31565b91989197509095505050505050565b612112813361308e565b6115185760405162461bcd60e51b815260206004820152601c60248201527f4d7573742062652074686520536574546f6b656e206d616e616765720000000060448201526064016104f6565b8151606090819085146121c55760405162461bcd60e51b815260206004820152602960248201527f4e657720636f6d706f6e656e747320616e6420706172616d73206c656e677468604482015268040dad2e6dac2e8c6d60bb1b60648201526084016104f6565b82518751146122285760405162461bcd60e51b815260206004820152602960248201527f4f6c6420636f6d706f6e656e747320616e6420706172616d73206c656e677468604482015268040dad2e6dac2e8c6d60bb1b60648201526084016104f6565b6122678686808060200260200160405190810160405280939291908181526020018383602002808284376000920191909152508b9392505061310d9050565b915061227282613228565b156122bf5760405162461bcd60e51b815260206004820181905260248201527f43616e6e6f742068617665206475706c696361746520636f6d706f6e656e747360448201526064016104f6565b6122c98385613310565b90509550959350505050565b60405163a7bdad0360e01b81526001600160a01b038281166004830152600091829185169063a7bdad0390602401600060405180830381865afa158015612320573d6000803e3d6000fd5b505050506040513d6000823e601f3d908101601f191682016040526123489190810190614a02565b51119392505050565b805182511461239a5760405162461bcd60e51b8152602060048201526015602482015274082e4e4c2f240d8cadccee8d040dad2e6dac2e8c6d605b1b60448201526064016104f6565b6123a3826134f7565b5050565b80801561244257506124408260036000866001600160a01b03166001600160a01b0316815260200190815260200160002060010180548060200260200160405190810160405280929190818152602001828054801561049b576020028201919060005260206000209081546001600160a01b0316815260019091019060200180831161047d57505050505061158190919063ffffffff16565b155b1561248957506001600160a01b0391821660009081526003602090815260408220600190810180549182018155835291200180546001600160a01b03191691909216179055565b8015801561252357506125238260036000866001600160a01b03166001600160a01b0316815260200190815260200160002060010180548060200260200160405190810160405280929190818152602001828054801561049b576020028201919060005260206000209081546001600160a01b0316815260019091019060200180831161047d57505050505061158190919063ffffffff16565b15610b7d576001600160a01b0383166000908152600360205260409020610b7d906001018361359e565b6001600160a01b0382166000908152600360205260408120805460ff16806110dc57506001600160a01b038316600090815260028201602052604090205460ff1691505092915050565b6125a1828261308e565b6123a35760405162461bcd60e51b815260206004820152601c60248201527f4d7573742062652074686520536574546f6b656e206d616e616765720000000060448201526064016104f6565b600054604051631d3af8fb60e21b81526001600160a01b038381166004830152909116906374ebe3ec90602401602060405180830381865afa158015612637573d6000803e3d6000fd5b505050506040513d601f19601f8201168201806040525081019061265b9190614e8d565b6126b35760405162461bcd60e51b815260206004820152602360248201527f4d75737420626520636f6e74726f6c6c65722d656e61626c656420536574546f60448201526235b2b760e91b60648201526084016104f6565b6126bc81613711565b61157e5760405162461bcd60e51b815260206004820152601e60248201527f4d7573742062652070656e64696e6720696e697469616c697a6174696f6e000060448201526064016104f6565b6001600160a01b03811660009081526004602090815260408083206005018054825181850281018501909352808352849383018282801561277257602002820191906000526020600020905b81546001600160a01b03168152600190910190602001808311612754575b5050505050905060005b81518110156127bf576127a88483838151811061279b5761279b6149cf565b6020026020010151613740565b156127b7575060009392505050565b60010161277c565b5060019392505050565b6000816127de670de0b6b3a764000085614eaa565b610c049190614ec1565b60008054604051631d3af8fb60e21b81526001600160a01b038481166004830152909116906374ebe3ec90602401602060405180830381865afa158015612833573d6000803e3d6000fd5b505050506040513d601f19601f820116820180604052508101906128579190614e8d565b80156105c257506040516335fc6c9f60e21b81523060048201526001600160a01b0383169063d7f1b27c906024015b602060405180830381865afa1580156128a3573d6000803e3d6000fd5b505050506040513d601f19601f820116820180604052508101906105c29190614e8d565b81516000908190815b8181101561291f57846001600160a01b03168682815181106128f4576128f46149cf565b60200260200101516001600160a01b0316036129175792506001915061292b9050565b6001016128d0565b50600019600092509250505b9250929050565b60008060008060006129448888612c93565b905060006129528989612bd6565b9050600061296088846137b2565b9050600061296e89846137be565b939b929a50909850919650945050505050565b6001600160a01b03808316600090815260026020908152604080832093851683529290529081206001018054610c0491906129bb9061499b565b80601f01602080910402602001604051908101604052809291908181526020018280546129e79061499b565b8015612a345780601f10612a0957610100808354040283529160200191612a34565b820191906000526020600020905b815481529060010190602001808311612a1757829003601f168201915b505050505061380c565b60008084612a67576001600160a01b038085166000908152600460205260409020541683612a85565b6001600160a01b038085166000908152600460205260409020548491165b91509150935093915050565b600083612aa757612aa2838361381f565b6110dc565b6110dc83836137be565b8315612b175781831115612b125760405162461bcd60e51b815260206004820152602260248201527f51756f7465206173736574207175616e746974792065786365656473206c696d6044820152611a5d60f21b60648201526084016104f6565b612bb7565b81831015612b675760405162461bcd60e51b815260206004820181905260248201527f51756f7465206173736574207175616e746974792062656c6f77206c696d697460448201526064016104f6565b80831115612bb75760405162461bcd60e51b815260206004820181905260248201527f496e73756666696369656e742071756f74652061737365742062616c616e636560448201526064016104f6565b50505050565b60008084612bcc578284612a85565b5091939092509050565b600060046000846001600160a01b03166001600160a01b0316815260200190815260200160002060030154836001600160a01b0316635230c3966040518163ffffffff1660e01b8152600401602060405180830381865afa158015612c3f573d6000803e3d6000fd5b505050506040513d601f19601f82011682018060405250810190612c639190614982565b6001600160a01b038086166000908152600260209081526040808320938816835292905220546127de9190614eaa565b6040516366cb8d2f60e01b81526001600160a01b038281166004830152600091908416906366cb8d2f90602401602060405180830381865afa158015610be0573d6000803e3d6000fd5b6000612ce98284614e1e565b84111580156110dc5750612cfd8284614e31565b909310159392505050565b612bb784848484613834565b8015612bb7576040516370a0823160e01b81526001600160a01b038581166004830152600091908516906370a0823190602401602060405180830381865afa158015612d64573d6000803e3d6000fd5b505050506040513d601f19601f82011682018060405250810190612d889190614982565b9050612d9685858585613930565b6040516370a0823160e01b81526001600160a01b038681166004830152600091908616906370a0823190602401602060405180830381865afa158015612de0573d6000803e3d6000fd5b505050506040513d601f19601f82011682018060405250810190612e049190614982565b9050612e108383614e31565b8114610a285760405162461bcd60e51b815260206004820152601d60248201527f496e76616c696420706f7374207472616e736665722062616c616e636500000060448201526064016104f6565b6000805460405163792aa04f60e01b81523060048201526024810185905282916001600160a01b03169063792aa04f90604401602060405180830381865afa158015612eae573d6000803e3d6000fd5b505050506040513d601f19601f82011682018060405250810190612ed29190614982565b90506110dc838261381f565b8015610b7d57610b7d8260008054906101000a90046001600160a01b03166001600160a01b031663469048406040518163ffffffff1660e01b8152600401602060405180830381865afa158015612f39573d6000803e3d6000fd5b505050506040513d601f19601f82011682018060405250810190612f5d91906149e5565b6001600160a01b038616919084612d14565b6040516370a0823160e01b81526001600160a01b0385811660048301526000918291829182918816906370a0823190602401602060405180830381865afa158015612fbe573d6000803e3d6000fd5b505050506040513d601f19601f82011682018060405250810190612fe29190614982565b6040516366cb8d2f60e01b81526001600160a01b0389811660048301529192506000918a16906366cb8d2f90602401602060405180830381865afa15801561302e573d6000803e3d6000fd5b505050506040513d601f19601f820116820180604052508101906130529190614982565b90506000821561306f5761306888888585613a5c565b9050613073565b5060005b61307e8a8a83613a8d565b9199909850909650945050505050565b6000816001600160a01b0316836001600160a01b031663481c6a756040518163ffffffff1660e01b8152600401602060405180830381865afa1580156130d8573d6000803e3d6000fd5b505050506040513d601f19601f820116820180604052508101906130fc91906149e5565b6001600160a01b0316149392505050565b815181516060919060006131218284614e1e565b6001600160401b038111156131385761313861450a565b604051908082528060200260200182016040528015613161578160200160208202803683370190505b50905060005b838110156131bb57868181518110613181576131816149cf565b602002602001015182828151811061319b5761319b6149cf565b6001600160a01b0390921660209283029190910190910152600101613167565b5060005b8281101561321e578581815181106131d9576131d96149cf565b60200260200101518282866131ee9190614e1e565b815181106131fe576131fe6149cf565b6001600160a01b03909216602092830291909101909101526001016131bf565b5095945050505050565b6000808251116132675760405162461bcd60e51b815260206004820152600a6024820152694120697320656d70747960b01b60448201526064016104f6565b60005b600183516132789190614e31565b811015613307576000838281518110613293576132936149cf565b6020026020010151905060008260016132ac9190614e1e565b90505b84518110156132fd578481815181106132ca576132ca6149cf565b60200260200101516001600160a01b0316826001600160a01b0316036132f557506001949350505050565b6001016132af565b505060010161326a565b50600092915050565b81518151606091906133228183614e1e565b6001600160401b038111156133395761333961450a565b60405190808252806020026020018201604052801561338e57816020015b61337b60405180606001604052806000815260200160608152602001606081525090565b8152602001906001900390816133575790505b50925060005b828110156133fd576133be8682815181106133b1576133b16149cf565b6020026020010151613c61565b8581815181106133d0576133d06149cf565b60200260200101518482815181106133ea576133ea6149cf565b6020908102919091010152600101613394565b5060005b818110156134ee57600085828151811061341d5761341d6149cf565b6020026020010151600001511161348f5760405162461bcd60e51b815260206004820152603060248201527f4e657720636f6d706f6e656e742074617267657420756e6974206d757374206260448201526f0652067726561746572207468616e20360841b60648201526084016104f6565b6134a48582815181106133b1576133b16149cf565b8481815181106134b6576134b66149cf565b60200260200101518482856134cb9190614e1e565b815181106134db576134db6149cf565b6020908102919091010152600101613401565b50505092915050565b60008151116135485760405162461bcd60e51b815260206004820152601860248201527f4172726179206c656e677468206d757374206265203e2030000000000000000060448201526064016104f6565b61355181613228565b1561157e5760405162461bcd60e51b815260206004820152601a60248201527f43616e6e6f74206475706c69636174652061646472657373657300000000000060448201526064016104f6565b600080613604848054806020026020016040519081016040528092919081815260200182805480156135f957602002820191906000526020600020905b81546001600160a01b031681526001909101906020018083116135db575b5050505050846128c7565b915091508061364d5760405162461bcd60e51b815260206004820152601560248201527420b2323932b9b9903737ba1034b71030b93930bc9760591b60448201526064016104f6565b835460009061365e90600190614e31565b90508083146136d857848181548110613679576136796149cf565b9060005260206000200160009054906101000a90046001600160a01b03168584815481106136a9576136a96149cf565b9060005260206000200160006101000a8154816001600160a01b0302191690836001600160a01b031602179055505b848054806136e8576136e8614ee3565b600082815260209020810160001990810180546001600160a01b03191690550190555050505050565b6040516353bae5f760e01b81523060048201526000906001600160a01b038316906353bae5f790602401612886565b6001600160a01b0380831660009081526004602052604081205490919081169083160361376f575060006105c2565b600061377b8484612bd6565b905060006137898585612c93565b90506000821161379c578082141561158e565b6137a882826001612cdd565b1595945050505050565b6000610c04838361381f565b60008215806137cb575081155b156137d8575060006105c2565b670de0b6b3a764000060016137ed8486614eaa565b6137f79190614e31565b6138019190614ec1565b610c04906001614e1e565b80516020820120600090610c0481613d39565b6000670de0b6b3a76400006127de8385614eaa565b8015612bb7576040516370a0823160e01b81526001600160a01b038381166004830152600091908616906370a0823190602401602060405180830381865afa158015613884573d6000803e3d6000fd5b505050506040513d601f19601f820116820180604052508101906138a89190614982565b90506138b685858585613e12565b6040516370a0823160e01b81526001600160a01b038481166004830152600091908716906370a0823190602401602060405180830381865afa158015613900573d6000803e3d6000fd5b505050506040513d601f19601f820116820180604052508101906139249190614982565b9050612e108383614e1e565b8015612bb7576040516001600160a01b03831660248201526044810182905260009060640160408051601f198184030181529181526020820180516001600160e01b031663a9059cbb60e01b179052516347b7819960e11b81529091506000906001600160a01b03871690638f6f0332906139b390889085908790600401614ef9565b6000604051808303816000875af11580156139d2573d6000803e3d6000fd5b505050506040513d6000823e601f3d908101601f191682016040526139fa9190810190614f20565b805190915015610a285780806020019051810190613a189190614e8d565b610a285760405162461bcd60e51b8152602060048201526015602482015274115490cc8c081d1c985b9cd9995c8819985a5b1959605a1b60448201526064016104f6565b600080613a69838761381f565b613a739086614e31565b9050613a83866116978387614e31565b9695505050505050565b6000613a998484613e6c565b905080158015613aa95750600082115b15613b1d57613ab884846122d5565b613b18576040516304e3532760e41b81526001600160a01b038481166004830152851690634e35327090602401600060405180830381600087803b158015613aff57600080fd5b505af1158015613b13573d6000803e3d6000fd5b505050505b613b97565b808015613b28575081155b15613b9757613b3784846122d5565b613b9757604051636f86c89760e01b81526001600160a01b038481166004830152851690636f86c89790602401600060405180830381600087803b158015613b7e57600080fd5b505af1158015613b92573d6000803e3d6000fd5b505050505b604051632ba57d1760e01b81526001600160a01b03848116600483015260248201849052851690632ba57d1790604401600060405180830381600087803b158015613be157600080fd5b505af1158015613bf5573d6000803e3d6000fd5b5050604051632ba57d1760e01b81526001600160a01b0386811660048301526024820186905287169250632ba57d179150604401600060405180830381600087803b158015613c4357600080fd5b505af1158015613c57573d6000803e3d6000fd5b5050505050505050565b6000613c70826020015161380c565b60408084015190516301e7dafd60e21b81529192506001600160a01b0383169163079f6bf491613ca291600401614f54565b602060405180830381865afa158015613cbf573d6000803e3d6000fd5b505050506040513d601f19601f82011682018060405250810190613ce39190614e8d565b6123a35760405162461bcd60e51b815260206004820152602160248201527f5072696365206164617074657220636f6e666967206461746120696e76616c696044820152601960fa1b60648201526084016104f6565b600080548190613d51906001600160a01b0316613ee3565b60405163e6d642c560e01b8152306004820152602481018590526001600160a01b03919091169063e6d642c590604401602060405180830381865afa158015613d9e573d6000803e3d6000fd5b505050506040513d601f19601f82011682018060405250810190613dc291906149e5565b90506001600160a01b0381166105c25760405162461bcd60e51b815260206004820152601560248201527426bab9ba103132903b30b634b21030b230b83a32b960591b60448201526064016104f6565b604080516001600160a01b0385811660248301528416604482015260648082018490528251808303909101815260849091019091526020810180516001600160e01b03166323b872dd60e01b179052612bb7908590613f4f565b6040516366cb8d2f60e01b81526001600160a01b03828116600483015260009182918516906366cb8d2f90602401602060405180830381865afa158015613eb7573d6000803e3d6000fd5b505050506040513d601f19601f82011682018060405250810190613edb9190614982565b139392505050565b6040516373b2e76b60e11b8152600060048201819052906001600160a01b0383169063e765ced690602401602060405180830381865afa158015613f2b573d6000803e3d6000fd5b505050506040513d601f19601f820116820180604052508101906105c291906149e5565b6000613f646001600160a01b03841683613fb2565b90508051600014158015613f89575080806020019051810190613f879190614e8d565b155b15610b7d57604051635274afe760e01b81526001600160a01b03841660048201526024016104f6565b6060610c048383600084600080856001600160a01b03168486604051613fd89190614f67565b60006040518083038185875af1925050503d8060008114614015576040519150601f19603f3d011682016040523d82523d6000602084013e61401a565b606091505b5091509150613a8386838360608261403a5761403582614081565b610c04565b815115801561405157506001600160a01b0384163b155b1561407a57604051639996b31560e01b81526001600160a01b03851660048201526024016104f6565b5080610c04565b8051156140915780518082602001fd5b604051630a12f52160e11b815260040160405180910390fd5b604051806101a0016040528060006001600160a01b0316815260200160006001600160a01b0316815260200160006001600160a01b0316815260200160006001600160a01b0316815260200160608152602001600015158152602001600081526020016000815260200160008152602001600081526020016000815260200160008152602001600081525090565b508054600082559060005260206000209081019061157e91906141bb565b8280548282559060005260206000209081019282156141ab579160200282015b828111156141ab57825182546001600160a01b0319166001600160a01b03909116178255602090920191600190910190614176565b506141b79291506141bb565b5090565b5b808211156141b757600081556001016141bc565b6001600160a01b038116811461157e57600080fd5b80356141f0816141d0565b919050565b6000806040838503121561420857600080fd5b8235614213816141d0565b91506020830135614223816141d0565b809150509250929050565b801515811461157e57600080fd5b80356141f08161422e565b60008060008060008060c0878903121561426057600080fd5b863561426b816141d0565b9550602087013561427b816141d0565b9450604087013561428b816141d0565b9350606087013592506080870135915060a08701356142a98161422e565b809150509295509295509295565b60005b838110156142d25781810151838201526020016142ba565b50506000910152565b600081518084526142f38160208601602086016142b7565b601f01601f19169290920160200192915050565b602081526143216020820183516001600160a01b03169052565b6000602083015161433d60408401826001600160a01b03169052565b5060408301516001600160a01b03811660608401525060608301516001600160a01b03811660808401525060808301516101a08060a08501526143846101c08501836142db565b915060a085015161439960c086018215159052565b5060c085015160e0858101919091528501516101008086019190915285015161012080860191909152850151610140808601919091528501516101608086019190915285015161018080860191909152909401519390920192909252919050565b60006020828403121561440c57600080fd5b8135610c04816141d0565b83815260606020820152600061443060608301856142db565b8281036040840152613a8381856142db565b60008151808452602080850194506020840160005b8381101561447c5781516001600160a01b031687529582019590820190600101614457565b509495945050505050565b602081526000610c046020830184614442565b600080604083850312156144ad57600080fd5b82356144b8816141d0565b946020939093013593505050565b60008083601f8401126144d857600080fd5b5081356001600160401b038111156144ef57600080fd5b6020830191508360208260051b850101111561292b57600080fd5b634e487b7160e01b600052604160045260246000fd5b604051606081016001600160401b03811182821017156145425761454261450a565b60405290565b60405160a081016001600160401b03811182821017156145425761454261450a565b604051601f8201601f191681016001600160401b03811182821017156145925761459261450a565b604052919050565b60006001600160401b038211156145b3576145b361450a565b5060051b60200190565b60006001600160401b038211156145d6576145d661450a565b50601f01601f191660200190565b60006145f76145f2846145bd565b61456a565b905082815283838301111561460b57600080fd5b828260208301376000602084830101529392505050565b600082601f83011261463357600080fd5b813560206146436145f28361459a565b82815260059290921b8401810191818101908684111561466257600080fd5b8286015b8481101561473a5780356001600160401b03808211156146865760008081fd5b908801906060828b03601f19018113156146a05760008081fd5b6146a8614520565b878401358152604080850135848111156146c25760008081fd5b8501603f8082018f136146d55760008081fd5b6146e58f8c8401358585016145e4565b848c01529386013593858511156146fe57600091508182fd5b84870196508e8188011261471457600095508586fd5b50506147268d8a8701358388016145e4565b908201528652505050918301918301614666565b509695505050505050565b60008060008060008060008060006101008a8c03121561476457600080fd5b61476d8a6141e5565b985061477b60208b016141e5565b975060408a01356001600160401b038082111561479757600080fd5b6147a38d838e016144c6565b909950975060608c01359150808211156147bc57600080fd5b6147c88d838e01614622565b965060808c01359150808211156147de57600080fd5b506147eb8c828d01614622565b9450506147fa60a08b0161423c565b925060c08a0135915060e08a013590509295985092959850929598565b600082601f83011261482857600080fd5b813560206148386145f28361459a565b8083825260208201915060208460051b87010193508684111561485a57600080fd5b602086015b8481101561473a5780356148728161422e565b835291830191830161485f565b60008060006060848603121561489457600080fd5b833561489f816141d0565b92506020848101356001600160401b03808211156148bc57600080fd5b818701915087601f8301126148d057600080fd5b81356148de6145f28261459a565b81815260059190911b8301840190848101908a8311156148fd57600080fd5b938501935b82851015614924578435614915816141d0565b82529385019390850190614902565b96505050604087013592508083111561493c57600080fd5b505061494a86828701614817565b9150509250925092565b6000806040838503121561496757600080fd5b8235614972816141d0565b915060208301356142238161422e565b60006020828403121561499457600080fd5b5051919050565b600181811c908216806149af57607f821691505b60208210810361090057634e487b7160e01b600052602260045260246000fd5b634e487b7160e01b600052603260045260246000fd5b6000602082840312156149f757600080fd5b8151610c04816141d0565b60006020808385031215614a1557600080fd5b82516001600160401b03811115614a2b57600080fd5b8301601f81018513614a3c57600080fd5b8051614a4a6145f28261459a565b81815260059190911b82018301908381019087831115614a6957600080fd5b928401925b82841015614a90578351614a81816141d0565b82529284019290840190614a6e565b979650505050505050565b6020808252601e908201527f45787465726e616c20706f736974696f6e73206e6f7420616c6c6f7765640000604082015260600190565b601f821115610b7d576000816000526020600020601f850160051c81016020861015614afb5750805b601f850160051c820191505b81811015610a2857828155600101614b07565b81516001600160401b03811115614b3357614b3361450a565b614b4781614b41845461499b565b84614ad2565b602080601f831160018114614b7c5760008415614b645750858301515b600019600386901b1c1916600185901b178555610a28565b600085815260208120601f198616915b82811015614bab57888601518255948401946001909101908401614b8c565b5085821015614bc95787850151600019600388901b60f8161c191681555b5050505050600190811b01905550565b85151581526000602086818401526040866040850152606060a06060860152614c0560a0860188614442565b8581036080870152865180825284820190600581901b83018601868a0160005b83811015614c7d57601f1986840301855281518051845289810151888b860152614c51898601826142db565b918a0151858303868c0152919050614c6981836142db565b968b01969450505090880190600101614c25565b50909e9d5050505050505050505050505050565b600082601f830112614ca257600080fd5b8151614cb06145f2826145bd565b818152846020838601011115614cc557600080fd5b6110dc8260208301602087016142b7565b60006020808385031215614ce957600080fd5b82516001600160401b0380821115614d0057600080fd5b818501915085601f830112614d1457600080fd5b8151614d226145f28261459a565b81815260059190911b83018401908481019088831115614d4157600080fd5b8585015b83811015614dfb57805185811115614d5d5760008081fd5b860160a0818c03601f1901811315614d755760008081fd5b614d7d614548565b89830151614d8a816141d0565b8152604083810151614d9b816141d0565b808c8401525060608085015182840152608091508185015160ff81168114614dc35760008081fd5b90830152918301519188831115614dda5760008081fd5b614de88e8c85870101614c91565b9082015285525050918601918601614d45565b5098975050505050505050565b634e487b7160e01b600052601160045260246000fd5b808201808211156105c2576105c2614e08565b818103818111156105c2576105c2614e08565b600060018060a01b03808916835280881660208401525085604083015284606083015283608083015260c060a0830152614e8160c08301846142db565b98975050505050505050565b600060208284031215614e9f57600080fd5b8151610c048161422e565b80820281158282048414176105c2576105c2614e08565b600082614ede57634e487b7160e01b600052601260045260246000fd5b500490565b634e487b7160e01b600052603160045260246000fd5b60018060a01b038416815282602082015260606040820152600061158e60608301846142db565b600060208284031215614f3257600080fd5b81516001600160401b03811115614f4857600080fd5b6110dc84828501614c91565b602081526000610c0460208301846142db565b60008251614f798184602087016142b7565b919091019291505056fea2646970667358221220b382cb7bdb537f713859f4f3b670db54624fc42d315bfca72438b964047f1ba064736f6c63430008190033",
  "deployedBytecode": "0x608060405234801561001057600080fd5b50600436106101585760003560e01c80638d50c6c1116100c3578063d4f005321161007c578063d4f005321461031d578063dc7bc58514610330578063dc8abe2e14610343578063f4787698146103bd578063f77c4791146103d0578063ff0932a1146103fb57600080fd5b80638d50c6c11461029d5780638e0f7756146102be578063b26faa0a146102d1578063c2098812146102e4578063c3824c48146102f7578063c4d66de81461030a57600080fd5b8063421dec4d11610115578063421dec4d1461020a57806345e3db3e1461022c578063602ab35d1461024f5780636db4a2621461026f578063737531ba14610282578063847ef08d1461029557600080fd5b80630b2c85eb1461015d57806323ab55ec1461018c578063270e5590146101ac5780632f6c493c146101cf57806339a88f80146101e457806341cefcd1146101f7575b600080fd5b61017061016b3660046141f5565b61040e565b6040805192151583526020830191909152015b60405180910390f35b61019f61019a366004614247565b61057d565b6040516101839190614307565b6101bf6101ba3660046143fa565b6105b7565b6040519015158152602001610183565b6101e26101dd3660046143fa565b6105c8565b005b6101bf6101f23660046143fa565b61072d565b6101bf6102053660046143fa565b610738565b61021d6102183660046141f5565b610743565b60405161018393929190614417565b6101bf61023a3660046143fa565b60036020526000908152604090205460ff1681565b61026261025d3660046143fa565b610881565b6040516101839190614487565b6101e261027d366004614247565b610906565b6101e261029036600461449a565b610a30565b6101e2610a97565b6102b06102ab3660046143fa565b610b82565b604051908152602001610183565b6101e26102cc366004614745565b610c0b565b6101e26102df36600461487f565b610f39565b6101bf6102f23660046143fa565b6110bb565b6101bf6103053660046141f5565b6110c6565b6101e26103183660046143fa565b6110e4565b61026261032b3660046143fa565b6112c0565b6101bf61033e3660046143fa565b611342565b61038b6103513660046143fa565b6004602081905260009182526040909120805460018201546002830154600384015493909401546001600160a01b03909216939092909185565b604080516001600160a01b0390961686526020860194909452928401919091526060830152608082015260a001610183565b6101e26103cb366004614954565b61134d565b6000546103e3906001600160a01b031681565b6040516001600160a01b039091168152602001610183565b6101e26104093660046143fa565b6113af565b6000808361041b81611518565b6104ae8460046000886001600160a01b03166001600160a01b0316815260200190815260200160002060050180548060200260200160405190810160405280929190818152602001828054801561049b57602002820191906000526020600020905b81546001600160a01b0316815260019091019060200180831161047d575b505050505061158190919063ffffffff16565b6104ff5760405162461bcd60e51b815260206004820152601f60248201527f436f6d706f6e656e74206e6f742070617274206f6620726562616c616e63650060448201526064015b60405180910390fd5b6000856001600160a01b03166318160ddd6040518163ffffffff1660e01b8152600401602060405180830381865afa15801561053f573d6000803e3d6000fd5b505050506040513d601f19601f820116820180604052508101906105639190614982565b9050610570868683611597565b9350935050509250929050565b6105856140aa565b8661058f81611518565b61059b888888886116bb565b60006105aa8989888888611940565b9998505050505050505050565b60006105c282611d97565b92915050565b60006105d382611df4565b905060006105e083611e2a565b905081806105eb5750805b6106765760405162461bcd60e51b815260206004820152605060248201527f43616e6e6f7420756e6c6f636b206561726c7920756e6c65737320616c6c207460448201527f61726765747320617265206d657420616e64207261697365546172676574506560648201526f7263656e74616765206973207a65726f60801b608482015260a4016104f6565b80156106c1576001600160a01b038316600081815260046020526040808220600201829055517f7ebe07e0f6679ed2dd131ed9d9498112c84991ccae90b0568240bf0dbf680d5c9190a25b6001600160a01b03831660008181526004602081905260408083208201839055805163a69df4b560e01b8152905163a69df4b59382840193909282900301818387803b15801561071057600080fd5b505af1158015610724573d6000803e3d6000fd5b50505050505050565b60006105c282611e2a565b60006105c282611e6d565b6002602090815260009283526040808420909152908252902080546001820180549192916107709061499b565b80601f016020809104026020016040519081016040528092919081815260200182805461079c9061499b565b80156107e95780601f106107be576101008083540402835291602001916107e9565b820191906000526020600020905b8154815290600101906020018083116107cc57829003601f168201915b5050505050908060020180546107fe9061499b565b80601f016020809104026020016040519081016040528092919081815260200182805461082a9061499b565b80156108775780601f1061084c57610100808354040283529160200191610877565b820191906000526020600020905b81548152906001019060200180831161085a57829003601f168201915b5050505050905083565b60608161088d81611518565b6001600160a01b038316600090815260036020908152604091829020600101805483518184028101840190945280845290918301828280156108f857602002820191906000526020600020905b81546001600160a01b031681526001909101906020018083116108da575b505050505091505b50919050565b61090e611f02565b8561091881611f2c565b610924878787876116bb565b60006109338888878787611940565b905061093e81611f82565b600061094982611fbf565b905060008061095784612067565b9150915083604001516001600160a01b031684602001516001600160a01b031685600001516001600160a01b03167f96310ab47353685e74601a419fddb52db22b6ce0f72cb735c35ff494289dd6423388606001518960a001518a60e0015189898c8e6101800151604051610a129897969594939291906001600160a01b03988916815296909716602087015293151560408601526060850192909252608084015260a083015260c082015260e08101919091526101000190565b60405180910390a45050505050610a2860018055565b505050505050565b81610a3a81612108565b6001600160a01b03831660008181526004602081905260409182902001849055517f6a1e9ac0e71aa1dc7854a57bce846b04b1aae20dc994b832098200d9236d1d4a90610a8a9085815260200190565b60405180910390a2505050565b336000908152600360205260408120905b6001820154811015610b0d576000826002016000846001018481548110610ad157610ad16149cf565b6000918252602080832091909101546001600160a01b031683528201929092526040019020805460ff1916911515919091179055600101610aa8565b50336000908152600460208190526040822080546001600160a01b031916815560018101839055600281018390556003810183905590810182905590610b566005830182614138565b5050336000908152600360205260408120805460ff1916815590610b7d6001830182614138565b505050565b6001600160a01b038181166000818152600460208190526040808320805491516370a0823160e01b815292830194909452919391909116906370a0823190602401602060405180830381865afa158015610be0573d6000803e3d6000fd5b505050506040513d601f19601f82011682018060405250810190610c049190614982565b9392505050565b88610c1581612108565b838015610c955750306001600160a01b03168a6001600160a01b031663d7b96d4e6040518163ffffffff1660e01b8152600401602060405180830381865afa158015610c65573d6000803e3d6000fd5b505050506040513d601f19601f82011682018060405250810190610c8991906149e5565b6001600160a01b031614155b15610cee57896001600160a01b031663f83d08ba6040518163ffffffff1660e01b8152600401600060405180830381600087803b158015610cd557600080fd5b505af1158015610ce9573d6000803e3d6000fd5b505050505b600080610d638c6001600160a01b03166399d50d5d6040518163ffffffff1660e01b8152600401600060405180830381865afa158015610d32573d6000803e3d6000fd5b505050506040513d6000823e601f3d908101601f19168201604052610d5a9190810190614a02565b8b8b8b8b61215e565b9150915060005b8251811015610e7f57610da8838281518110610d8857610d886149cf565b60200260200101518e6001600160a01b03166122d590919063ffffffff16565b15610dc55760405162461bcd60e51b81526004016104f690614a9b565b818181518110610dd757610dd76149cf565b6020026020010151600260008f6001600160a01b03166001600160a01b031681526020019081526020016000206000858481518110610e1857610e186149cf565b60200260200101516001600160a01b03166001600160a01b03168152602001908152602001600020600082015181600001556020820151816001019081610e5f9190614b1a565b5060408201516002820190610e749082614b1a565b505050600101610d6a565b506001600160a01b038c8116600090815260046020908152604090912080546001600160a01b031916928e1692909217825542600183015560028201879055600382018690558351610ed79260050191850190614156565b508a6001600160a01b03168c6001600160a01b03167f2ca831858de887d2ca1c692d1940334f1d3f6c80c9101a306201d66397cf9be68888888787604051610f23959493929190614bd9565b60405180910390a3505050505050505050505050565b82610f4381612108565b610f4d8383612351565b60005b83518110156110b457610f9685858381518110610f6f57610f6f6149cf565b6020026020010151858481518110610f8957610f896149cf565b60200260200101516123a7565b828181518110610fa857610fa86149cf565b602002602001015160036000876001600160a01b03166001600160a01b031681526020019081526020016000206002016000868481518110610fec57610fec6149cf565b60200260200101516001600160a01b03166001600160a01b0316815260200190815260200160002060006101000a81548160ff02191690831515021790555083818151811061103d5761103d6149cf565b60200260200101516001600160a01b0316856001600160a01b03167f4e771e3486d7afcce48115112ca75bc21bc33ac6d6261f7d273b9c582060671785848151811061108b5761108b6149cf565b60200260200101516040516110a4911515815260200190565b60405180910390a3600101610f50565b5050505050565b60006105c282611df4565b6000826110d281611518565b6110dc848461254d565b949350505050565b80336110f08282612597565b826110fa816125ed565b6000846001600160a01b031663802758606040518163ffffffff1660e01b8152600401600060405180830381865afa15801561113a573d6000803e3d6000fd5b505050506040513d6000823e601f3d908101601f191682016040526111629190810190614cd6565b905060005b81518110156111ea576000828281518110611184576111846149cf565b60200260200101519050806060015160ff166000146111b55760405162461bcd60e51b81526004016104f690614a9b565b6040808201516001600160a01b03808a1660009081526002602090815284822095519092168152939052912055600101611167565b50846001600160a01b0316635230c3966040518163ffffffff1660e01b8152600401602060405180830381865afa158015611229573d6000803e3d6000fd5b505050506040513d601f19601f8201168201806040525081019061124d9190614982565b6001600160a01b03861660008181526004602081905260408083206003019490945583516307ff078f60e11b815293519293630ffe0f1e938183019392909182900301818387803b1580156112a157600080fd5b505af11580156112b5573d6000803e3d6000fd5b505050505050505050565b6060816112cc81611518565b6001600160a01b038316600090815260046020908152604091829020600501805483518184028101840190945280845290918301828280156108f8576020028201919060005260206000209081546001600160a01b031681526001909101906020018083116108da575050505050915050919050565b60006105c282612708565b8161135781612108565b6001600160a01b038316600081815260036020908152604091829020805460ff191686151590811790915591519182527f1fed19c0eee5ddf8ef482a13e2f0c3ec5c1390b1e39160fe52eabd651ecc7dba9101610a8a565b806113b981611f2c565b6113c282611df4565b1561140f5760405162461bcd60e51b815260206004820152601d60248201527f526562616c616e6365206d75737420626520696e2070726f677265737300000060448201526064016104f6565b61141882611d97565b6114705760405162461bcd60e51b815260206004820152602360248201527f54617267657473206e6f74206d6574206f722071756f7465206173736574203d60448201526207e20360ec1b60648201526084016104f6565b6001600160a01b0382166000908152600460208190526040822001546114c4906114a290670de0b6b3a7640000614e1e565b6001600160a01b038516600090815260046020526040902060030154906127c9565b6001600160a01b0384166000818152600460205260409081902060030183905551919250907fe4c448aaaad94925b669914540bde1ea0123c0b2320e4cf6ea0ad7a1818a1c9890610a8a9084815260200190565b611521816127e8565b61157e5760405162461bcd60e51b815260206004820152602860248201527f4d75737420626520612076616c696420616e6420696e697469616c697a65642060448201526729b2ba2a37b5b2b760c11b60648201526084016104f6565b50565b60008061158e84846128c7565b95945050505050565b6000805460405163792aa04f60e01b815230600482015260248101839052829182916001600160a01b039091169063792aa04f90604401602060405180830381865afa1580156115eb573d6000803e3d6000fd5b505050506040513d601f19601f8201168201806040525081019061160f9190614982565b90506000806000806116228a8a8a612932565b935093509350935082840361166e5760405162461bcd60e51b815260206004820152601260248201527115185c99d95d08185b1c9958591e481b595d60721b60448201526064016104f6565b8181109650866116a25761169d61168d86670de0b6b3a7640000614e31565b6116978484614e31565b906127c9565b6116ac565b6116ac8183614e31565b95505050505050935093915050565b6001600160a01b0380851660009081526004602052604090205481169084168190036117355760405162461bcd60e51b8152602060048201526024808201527f43616e6e6f7420626964206578706c696369746c79206f6e2051756f746520416044820152631cdcd95d60e21b60648201526084016104f6565b806001600160a01b0316836001600160a01b03161461178d5760405162461bcd60e51b81526020600482015260146024820152730a2eadee8ca40c2e6e6cae840dad2e6dac2e8c6d60631b60448201526064016104f6565b61181e8460046000886001600160a01b03166001600160a01b0316815260200190815260200160002060050180548060200260200160405190810160405280929190818152602001828054801561049b576020028201919060005260206000209081546001600160a01b0316815260019091019060200180831161047d57505050505061158190919063ffffffff16565b61186a5760405162461bcd60e51b815260206004820152601f60248201527f436f6d706f6e656e74206e6f742070617274206f6620726562616c616e63650060448201526064016104f6565b61187d6001600160a01b038616856122d5565b1561189a5760405162461bcd60e51b81526004016104f690614a9b565b6118a385611df4565b156118f05760405162461bcd60e51b815260206004820152601d60248201527f526562616c616e6365206d75737420626520696e2070726f677265737300000060448201526064016104f6565b600082116110b45760405162461bcd60e51b815260206004820152601c60248201527f436f6d706f6e656e7420616d6f756e74206d757374206265203e20300000000060448201526064016104f6565b6119486140aa565b6001600160a01b038616808252604080516318160ddd60e01b815290516318160ddd916004808201926020929091908290030181865afa158015611990573d6000803e3d6000fd5b505050506040513d601f19601f820116820180604052508101906119b49190614982565b6101808201526119c48686612981565b6001600160a01b0390811660608301528681166000908152600260208181526040808420948a1684529390529190200180546119ff9061499b565b80601f0160208091040260200160405190810160405280929190818152602001828054611a2b9061499b565b8015611a785780601f10611a4d57610100808354040283529160200191611a78565b820191906000526020600020905b815481529060010190602001808311611a5b57829003601f168201915b50505050508160800181905250611a958686836101800151611597565b60c0830152151560a0820181905282151514611af35760405162461bcd60e51b815260206004820152601a60248201527f41756374696f6e20646972656374696f6e206d69736d6174636800000000000060448201526064016104f6565b6000198403611b08578060c001519350611b66565b8060c00151841115611b665760405162461bcd60e51b815260206004820152602160248201527f4269642073697a6520657863656564732061756374696f6e207175616e7469746044820152607960f81b60648201526084016104f6565b611b758160a001518787612a3e565b6001600160a01b039081166040808501919091529181166020808501919091526060840151898316600090815260049092529290206001015491169063104b9b6490889088908890611bc79042614e31565b6001600160a01b038c166000908152600460208190526040918290206002015460808a015192516001600160e01b031960e08a901b168152611c0f9796959493919201614e44565b602060405180830381865afa158015611c2c573d6000803e3d6000fd5b505050506040513d601f19601f82011682018060405250810190611c509190614982565b60e0820181905260a0820151600091611c6b91908790612a91565b60208301516040516370a0823160e01b81526001600160a01b038a811660048301529293509116906370a0823190602401602060405180830381865afa158015611cb9573d6000803e3d6000fd5b505050506040513d601f19601f82011682018060405250810190611cdd9190614982565b61014083015260408083015190516370a0823160e01b81526001600160a01b038981166004830152909116906370a0823190602401602060405180830381865afa158015611d2f573d6000803e3d6000fd5b505050506040513d601f19601f82011682018060405250810190611d539190614982565b82610160018181525050611d728260a001518286856101400151612ab1565b611d818260a001518683612bbd565b6101208401526101008301525095945050505050565b6001600160a01b0380821660009081526004602052604081208054919290918391611dc491869116612bd6565b8254611dda9086906001600160a01b0316612c93565b119050611de684612708565b80156110dc57509392505050565b6001600160a01b0381166000908152600460205260408120600281015460018201544291611e2191614e1e565b11159392505050565b6001600160a01b0381166000908152600460205260408120611e4b83612708565b8015611e5b5750611e5b83611e6d565b8015610c045750600401541592915050565b6001600160a01b0380821660009081526004602052604081208054919290918391611e9a91869116612bd6565b8254611eb09086906001600160a01b0316612c93565b835491109150600090611ef190611ed19087906001600160a01b0316612bd6565b8454600190611eea9089906001600160a01b0316612c93565b9190612cdd565b9050818061158e5750949350505050565b600260015403611f2557604051633ee5aeb560e01b815260040160405180910390fd5b6002600155565b611f36813361254d565b61157e5760405162461bcd60e51b815260206004820152601c60248201527f41646472657373206e6f74207065726d697474656420746f206269640000000060448201526064016104f6565b611f9b8160400151338360000151846101200151612d08565b6020810151610100820151825161157e926001600160a01b03909116913390612d14565b604081810151825161016084015192516370a0823160e01b81526001600160a01b038083166004830152600094859290918516906370a0823190602401602060405180830381865afa158015612019573d6000803e3d6000fd5b505050506040513d601f19601f8201168201806040525081019061203d9190614982565b6120479190614e31565b90506000612056600083612e5e565b905061158e83876040015183612ede565b80516020820151610180830151610140840151600093849390928492612099926001600160a01b038616929091612f6f565b5050905060006120cd8660400151876101800151886101600151866001600160a01b0316612f6f909392919063ffffffff16565b505090506000828761014001516120e49190614e31565b90506000876101600151836120f99190614e31565b91989197509095505050505050565b612112813361308e565b6115185760405162461bcd60e51b815260206004820152601c60248201527f4d7573742062652074686520536574546f6b656e206d616e616765720000000060448201526064016104f6565b8151606090819085146121c55760405162461bcd60e51b815260206004820152602960248201527f4e657720636f6d706f6e656e747320616e6420706172616d73206c656e677468604482015268040dad2e6dac2e8c6d60bb1b60648201526084016104f6565b82518751146122285760405162461bcd60e51b815260206004820152602960248201527f4f6c6420636f6d706f6e656e747320616e6420706172616d73206c656e677468604482015268040dad2e6dac2e8c6d60bb1b60648201526084016104f6565b6122678686808060200260200160405190810160405280939291908181526020018383602002808284376000920191909152508b9392505061310d9050565b915061227282613228565b156122bf5760405162461bcd60e51b815260206004820181905260248201527f43616e6e6f742068617665206475706c696361746520636f6d706f6e656e747360448201526064016104f6565b6122c98385613310565b90509550959350505050565b60405163a7bdad0360e01b81526001600160a01b038281166004830152600091829185169063a7bdad0390602401600060405180830381865afa158015612320573d6000803e3d6000fd5b505050506040513d6000823e601f3d908101601f191682016040526123489190810190614a02565b51119392505050565b805182511461239a5760405162461bcd60e51b8152602060048201526015602482015274082e4e4c2f240d8cadccee8d040dad2e6dac2e8c6d605b1b60448201526064016104f6565b6123a3826134f7565b5050565b80801561244257506124408260036000866001600160a01b03166001600160a01b0316815260200190815260200160002060010180548060200260200160405190810160405280929190818152602001828054801561049b576020028201919060005260206000209081546001600160a01b0316815260019091019060200180831161047d57505050505061158190919063ffffffff16565b155b1561248957506001600160a01b0391821660009081526003602090815260408220600190810180549182018155835291200180546001600160a01b03191691909216179055565b8015801561252357506125238260036000866001600160a01b03166001600160a01b0316815260200190815260200160002060010180548060200260200160405190810160405280929190818152602001828054801561049b576020028201919060005260206000209081546001600160a01b0316815260019091019060200180831161047d57505050505061158190919063ffffffff16565b15610b7d576001600160a01b0383166000908152600360205260409020610b7d906001018361359e565b6001600160a01b0382166000908152600360205260408120805460ff16806110dc57506001600160a01b038316600090815260028201602052604090205460ff1691505092915050565b6125a1828261308e565b6123a35760405162461bcd60e51b815260206004820152601c60248201527f4d7573742062652074686520536574546f6b656e206d616e616765720000000060448201526064016104f6565b600054604051631d3af8fb60e21b81526001600160a01b038381166004830152909116906374ebe3ec90602401602060405180830381865afa158015612637573d6000803e3d6000fd5b505050506040513d601f19601f8201168201806040525081019061265b9190614e8d565b6126b35760405162461bcd60e51b815260206004820152602360248201527f4d75737420626520636f6e74726f6c6c65722d656e61626c656420536574546f60448201526235b2b760e91b60648201526084016104f6565b6126bc81613711565b61157e5760405162461bcd60e51b815260206004820152601e60248201527f4d7573742062652070656e64696e6720696e697469616c697a6174696f6e000060448201526064016104f6565b6001600160a01b03811660009081526004602090815260408083206005018054825181850281018501909352808352849383018282801561277257602002820191906000526020600020905b81546001600160a01b03168152600190910190602001808311612754575b5050505050905060005b81518110156127bf576127a88483838151811061279b5761279b6149cf565b6020026020010151613740565b156127b7575060009392505050565b60010161277c565b5060019392505050565b6000816127de670de0b6b3a764000085614eaa565b610c049190614ec1565b60008054604051631d3af8fb60e21b81526001600160a01b038481166004830152909116906374ebe3ec90602401602060405180830381865afa158015612833573d6000803e3d6000fd5b505050506040513d601f19601f820116820180604052508101906128579190614e8d565b80156105c257506040516335fc6c9f60e21b81523060048201526001600160a01b0383169063d7f1b27c906024015b602060405180830381865afa1580156128a3573d6000803e3d6000fd5b505050506040513d601f19601f820116820180604052508101906105c29190614e8d565b81516000908190815b8181101561291f57846001600160a01b03168682815181106128f4576128f46149cf565b60200260200101516001600160a01b0316036129175792506001915061292b9050565b6001016128d0565b50600019600092509250505b9250929050565b60008060008060006129448888612c93565b905060006129528989612bd6565b9050600061296088846137b2565b9050600061296e89846137be565b939b929a50909850919650945050505050565b6001600160a01b03808316600090815260026020908152604080832093851683529290529081206001018054610c0491906129bb9061499b565b80601f01602080910402602001604051908101604052809291908181526020018280546129e79061499b565b8015612a345780601f10612a0957610100808354040283529160200191612a34565b820191906000526020600020905b815481529060010190602001808311612a1757829003601f168201915b505050505061380c565b60008084612a67576001600160a01b038085166000908152600460205260409020541683612a85565b6001600160a01b038085166000908152600460205260409020548491165b91509150935093915050565b600083612aa757612aa2838361381f565b6110dc565b6110dc83836137be565b8315612b175781831115612b125760405162461bcd60e51b815260206004820152602260248201527f51756f7465206173736574207175616e746974792065786365656473206c696d6044820152611a5d60f21b60648201526084016104f6565b612bb7565b81831015612b675760405162461bcd60e51b815260206004820181905260248201527f51756f7465206173736574207175616e746974792062656c6f77206c696d697460448201526064016104f6565b80831115612bb75760405162461bcd60e51b815260206004820181905260248201527f496e73756666696369656e742071756f74652061737365742062616c616e636560448201526064016104f6565b50505050565b60008084612bcc578284612a85565b5091939092509050565b600060046000846001600160a01b03166001600160a01b0316815260200190815260200160002060030154836001600160a01b0316635230c3966040518163ffffffff1660e01b8152600401602060405180830381865afa158015612c3f573d6000803e3d6000fd5b505050506040513d601f19601f82011682018060405250810190612c639190614982565b6001600160a01b038086166000908152600260209081526040808320938816835292905220546127de9190614eaa565b6040516366cb8d2f60e01b81526001600160a01b038281166004830152600091908416906366cb8d2f90602401602060405180830381865afa158015610be0573d6000803e3d6000fd5b6000612ce98284614e1e565b84111580156110dc5750612cfd8284614e31565b909310159392505050565b612bb784848484613834565b8015612bb7576040516370a0823160e01b81526001600160a01b038581166004830152600091908516906370a0823190602401602060405180830381865afa158015612d64573d6000803e3d6000fd5b505050506040513d601f19601f82011682018060405250810190612d889190614982565b9050612d9685858585613930565b6040516370a0823160e01b81526001600160a01b038681166004830152600091908616906370a0823190602401602060405180830381865afa158015612de0573d6000803e3d6000fd5b505050506040513d601f19601f82011682018060405250810190612e049190614982565b9050612e108383614e31565b8114610a285760405162461bcd60e51b815260206004820152601d60248201527f496e76616c696420706f7374207472616e736665722062616c616e636500000060448201526064016104f6565b6000805460405163792aa04f60e01b81523060048201526024810185905282916001600160a01b03169063792aa04f90604401602060405180830381865afa158015612eae573d6000803e3d6000fd5b505050506040513d601f19601f82011682018060405250810190612ed29190614982565b90506110dc838261381f565b8015610b7d57610b7d8260008054906101000a90046001600160a01b03166001600160a01b031663469048406040518163ffffffff1660e01b8152600401602060405180830381865afa158015612f39573d6000803e3d6000fd5b505050506040513d601f19601f82011682018060405250810190612f5d91906149e5565b6001600160a01b038616919084612d14565b6040516370a0823160e01b81526001600160a01b0385811660048301526000918291829182918816906370a0823190602401602060405180830381865afa158015612fbe573d6000803e3d6000fd5b505050506040513d601f19601f82011682018060405250810190612fe29190614982565b6040516366cb8d2f60e01b81526001600160a01b0389811660048301529192506000918a16906366cb8d2f90602401602060405180830381865afa15801561302e573d6000803e3d6000fd5b505050506040513d601f19601f820116820180604052508101906130529190614982565b90506000821561306f5761306888888585613a5c565b9050613073565b5060005b61307e8a8a83613a8d565b9199909850909650945050505050565b6000816001600160a01b0316836001600160a01b031663481c6a756040518163ffffffff1660e01b8152600401602060405180830381865afa1580156130d8573d6000803e3d6000fd5b505050506040513d601f19601f820116820180604052508101906130fc91906149e5565b6001600160a01b0316149392505050565b815181516060919060006131218284614e1e565b6001600160401b038111156131385761313861450a565b604051908082528060200260200182016040528015613161578160200160208202803683370190505b50905060005b838110156131bb57868181518110613181576131816149cf565b602002602001015182828151811061319b5761319b6149cf565b6001600160a01b0390921660209283029190910190910152600101613167565b5060005b8281101561321e578581815181106131d9576131d96149cf565b60200260200101518282866131ee9190614e1e565b815181106131fe576131fe6149cf565b6001600160a01b03909216602092830291909101909101526001016131bf565b5095945050505050565b6000808251116132675760405162461bcd60e51b815260206004820152600a6024820152694120697320656d70747960b01b60448201526064016104f6565b60005b600183516132789190614e31565b811015613307576000838281518110613293576132936149cf565b6020026020010151905060008260016132ac9190614e1e565b90505b84518110156132fd578481815181106132ca576132ca6149cf565b60200260200101516001600160a01b0316826001600160a01b0316036132f557506001949350505050565b6001016132af565b505060010161326a565b50600092915050565b81518151606091906133228183614e1e565b6001600160401b038111156133395761333961450a565b60405190808252806020026020018201604052801561338e57816020015b61337b60405180606001604052806000815260200160608152602001606081525090565b8152602001906001900390816133575790505b50925060005b828110156133fd576133be8682815181106133b1576133b16149cf565b6020026020010151613c61565b8581815181106133d0576133d06149cf565b60200260200101518482815181106133ea576133ea6149cf565b6020908102919091010152600101613394565b5060005b818110156134ee57600085828151811061341d5761341d6149cf565b6020026020010151600001511161348f5760405162461bcd60e51b815260206004820152603060248201527f4e657720636f6d706f6e656e742074617267657420756e6974206d757374206260448201526f0652067726561746572207468616e20360841b60648201526084016104f6565b6134a48582815181106133b1576133b16149cf565b8481815181106134b6576134b66149cf565b60200260200101518482856134cb9190614e1e565b815181106134db576134db6149cf565b6020908102919091010152600101613401565b50505092915050565b60008151116135485760405162461bcd60e51b815260206004820152601860248201527f4172726179206c656e677468206d757374206265203e2030000000000000000060448201526064016104f6565b61355181613228565b1561157e5760405162461bcd60e51b815260206004820152601a60248201527f43616e6e6f74206475706c69636174652061646472657373657300000000000060448201526064016104f6565b600080613604848054806020026020016040519081016040528092919081815260200182805480156135f957602002820191906000526020600020905b81546001600160a01b031681526001909101906020018083116135db575b5050505050846128c7565b915091508061364d5760405162461bcd60e51b815260206004820152601560248201527420b2323932b9b9903737ba1034b71030b93930bc9760591b60448201526064016104f6565b835460009061365e90600190614e31565b90508083146136d857848181548110613679576136796149cf565b9060005260206000200160009054906101000a90046001600160a01b03168584815481106136a9576136a96149cf565b9060005260206000200160006101000a8154816001600160a01b0302191690836001600160a01b031602179055505b848054806136e8576136e8614ee3565b600082815260209020810160001990810180546001600160a01b03191690550190555050505050565b6040516353bae5f760e01b81523060048201526000906001600160a01b038316906353bae5f790602401612886565b6001600160a01b0380831660009081526004602052604081205490919081169083160361376f575060006105c2565b600061377b8484612bd6565b905060006137898585612c93565b90506000821161379c578082141561158e565b6137a882826001612cdd565b1595945050505050565b6000610c04838361381f565b60008215806137cb575081155b156137d8575060006105c2565b670de0b6b3a764000060016137ed8486614eaa565b6137f79190614e31565b6138019190614ec1565b610c04906001614e1e565b80516020820120600090610c0481613d39565b6000670de0b6b3a76400006127de8385614eaa565b8015612bb7576040516370a0823160e01b81526001600160a01b038381166004830152600091908616906370a0823190602401602060405180830381865afa158015613884573d6000803e3d6000fd5b505050506040513d601f19601f820116820180604052508101906138a89190614982565b90506138b685858585613e12565b6040516370a0823160e01b81526001600160a01b038481166004830152600091908716906370a0823190602401602060405180830381865afa158015613900573d6000803e3d6000fd5b505050506040513d601f19601f820116820180604052508101906139249190614982565b9050612e108383614e1e565b8015612bb7576040516001600160a01b03831660248201526044810182905260009060640160408051601f198184030181529181526020820180516001600160e01b031663a9059cbb60e01b179052516347b7819960e11b81529091506000906001600160a01b03871690638f6f0332906139b390889085908790600401614ef9565b6000604051808303816000875af11580156139d2573d6000803e3d6000fd5b505050506040513d6000823e601f3d908101601f191682016040526139fa9190810190614f20565b805190915015610a285780806020019051810190613a189190614e8d565b610a285760405162461bcd60e51b8152602060048201526015602482015274115490cc8c081d1c985b9cd9995c8819985a5b1959605a1b60448201526064016104f6565b600080613a69838761381f565b613a739086614e31565b9050613a83866116978387614e31565b9695505050505050565b6000613a998484613e6c565b905080158015613aa95750600082115b15613b1d57613ab884846122d5565b613b18576040516304e3532760e41b81526001600160a01b038481166004830152851690634e35327090602401600060405180830381600087803b158015613aff57600080fd5b505af1158015613b13573d6000803e3d6000fd5b505050505b613b97565b808015613b28575081155b15613b9757613b3784846122d5565b613b9757604051636f86c89760e01b81526001600160a01b038481166004830152851690636f86c89790602401600060405180830381600087803b158015613b7e57600080fd5b505af1158015613b92573d6000803e3d6000fd5b505050505b604051632ba57d1760e01b81526001600160a01b03848116600483015260248201849052851690632ba57d1790604401600060405180830381600087803b158015613be157600080fd5b505af1158015613bf5573d6000803e3d6000fd5b5050604051632ba57d1760e01b81526001600160a01b0386811660048301526024820186905287169250632ba57d179150604401600060405180830381600087803b158015613c4357600080fd5b505af1158015613c57573d6000803e3d6000fd5b5050505050505050565b6000613c70826020015161380c565b60408084015190516301e7dafd60e21b81529192506001600160a01b0383169163079f6bf491613ca291600401614f54565b602060405180830381865afa158015613cbf573d6000803e3d6000fd5b505050506040513d601f19601f82011682018060405250810190613ce39190614e8d565b6123a35760405162461bcd60e51b815260206004820152602160248201527f5072696365206164617074657220636f6e666967206461746120696e76616c696044820152601960fa1b60648201526084016104f6565b600080548190613d51906001600160a01b0316613ee3565b60405163e6d642c560e01b8152306004820152602481018590526001600160a01b03919091169063e6d642c590604401602060405180830381865afa158015613d9e573d6000803e3d6000fd5b505050506040513d601f19601f82011682018060405250810190613dc291906149e5565b90506001600160a01b0381166105c25760405162461bcd60e51b815260206004820152601560248201527426bab9ba103132903b30b634b21030b230b83a32b960591b60448201526064016104f6565b604080516001600160a01b0385811660248301528416604482015260648082018490528251808303909101815260849091019091526020810180516001600160e01b03166323b872dd60e01b179052612bb7908590613f4f565b6040516366cb8d2f60e01b81526001600160a01b03828116600483015260009182918516906366cb8d2f90602401602060405180830381865afa158015613eb7573d6000803e3d6000fd5b505050506040513d601f19601f82011682018060405250810190613edb9190614982565b139392505050565b6040516373b2e76b60e11b8152600060048201819052906001600160a01b0383169063e765ced690602401602060405180830381865afa158015613f2b573d6000803e3d6000fd5b505050506040513d601f19601f820116820180604052508101906105c291906149e5565b6000613f646001600160a01b03841683613fb2565b90508051600014158015613f89575080806020019051810190613f879190614e8d565b155b15610b7d57604051635274afe760e01b81526001600160a01b03841660048201526024016104f6565b6060610c048383600084600080856001600160a01b03168486604051613fd89190614f67565b60006040518083038185875af1925050503d8060008114614015576040519150601f19603f3d011682016040523d82523d6000602084013e61401a565b606091505b5091509150613a8386838360608261403a5761403582614081565b610c04565b815115801561405157506001600160a01b0384163b155b1561407a57604051639996b31560e01b81526001600160a01b03851660048201526024016104f6565b5080610c04565b8051156140915780518082602001fd5b604051630a12f52160e11b815260040160405180910390fd5b604051806101a0016040528060006001600160a01b0316815260200160006001600160a01b0316815260200160006001600160a01b0316815260200160006001600160a01b0316815260200160608152602001600015158152602001600081526020016000815260200160008152602001600081526020016000815260200160008152602001600081525090565b508054600082559060005260206000209081019061157e91906141bb565b8280548282559060005260206000209081019282156141ab579160200282015b828111156141ab57825182546001600160a01b0319166001600160a01b03909116178255602090920191600190910190614176565b506141b79291506141bb565b5090565b5b808211156141b757600081556001016141bc565b6001600160a01b038116811461157e57600080fd5b80356141f0816141d0565b919050565b6000806040838503121561420857600080fd5b8235614213816141d0565b91506020830135614223816141d0565b809150509250929050565b801515811461157e57600080fd5b80356141f08161422e565b60008060008060008060c0878903121561426057600080fd5b863561426b816141d0565b9550602087013561427b816141d0565b9450604087013561428b816141d0565b9350606087013592506080870135915060a08701356142a98161422e565b809150509295509295509295565b60005b838110156142d25781810151838201526020016142ba565b50506000910152565b600081518084526142f38160208601602086016142b7565b601f01601f19169290920160200192915050565b602081526143216020820183516001600160a01b03169052565b6000602083015161433d60408401826001600160a01b03169052565b5060408301516001600160a01b03811660608401525060608301516001600160a01b03811660808401525060808301516101a08060a08501526143846101c08501836142db565b915060a085015161439960c086018215159052565b5060c085015160e0858101919091528501516101008086019190915285015161012080860191909152850151610140808601919091528501516101608086019190915285015161018080860191909152909401519390920192909252919050565b60006020828403121561440c57600080fd5b8135610c04816141d0565b83815260606020820152600061443060608301856142db565b8281036040840152613a8381856142db565b60008151808452602080850194506020840160005b8381101561447c5781516001600160a01b031687529582019590820190600101614457565b509495945050505050565b602081526000610c046020830184614442565b600080604083850312156144ad57600080fd5b82356144b8816141d0565b946020939093013593505050565b60008083601f8401126144d857600080fd5b5081356001600160401b038111156144ef57600080fd5b6020830191508360208260051b850101111561292b57600080fd5b634e487b7160e01b600052604160045260246000fd5b604051606081016001600160401b03811182821017156145425761454261450a565b60405290565b60405160a081016001600160401b03811182821017156145425761454261450a565b604051601f8201601f191681016001600160401b03811182821017156145925761459261450a565b604052919050565b60006001600160401b038211156145b3576145b361450a565b5060051b60200190565b60006001600160401b038211156145d6576145d661450a565b50601f01601f191660200190565b60006145f76145f2846145bd565b61456a565b905082815283838301111561460b57600080fd5b828260208301376000602084830101529392505050565b600082601f83011261463357600080fd5b813560206146436145f28361459a565b82815260059290921b8401810191818101908684111561466257600080fd5b8286015b8481101561473a5780356001600160401b03808211156146865760008081fd5b908801906060828b03601f19018113156146a05760008081fd5b6146a8614520565b878401358152604080850135848111156146c25760008081fd5b8501603f8082018f136146d55760008081fd5b6146e58f8c8401358585016145e4565b848c01529386013593858511156146fe57600091508182fd5b84870196508e8188011261471457600095508586fd5b50506147268d8a8701358388016145e4565b908201528652505050918301918301614666565b509695505050505050565b60008060008060008060008060006101008a8c03121561476457600080fd5b61476d8a6141e5565b985061477b60208b016141e5565b975060408a01356001600160401b038082111561479757600080fd5b6147a38d838e016144c6565b909950975060608c01359150808211156147bc57600080fd5b6147c88d838e01614622565b965060808c01359150808211156147de57600080fd5b506147eb8c828d01614622565b9450506147fa60a08b0161423c565b925060c08a0135915060e08a013590509295985092959850929598565b600082601f83011261482857600080fd5b813560206148386145f28361459a565b8083825260208201915060208460051b87010193508684111561485a57600080fd5b602086015b8481101561473a5780356148728161422e565b835291830191830161485f565b60008060006060848603121561489457600080fd5b833561489f816141d0565b92506020848101356001600160401b03808211156148bc57600080fd5b818701915087601f8301126148d057600080fd5b81356148de6145f28261459a565b81815260059190911b8301840190848101908a8311156148fd57600080fd5b938501935b82851015614924578435614915816141d0565b82529385019390850190614902565b96505050604087013592508083111561493c57600080fd5b505061494a86828701614817565b9150509250925092565b6000806040838503121561496757600080fd5b8235614972816141d0565b915060208301356142238161422e565b60006020828403121561499457600080fd5b5051919050565b600181811c908216806149af57607f821691505b60208210810361090057634e487b7160e01b600052602260045260246000fd5b634e487b7160e01b600052603260045260246000fd5b6000602082840312156149f757600080fd5b8151610c04816141d0565b60006020808385031215614a1557600080fd5b82516001600160401b03811115614a2b57600080fd5b8301601f81018513614a3c57600080fd5b8051614a4a6145f28261459a565b81815260059190911b82018301908381019087831115614a6957600080fd5b928401925b82841015614a90578351614a81816141d0565b82529284019290840190614a6e565b979650505050505050565b6020808252601e908201527f45787465726e616c20706f736974696f6e73206e6f7420616c6c6f7765640000604082015260600190565b601f821115610b7d576000816000526020600020601f850160051c81016020861015614afb5750805b601f850160051c820191505b81811015610a2857828155600101614b07565b81516001600160401b03811115614b3357614b3361450a565b614b4781614b41845461499b565b84614ad2565b602080601f831160018114614b7c5760008415614b645750858301515b600019600386901b1c1916600185901b178555610a28565b600085815260208120601f198616915b82811015614bab57888601518255948401946001909101908401614b8c565b5085821015614bc95787850151600019600388901b60f8161c191681555b5050505050600190811b01905550565b85151581526000602086818401526040866040850152606060a06060860152614c0560a0860188614442565b8581036080870152865180825284820190600581901b83018601868a0160005b83811015614c7d57601f1986840301855281518051845289810151888b860152614c51898601826142db565b918a0151858303868c0152919050614c6981836142db565b968b01969450505090880190600101614c25565b50909e9d5050505050505050505050505050565b600082601f830112614ca257600080fd5b8151614cb06145f2826145bd565b818152846020838601011115614cc557600080fd5b6110dc8260208301602087016142b7565b60006020808385031215614ce957600080fd5b82516001600160401b0380821115614d0057600080fd5b818501915085601f830112614d1457600080fd5b8151614d226145f28261459a565b81815260059190911b83018401908481019088831115614d4157600080fd5b8585015b83811015614dfb57805185811115614d5d5760008081fd5b860160a0818c03601f1901811315614d755760008081fd5b614d7d614548565b89830151614d8a816141d0565b8152604083810151614d9b816141d0565b808c8401525060608085015182840152608091508185015160ff81168114614dc35760008081fd5b90830152918301519188831115614dda5760008081fd5b614de88e8c85870101614c91565b9082015285525050918601918601614d45565b5098975050505050505050565b634e487b7160e01b600052601160045260246000fd5b808201808211156105c2576105c2614e08565b818103818111156105c2576105c2614e08565b600060018060a01b03808916835280881660208401525085604083015284606083015283608083015260c060a0830152614e8160c08301846142db565b98975050505050505050565b600060208284031215614e9f57600080fd5b8151610c048161422e565b80820281158282048414176105c2576105c2614e08565b600082614ede57634e487b7160e01b600052601260045260246000fd5b500490565b634e487b7160e01b600052603160045260246000fd5b60018060a01b038416815282602082015260606040820152600061158e60608301846142db565b600060208284031215614f3257600080fd5b81516001600160401b03811115614f4857600080fd5b6110dc84828501614c91565b602081526000610c0460208301846142db565b60008251614f798184602087016142b7565b919091019291505056fea2646970667358221220b382cb7bdb537f713859f4f3b670db54624fc42d315bfca72438b964047f1ba064736f6c63430008190033",
  "devdoc": {
    "details": "Compatible with StreamingFeeModule and BasicIssuanceModule. Review compatibility if used with additional modules.WARNING: If rebalances don't lock the SetToken, there's potential for bids to be front-run by sizable issuance/redemption. This could lead to the SetToken not approaching its target allocation proportionately to the bid size. To counteract this risk, a supply cap can be applied to the SetToken, allowing regular issuance/redemption while preventing front-running with large issuance/redemption.WARNING: This contract does NOT support ERC-777 component tokens or quote assets.WARNING: Please note that the behavior of block.timestamp varies across different EVM chains. This contract does not incorporate additional checks for unique behavior or for elements like sequencer uptime. Ensure you understand these characteristics when interacting with the contract on different EVM chains.",
    "errors": {
      "AddressEmptyCode(address)": [
        {
          "details": "There's no code at `target` (it is not a contract)."
        }
      ],
      "AddressInsufficientBalance(address)": [
        {
          "details": "The ETH balance of the account is not enough to perform the operation."
        }
      ],
      "FailedInnerCall()": [
        {
          "details": "A call to an address target failed. The target may have reverted."
        }
      ],
      "ReentrancyGuardReentrantCall()": [
        {
          "details": "Unauthorized reentrant call."
        }
      ],
      "SafeERC20FailedOperation(address)": [
        {
          "details": "An operation with an ERC20 token failed."
        }
      ]
    },
    "events": {
      "AnyoneBidUpdated(address,bool)": {
        "details": "Emitted upon toggling the bid permission setting via setAnyoneBid()",
        "params": {
          "isAnyoneAllowedToBid": "Flag indicating if bids are open to all (true) or restricted (false)",
          "setToken": "Reference to the SetToken undergoing rebalancing"
        }
      },
      "AssetTargetsRaised(address,uint256)": {
        "details": "Emitted upon calling raiseAssetTargets()",
        "params": {
          "newPositionMultiplier": "Updated position multiplier for the SetToken rebalance",
          "setToken": "Reference to the SetToken undergoing rebalancing"
        }
      },
      "BidExecuted(address,address,address,address,address,bool,uint256,uint256,uint256,uint256,uint256)": {
        "details": "Emitted upon execution of a bid via the bid() function.",
        "params": {
          "bidder": "The address of the bidder.",
          "isSellAuction": "Indicates if this is a sell auction (true) or a buy auction (false).",
          "netQuantityReceivedBySet": "The net amount of tokens received by the SetToken in the bid.",
          "netQuantitySentBySet": "The net amount of tokens sent by the SetToken in the bid.",
          "price": "The price of the component in precise units (10 ** 18).",
          "priceAdapter": "Instance of the price adapter contract used for this bid.",
          "protocolFee": "The amount of the received token allocated as a protocol fee.",
          "receiveToken": "The ERC20 token that is being received by the bidder.",
          "sendToken": "The ERC20 token that is being sent by the bidder.",
          "setToken": "Instance of the SetToken contract that is being rebalanced.",
          "setTotalSupply": "The total supply of the SetToken at the time of the bid."
        }
      },
      "BidderStatusUpdated(address,address,bool)": {
        "details": "Emitted when the bidding status of an address is changed via setBidderStatus()",
        "params": {
          "bidder": "Address whose bidding permission status is toggled",
          "isBidderAllowed": "Flag indicating if the address is allowed (true) or not allowed (false) to bid",
          "setToken": "Reference to the SetToken undergoing rebalancing"
        }
      },
      "LockedRebalanceEndedEarly(address)": {
        "details": "Emitted when a locked rebalance is concluded early via the unlock() function.",
        "params": {
          "setToken": "Instance of the SetToken contract that is being rebalanced."
        }
      },
      "RaiseTargetPercentageUpdated(address,uint256)": {
        "details": "Emitted when the target percentage increase is modified via setRaiseTargetPercentage()",
        "params": {
          "newRaiseTargetPercentage": "Updated percentage for potential target unit increases, in precise units (10 ** 18)",
          "setToken": "Reference to the SetToken undergoing rebalancing"
        }
      },
      "RebalanceStarted(address,address,bool,uint256,uint256,address[],(uint256,string,bytes)[])": {
        "details": "Emitted when a rebalance is initiated using the startRebalance() function.",
        "params": {
          "auctionParameters": "Array of AuctionExecutionParams structs, containing auction parameters for each component token.",
          "componentsInvolved": "Array of addresses of the component tokens involved in the rebalance.",
          "initialPositionMultiplier": "Position multiplier when target units were calculated.",
          "isSetTokenLocked": "Indicates if the rebalance process locks the SetToken (true) or not (false).",
          "quoteAsset": "The ERC20 token that is used as a quote currency for the auctions.",
          "rebalanceDuration": "Duration of the rebalance process in seconds.",
          "setToken": "Instance of the SetToken contract that is undergoing rebalancing."
        }
      }
    },
    "kind": "dev",
    "methods": {
      "allTargetsMet(address)": {
        "details": "Checks externally if all target units for components have been met.",
        "params": {
          "_setToken": "Instance of the SetToken to be rebalanced."
        },
        "returns": {
          "_0": "bool True if all component's target units have been met; false otherwise."
        }
      },
      "bid(address,address,address,uint256,uint256,bool)": {
        "details": "ACCESS LIMITED: Only approved addresses can call this function unless isAnyoneAllowedToBid is enabled. This function is used to push the current component units closer to the target units defined in startRebalance(). Bidders specify the amount of the component they intend to buy or sell, and also specify the maximum/minimum amount of the quote asset they are willing to spend/receive. If the component amount is max uint256, the bid will fill the remaining amount to reach the target. The auction parameters, which are set by the manager, are used to determine the price of the component. Any bids that either don't move the component units towards the target, or overshoot the target, will be reverted. If protocol fees are enabled, they are collected in the token received in a bid. SELL AUCTIONS: At the start of the rebalance, sell auctions are available to be filled in their full size. BUY AUCTIONS: Buy auctions can be filled up to the amount of quote asset available in the SetToken. This means that if the SetToken does not contain the quote asset as a component, buy auctions cannot be bid on until sell auctions have been executed and there is quote asset available in the SetToken.",
        "params": {
          "_component": "The component for which the auction is to be bid on.",
          "_componentAmount": "The amount of component in the bid.",
          "_isSellAuction": "The direction of the auction expected by the bidder",
          "_quoteAsset": "The ERC20 token expected to be used as the quote asset by the bidder",
          "_quoteAssetLimit": "The maximum or minimum amount of quote asset that can be spent or received during the bid.",
          "_setToken": "The SetToken to be rebalanced."
        }
      },
      "canRaiseAssetTargets(address)": {
        "details": "Checks externally if the conditions to raise asset targets are met.",
        "params": {
          "_setToken": "The SetToken being checked."
        },
        "returns": {
          "_0": "bool True if conditions to raise asset targets are met; false otherwise."
        }
      },
      "canUnlockEarly(address)": {
        "details": "Checks externally if the conditions for early unlock are met.",
        "params": {
          "_setToken": "The SetToken being checked."
        },
        "returns": {
          "_0": "bool True if early unlock conditions are met; false otherwise."
        }
      },
      "getAllowedBidders(address)": {
        "details": "Retrieves the list of addresses that are permitted to participate in the auction by calling `bid()`.",
        "params": {
          "_setToken": "Instance of the SetToken for which to retrieve the list of allowed bidders."
        },
        "returns": {
          "_0": "address[]          Array of addresses representing the allowed bidders."
        }
      },
      "getAuctionSizeAndDirection(address,address)": {
        "details": "Calculates the quantity of a component involved in the rebalancing of the given SetToken, and determines if the component is being bought or sold.",
        "params": {
          "_component": "Instance of the IERC20 component to bid on.",
          "_setToken": "Instance of the SetToken being rebalanced."
        },
        "returns": {
          "componentQuantity": "  Quantity of the component involved in the bid.",
          "isSellAuction": "      Indicates if this is a sell auction (true) or a buy auction (false)."
        }
      },
      "getBidPreview(address,address,address,uint256,uint256,bool)": {
        "details": "Generates a preview of the bid for a given component in the rebalancing of the SetToken. It calculates the quantity of the component that will be exchanged and the direction of exchange.",
        "params": {
          "_component": "Instance of the component auction to bid on.",
          "_componentQuantity": "Quantity of the component involved in the bid.",
          "_isSellAuction": "The direction of the auction expected by the bidder",
          "_quoteAsset": "The ERC20 token expected to be used as the quote asset by the bidder",
          "_quoteQuantityLimit": "Maximum or minimum amount of quote asset spent or received during the bid.",
          "_setToken": "Instance of the SetToken being rebalanced."
        },
        "returns": {
          "_0": "BidInfo              Struct containing data for the bid."
        }
      },
      "getQuoteAssetBalance(address)": {
        "details": "Retrieves the balance of the quote asset for a given SetToken.",
        "params": {
          "_setToken": "The SetToken whose quote asset balance is being retrieved."
        },
        "returns": {
          "_0": "uint256 The balance of the quote asset."
        }
      },
      "getRebalanceComponents(address)": {
        "details": "Retrieves the array of components that are involved in the rebalancing of the given SetToken.",
        "params": {
          "_setToken": "Instance of the SetToken."
        },
        "returns": {
          "_0": "address[]   Array of component addresses involved in the rebalance."
        }
      },
      "initialize(address)": {
        "details": "MANAGER ONLY: Initializes the module for a SetToken, enabling access to AuctionModuleV1 for rebalances. Retrieves the current units for each asset in the Set and sets the targetUnit to match the current unit, effectively preventing any bidding until `startRebalance()` is explicitly called. The position multiplier is also logged to ensure that any changes to the position multiplier do not unintentionally open the Set for rebalancing.",
        "params": {
          "_setToken": "Address of the Set Token"
        }
      },
      "isAllowedBidder(address,address)": {
        "details": "Determines whether the given bidder address is allowed to participate in the auction.",
        "params": {
          "_bidder": "Address of the bidder.",
          "_setToken": "Instance of the SetToken for which the bid is being placed."
        },
        "returns": {
          "_0": "bool       True if the given `_bidder` is permitted to bid, false otherwise."
        }
      },
      "isQuoteAssetExcessOrAtTarget(address)": {
        "details": "Checks externally if the quote asset is in excess or at target.",
        "params": {
          "_setToken": "The SetToken being checked."
        },
        "returns": {
          "_0": "bool True if the quote asset is in excess or at target; false otherwise."
        }
      },
      "isRebalanceDurationElapsed(address)": {
        "details": "Checks externally if the rebalance duration has elapsed for the given SetToken.",
        "params": {
          "_setToken": "The SetToken whose rebalance duration is being checked."
        },
        "returns": {
          "_0": "bool True if the rebalance duration has elapsed; false otherwise."
        }
      },
      "raiseAssetTargets(address)": {
        "details": "ACCESS LIMITED: Increases asset targets uniformly when all target units have been met but there is remaining quote asset. Can be called multiple times if necessary. Targets are increased by the percentage specified by raiseAssetTargetsPercentage set by the manager. This helps in reducing tracking error and providing greater granularity in reaching an equilibrium between the excess quote asset and the components to be purchased. However, excessively raising targets may result in under-allocating to the quote asset as more of it is spent buying components to meet the new targets.",
        "params": {
          "_setToken": "The SetToken to be rebalanced."
        }
      },
      "removeModule()": {
        "details": "Called by a SetToken to notify that this module was removed from the SetToken. Clears the `rebalanceInfo` and `permissionsInfo` of the calling SetToken. IMPORTANT: The auction execution settings of the SetToken, including auction parameters, are NOT DELETED. Restoring a previously removed module requires careful initialization of the execution settings."
      },
      "setAnyoneBid(address,bool)": {
        "details": "MANAGER ONLY: Toggles whether or not anyone is allowed to call the `bid()` function. If set to true, it bypasses the bidAllowList, allowing any address to call the `bid()` function. The manager can call this function at any time.",
        "params": {
          "_setToken": "The SetToken instance.",
          "_status": "A boolean indicating if anyone can bid."
        }
      },
      "setBidderStatus(address,address[],bool[])": {
        "details": "MANAGER ONLY: Toggles the permission status of specified addresses to call the `bid()` function. The manager can call this function at any time.",
        "params": {
          "_bidders": "An array of addresses whose bidding permission status is to be toggled.",
          "_setToken": "The SetToken being rebalanced.",
          "_statuses": "An array of booleans indicating the new bidding permission status for each corresponding address in `_bidders`."
        }
      },
      "setRaiseTargetPercentage(address,uint256)": {
        "details": "MANAGER ONLY: Sets the percentage by which the target units for all components can be increased. Can be called at any time by the manager.",
        "params": {
          "_raiseTargetPercentage": "The percentage (in precise units) by which the target units can be increased.",
          "_setToken": "The SetToken to be rebalanced."
        }
      },
      "startRebalance(address,address,address[],(uint256,string,bytes)[],(uint256,string,bytes)[],bool,uint256,uint256)": {
        "details": "MANAGER ONLY: Initiates the rebalance process by setting target allocations for the SetToken. Opens auctions for filling by the Set's designated bidders. The function takes in new components to be added with their target units and existing components with updated target units (set to 0 if removing). A positionMultiplier is supplied to adjust target units, e.g., in cases where fee accrual affects the positionMultiplier of the SetToken, ensuring proportional allocation among components. If target allocations are not met within the specified duration, the rebalance concludes with the allocations achieved.WARNING: If rebalances don't lock the SetToken, enforce a supply cap on the SetToken to prevent front-running.",
        "params": {
          "_initialPositionMultiplier": "Position multiplier at the start of the rebalance.",
          "_newComponents": "Addresses of new components to be added.",
          "_newComponentsAuctionParams": "AuctionExecutionParams for new components, indexed corresponding to _newComponents.",
          "_oldComponentsAuctionParams": "AuctionExecutionParams for existing components, indexed corresponding to                                      the current component positions. Set to 0 for components being removed.",
          "_quoteAsset": "ERC20 token used as the quote asset in auctions.",
          "_rebalanceDuration": "Duration of the rebalance in seconds.",
          "_setToken": "The SetToken to be rebalanced.",
          "_shouldLockSetToken": "Indicates if the rebalance should lock the SetToken."
        }
      },
      "unlock(address)": {
        "details": "Unlocks the SetToken after rebalancing. Can be called once the rebalance duration has elapsed. Can only be called before the rebalance duration has elapsed if all targets are met, there is excess or at-target quote asset, and raiseTargetPercentage is zero. Resets the raiseTargetPercentage to zero.",
        "params": {
          "_setToken": "The SetToken to be unlocked."
        }
      }
    },
    "title": "AuctionRebalanceModuleV1",
    "version": 1
  },
  "userdoc": {
    "kind": "user",
    "methods": {},
    "notice": "Facilitates rebalances for index sets via single-asset auctions. Managers initiate rebalances specifying target allocations in precise units (scaled by 10^18), quote asset (e.g., WETH, USDC), auction parameters per component, and rebalance duration through startRebalance(). Bidders can participate via bid() for individual components. Excess quote asset can be managed by proportionally increasing the targets using raiseAssetTargets().",
    "version": 1
  },
  "storageLayout": {
    "storage": [
      {
        "astId": 5359,
        "contract": "contracts/modules/AuctionRebalanceModuleV1.sol:AuctionRebalanceModuleV1",
        "label": "controller",
        "offset": 0,
        "slot": "0",
        "type": "t_contract(IController)3769"
      },
      {
        "astId": 1523,
        "contract": "contracts/modules/AuctionRebalanceModuleV1.sol:AuctionRebalanceModuleV1",
        "label": "_status",
        "offset": 0,
        "slot": "1",
        "type": "t_uint256"
      },
      {
        "astId": 7099,
        "contract": "contracts/modules/AuctionRebalanceModuleV1.sol:AuctionRebalanceModuleV1",
        "label": "executionInfo",
        "offset": 0,
        "slot": "2",
        "type": "t_mapping(t_contract(ISetToken)4183,t_mapping(t_contract(IERC20)877,t_struct(AuctionExecutionParams)6942_storage))"
      },
      {
        "astId": 7105,
        "contract": "contracts/modules/AuctionRebalanceModuleV1.sol:AuctionRebalanceModuleV1",
        "label": "permissionInfo",
        "offset": 0,
        "slot": "3",
        "type": "t_mapping(t_contract(ISetToken)4183,t_struct(BidPermissionInfo)6952_storage)"
      },
      {
        "astId": 7111,
        "contract": "contracts/modules/AuctionRebalanceModuleV1.sol:AuctionRebalanceModuleV1",
        "label": "rebalanceInfo",
        "offset": 0,
        "slot": "4",
        "type": "t_mapping(t_contract(ISetToken)4183,t_struct(RebalanceInfo)6967_storage)"
      }
    ],
    "types": {
      "t_address": {
        "encoding": "inplace",
        "label": "address",
        "numberOfBytes": "20"
      },
      "t_array(t_address)dyn_storage": {
        "base": "t_address",
        "encoding": "dynamic_array",
        "label": "address[]",
        "numberOfBytes": "32"
      },
      "t_bool": {
        "encoding": "inplace",
        "label": "bool",
        "numberOfBytes": "1"
      },
      "t_bytes_storage": {
        "encoding": "bytes",
        "label": "bytes",
        "numberOfBytes": "32"
      },
      "t_contract(IController)3769": {
        "encoding": "inplace",
        "label": "contract IController",
        "numberOfBytes": "20"
      },
      "t_contract(IERC20)877": {
        "encoding": "inplace",
        "label": "contract IERC20",
        "numberOfBytes": "20"
      },
      "t_contract(ISetToken)4183": {
        "encoding": "inplace",
        "label": "contract ISetToken",
        "numberOfBytes": "20"
      },
      "t_mapping(t_address,t_bool)": {
        "encoding": "mapping",
        "key": "t_address",
        "label": "mapping(address => bool)",
        "numberOfBytes": "32",
        "value": "t_bool"
      },
      "t_mapping(t_contract(IERC20)877,t_struct(AuctionExecutionParams)6942_storage)": {
        "encoding": "mapping",
        "key": "t_contract(IERC20)877",
        "label": "mapping(contract IERC20 => struct AuctionRebalanceModuleV1.AuctionExecutionParams)",
        "numberOfBytes": "32",
        "value": "t_struct(AuctionExecutionParams)6942_storage"
      },
      "t_mapping(t_contract(ISetToken)4183,t_mapping(t_contract(IERC20)877,t_struct(AuctionExecutionParams)6942_storage))": {
        "encoding": "mapping",
        "key": "t_contract(ISetToken)4183",
        "label": "mapping(contract ISetToken => mapping(contract IERC20 => struct AuctionRebalanceModuleV1.AuctionExecutionParams))",
        "numberOfBytes": "32",
        "value": "t_mapping(t_contract(IERC20)877,t_struct(AuctionExecutionParams)6942_storage)"
      },
      "t_mapping(t_contract(ISetToken)4183,t_struct(BidPermissionInfo)6952_storage)": {
        "encoding": "mapping",
        "key": "t_contract(ISetToken)4183",
        "label": "mapping(contract ISetToken => struct AuctionRebalanceModuleV1.BidPermissionInfo)",
        "numberOfBytes": "32",
        "value": "t_struct(BidPermissionInfo)6952_storage"
      },
      "t_mapping(t_contract(ISetToken)4183,t_struct(RebalanceInfo)6967_storage)": {
        "encoding": "mapping",
        "key": "t_contract(ISetToken)4183",
        "label": "mapping(contract ISetToken => struct AuctionRebalanceModuleV1.RebalanceInfo)",
        "numberOfBytes": "32",
        "value": "t_struct(RebalanceInfo)6967_storage"
      },
      "t_string_storage": {
        "encoding": "bytes",
        "label": "string",
        "numberOfBytes": "32"
      },
      "t_struct(AuctionExecutionParams)6942_storage": {
        "encoding": "inplace",
        "label": "struct AuctionRebalanceModuleV1.AuctionExecutionParams",
        "members": [
          {
            "astId": 6937,
            "contract": "contracts/modules/AuctionRebalanceModuleV1.sol:AuctionRebalanceModuleV1",
            "label": "targetUnit",
            "offset": 0,
            "slot": "0",
            "type": "t_uint256"
          },
          {
            "astId": 6939,
            "contract": "contracts/modules/AuctionRebalanceModuleV1.sol:AuctionRebalanceModuleV1",
            "label": "priceAdapterName",
            "offset": 0,
            "slot": "1",
            "type": "t_string_storage"
          },
          {
            "astId": 6941,
            "contract": "contracts/modules/AuctionRebalanceModuleV1.sol:AuctionRebalanceModuleV1",
            "label": "priceAdapterConfigData",
            "offset": 0,
            "slot": "2",
            "type": "t_bytes_storage"
          }
        ],
        "numberOfBytes": "96"
      },
      "t_struct(BidPermissionInfo)6952_storage": {
        "encoding": "inplace",
        "label": "struct AuctionRebalanceModuleV1.BidPermissionInfo",
        "members": [
          {
            "astId": 6944,
            "contract": "contracts/modules/AuctionRebalanceModuleV1.sol:AuctionRebalanceModuleV1",
            "label": "isAnyoneAllowedToBid",
            "offset": 0,
            "slot": "0",
            "type": "t_bool"
          },
          {
            "astId": 6947,
            "contract": "contracts/modules/AuctionRebalanceModuleV1.sol:AuctionRebalanceModuleV1",
            "label": "biddersHistory",
            "offset": 0,
            "slot": "1",
            "type": "t_array(t_address)dyn_storage"
          },
          {
            "astId": 6951,
            "contract": "contracts/modules/AuctionRebalanceModuleV1.sol:AuctionRebalanceModuleV1",
            "label": "bidAllowList",
            "offset": 0,
            "slot": "2",
            "type": "t_mapping(t_address,t_bool)"
          }
        ],
        "numberOfBytes": "96"
      },
      "t_struct(RebalanceInfo)6967_storage": {
        "encoding": "inplace",
        "label": "struct AuctionRebalanceModuleV1.RebalanceInfo",
        "members": [
          {
            "astId": 6955,
            "contract": "contracts/modules/AuctionRebalanceModuleV1.sol:AuctionRebalanceModuleV1",
            "label": "quoteAsset",
            "offset": 0,
            "slot": "0",
            "type": "t_contract(IERC20)877"
          },
          {
            "astId": 6957,
            "contract": "contracts/modules/AuctionRebalanceModuleV1.sol:AuctionRebalanceModuleV1",
            "label": "rebalanceStartTime",
            "offset": 0,
            "slot": "1",
            "type": "t_uint256"
          },
          {
            "astId": 6959,
            "contract": "contracts/modules/AuctionRebalanceModuleV1.sol:AuctionRebalanceModuleV1",
            "label": "rebalanceDuration",
            "offset": 0,
            "slot": "2",
            "type": "t_uint256"
          },
          {
            "astId": 6961,
            "contract": "contracts/modules/AuctionRebalanceModuleV1.sol:AuctionRebalanceModuleV1",
            "label": "positionMultiplier",
            "offset": 0,
            "slot": "3",
            "type": "t_uint256"
          },
          {
            "astId": 6963,
            "contract": "contracts/modules/AuctionRebalanceModuleV1.sol:AuctionRebalanceModuleV1",
            "label": "raiseTargetPercentage",
            "offset": 0,
            "slot": "4",
            "type": "t_uint256"
          },
          {
            "astId": 6966,
            "contract": "contracts/modules/AuctionRebalanceModuleV1.sol:AuctionRebalanceModuleV1",
            "label": "rebalanceComponents",
            "offset": 0,
            "slot": "5",
            "type": "t_array(t_address)dyn_storage"
          }
        ],
        "numberOfBytes": "192"
      },
      "t_uint256": {
        "encoding": "inplace",
        "label": "uint256",
        "numberOfBytes": "32"
      }
    }
  }
}